business_id,date,review_id,stars,text,type,user_id,cool,useful,funny,bucket
TzImzfIWkZTnetKl2a4-SQ,2009-12-13,fjqsBbqqUXUEPZfdIiXrwg,3,"Chain restaurant that's just about okay for afternoon dining with friends. If I wasn't having beer at lunch I'd probably suggest eating someplace else. Food is good but in my experience their beer makes the meal. I've eaten here about half a dozen times during the past few years when in town for business weekends.

It is centrally located on the corner of Mill and Fifth Street in downtown Tempe, amongst quite a few other local restaurants. During my most recent visit I ordered a steak at lunch along with one of the seasonal brewed beers. Steak was okay but I wouldn't order it again. Beer was exceptional, so I wasn't unhappy overall.

I love burgers and I think I'll stick to that as my primary choice when eating here in the future. I can't think of any times when service was particularly unsatisfactory, nor were there times when service really stood out as exceptional. I have almost always eaten here on a Saturday afternoon, and it's typically been fairly busy during the lunch hour. Never had a problem getting a table, which is important since I'm usually heading back for an afternoon conference session.

I love the big glass beer mugs (not sure what size they are) but I can't always down the whole thing during a short lunch break (I'm a lightweight).

Overall, good place to eat if you're hungry and in the downtown area, but I wouldn't go out of my way to get here.",review,3miOUpoAr-NW7nGceQkYYg,0,0,0,1
cNGI_5GbfNFbZBMQZ-s-UQ,2012-06-11,S0_rymuRwcyOgJ3YdDLmoQ,5,Fresh and delicious.,review,Y66tK6ik9gP7AW9exNoRug,0,2,0,1
nXKwzVKJCtIGd4HxXgjdnQ,2012-06-24,sKxtwP9oYzDkgf0TqdLtdQ,4,"Love this place pretty decent sushi for a good price, I love that they have happy hour and reverse happy hour. They're even open till 2am for when I'm craving sushi for a midnight meal:)
Only reason I gave it 4stars is that the service is slow sometimes",review,19He-fV6qMeUHkaUgry51w,0,1,0,1
LRuIY8JFqadCSYLo242MGg,2012-04-05,3fVk0RlqxXrhtQ7EL71MVw,3,Pretty good deli sandwich but a hassle for parking. Love the selection of things to buy sorta like a little market in NY!,review,S5hUJTLbnCxidsR5IRsKzQ,0,0,0,1
1qrrdRh4cgMW-dm5kVNmdA,2010-12-30,EUWsGxLk7Lob6aCfdmmITQ,4,"At the ripe old age of 3, it's time for my previous review to take a siesta. Over the course of that three years, Tempe Camera's only gotten better. The selection's improved (finally finding a happy medium between film and digital), the prices are even better than they were, and I dare say service on the retail side's kickass too.

TCR is now my go-to photo supplier as a working pro. They've either got what I need or can quickly get it, they still know their stuff, and they support both local photographic education and the local photo industry. They're also the only dealer in the Valley that sells Think Thank Photo products, which are best damn professional camera bags ever.

And if you're an amateur, they've got plenty of friendly, knowledgeable staff for you too. Don't be afraid to ask for someone else; like almost anywhere, they employ people of varying personalities. There are sales staff I don't click with at TCR, but I wouldn't classify anyone as distinctly rude. (If you want that, you'll have to try B&H or Adorama.) If you need lots of hand-holding, the ASU crush probably means you'll either want to shop at off hours or go to Photomark--TCR tries, but the crowd to counter ratio just isn't favorable at peak times.

Repairs are still something they do very well at excellent prices. When I've had equipment serviced, it's been turned around quickly, relatively inexpensively, and works like brand new. Evaluation of your equipment is still free, as it should ideally be at every repair shop (but often isn't).

The lab's added a bunch of cool new services, including damn fine plexi mounting, and is doing a considerably better job with film than their old reputation for free scratches with purchase would suggest. Hundreds of frames processed with nary a scratch to be found.

Rentals I'm a little more ambivalent about.  They've thinned the herd out considerably (about half the rentals inventory has taken up residence in the used equipment case) and the selection of lighting equipment is basically unchanged, but they've got the latest Canon and Nikon bodies, and everything's well-maintained and in good shape. Rates are good for what they do have--the question's just if they have what you want.",review,HWi8ntFMy81BVjAsgAwbrQ,1,3,1,1
N_6bV3c3JagKW7sD3X9ldA,2010-08-14,_ya44j3weaEcU8z21jeRNw,4,"The bad: the bar closes at 10pm.  It seems like the western, country, wagon-wheel themed bar that you'd like to close down one night while playing some good tunes on the juke box and eating peanuts.  And also the french fries, file those under bad.

The good: the hamburgers are pretty much delicious.  Definitely go for guacamole, and add whatever you want from the topping wagon.

I didn't try one myself, but I hear the cookies are good.",review,BiDA7uVJ5igMCsp4ZfpCpQ,0,0,0,1
xWKtOLuIOVGZprcpGiqpQA,2010-08-07,X7EsMHroYo_bH3kD6OYhxQ,2,"I went because several people I know raved about the place, because I'm a lapsed vegetarian and I'm always trying to get back on track and heard the veggie sandwiches were incredible, and because I'm a malt freak and found out they have malteds there.

I was disappointed. And my friend I was with who had been one of Stickler's die-hard fans said that, although it was okay this time, the place seems to have gone down hill.

Stickler's wasn't busy at all, maybe 4 tables of customers and 3 people in line, but although there were alot of workers behind the counter, the service was very slow. We had to wait a long time for our veggie sandwiches. Now my friend has been there when it was jam-packed and she said the service then was much quicker. We went about 2 so maybe the staff was worn out from the lunch rush earlier.

The bread was good, crunchy on the outside and soft inside but the vegetarian sandwich itself was boring. It's supposed to have Swiss, Provolone and American cheese on it. I couldn't even taste the Swiss or Provolone at all, the American over powered the sandwich and was more like a cheez-whiz type.

I'm always on the look out for a good malt, one that really tastes like a malt and not a shake. My chocolate malt tasted more like a shake and I wasn't impressed with the ice cream. My buddy liked her vanilla malt though.

The one thing I did like about Stickler's is that they have the small bags of Miss Vickie's chips to buy. It used to be you could buy big bags in the grocery stores but now the chips,which are the best kettle chips I've ever had, are just carried in certain deli and sandwich shops.",review,FzaOGf0SuHRPrk7huJZbcA,0,1,0,1
DUDr1kuGv6eh1_s2GWJVgw,2012-09-13,2s0Es6Y6EYtCAHCA8oCn6g,5,"Potbelly, you have been handed the torch.

It was a good ride Jimmy Johns, but you have no locations close to my newly purchased home.  Its not you, its me.  I promise.

I love italian-style subs.  The Wreck at Potbelly is fantastic.  The Wreck salad is also great (for a salad).  

This place is my new go to sub shack.",review,9UNGbiE9k0fvMpCMJp0Gww,2,4,4,1
eIxSLxzIlfExI6vgAbn2JA,2011-01-08,UEjPFR1a0cOvXYgn_qkB_g,5,"No question -- my FAVORITE burger in the valley!

I first got turned on to Lobbys at a Yelp Office Hours -- http://www.yelp.com/biz/september-office-hours-at-lobbys-tempe#hrid:kQOElzgklMRbAyWS8LhVFw - - and by my check-ins, you can see i've frequented there since. 

I've tried a lot of other ""great"" burgers -- 5 Guys, Smashburger, etc - but IMHO, none of them stack up to the food and the experience at Lobbys. 

The burgers at Lobbys are so good that I crave them --I want to drive across town or plan out my day so that I'm in the area to get one! I just feel that there's more quality ingredients with a Lobbys burger -- the bun, the taste, the way the cheese melts over the whole patty, the special sauce, and the burger itself. 

And just as Lynn W says the service is truly superior here and "" He (Lobby) really cares about his business and it shows"". 

I've recommended many friends to check out Lobbys and have brought a few friends here -- everyone has loved it! Especially my Chicago friends that live in the valley. 

Lobbys burgers is that raised bar that I measure all other burger joints to.",review,vn3lecMsL3kXVe-7hg3gLg,4,9,4,1
St3jS0PnF1lulH1ggA4Jgw,2010-09-10,tHHLBvbNg1SM3_VVTLvZFQ,3,"Luci's is a good neighborhood spot to buy your health foods, drop in for a coffee or fresh made baked good, or pick up some beer or frozen meat on the way home.  I agree with Pamela's sentiment about it being a marriage of TJ's and Hi-Health with AJ's prices. 

I've had a couple of bad cups of coffee here, but in the 10-12 times I've been they have always been very nice and have remedied any problem very quickly. If it wasn't on my route, I may not stop here much though. Trader Joe's and Hi-Health are right next door to each other at 20/Camelback and you can save a ton of money if you do it that way!",review,JgDkCER12uiv4lbpmkZ9VA,0,0,0,1
mQfT3JYu18HN22DVylcE7A,2012-08-19,lDX0_aWKJ-0MGazcusrYmA,4,Charming cafe and it doesn't matter what you order. Breakfast - Lunch - you can't miss.,review,HUjxOju8G9eB-h4RejLhTg,0,0,0,1
MLAnvEcvDfOWELHUN_0xEw,2012-05-17,LMBgdKmFUBWS5ogvS05jqA,1,"This place needs to close their doors, get their act together, and then reopen. The atmosphere is boring and it is obvious that they did the bare minimum coverup from the last restaurant. The food is horribly boring and has no flavor. I ordered the chicken and avocado pizza and it literally tasted like nothing! We also got the nachos (which was actually just a plate of chips with one tiny pinch of cheese and soggy beef). In addition, the server didn't put in my order for my pizza, hardly apologized and then brought it to me 30 minutes after my friends were done eating. One of my friends ordered the ahi tuna and it was switched with someone else's special order so that had to go back to the kitchen and be reordered as well. The only thing I liked was the beer, and that too took forever and I had to remind my server several times to get me a refill. Way to much effort to get food and drink that is sub par at best.",review,OEIoHR0ERrCqshpQ8qoV1w,0,2,0,1
umdxfhSlk67yGEi8-S-bEg,2012-05-01,B06qRnmRlZZFA6VWm1_B7Q,4,"Sometimes you just gotta have a burger.  I was in the Scottsdale Rd/Grayhawk area and noticed this place where Nick's used to be.  I tasted their burger at the Scottsdale Culinary Festival's Burger Battle and thought it was really good.

The CB&CB burger with tater tots really hit the spot for lunch.  The burger and carmelized onions worked together really well.  The tater tots were delicious.

Overall it was a satisfying meal and I'll be back soon.",review,Kqvfep2mxS10S50FbVDi4Q,1,2,0,1
lKQ5hnkSQ-XP80jNCH46nQ,2011-12-19,KWQrjg_Ty2C4unwKx-Ly2g,5,"Recently I had the pleasure of eating at this great new Iron Chef Jose Garces restaurant. Pulling up to the front entrance to the restaurant my girlfriend and I were greeted by extremely nice doorman who valet our vehicle for us. We were a bit concerned that we were going to get wet from the rain on this day, but thanks to the valet service the hotel & restaurant provide we stayed warm and dry! Now I must say we were taken back from the decor inside the restaurant... It was spectacular!! The way the restaurant is decorated just puts a smile on your face! Also, it gives you a feel for Iron Chef Jose Garces personality which seems to be light and fun. The food is absolutely amazing!! We split the ""IGNACIO"" Nachos which have black beans, tomato, queso mixto, jalapeo, chile de arbol, and radish, and the Barbbacoa ""Costillas"" berkshire pork spare ribs, chipotle-cider mustard bbq they were tender, juicy, and delicious! We tried the House Margarita the ""Distrito"" and the white ""Mexican Sangria"" both were spectacular!! I have never heard of a white sangria before.. But WOW it was amazing! All of the employees we encountered were extremely nice, knowledgeable, and sincere. This restaurant will definitely stay on my regular to do list! Thanks to everyone who gave us a wonderful experience!!!",review,uTEhgjhxFtIYI2ufdDD3NQ,0,0,0,1
Eeonj15SXvfR6kgvh8BOWw,2011-04-04,5XTqH2H2bZE7dOSuDJiQ3A,4,"Had lunch here with 6 coworkers and the server accomodated 5 seperate checks with no fuss. She quickly brought out two baskets of soft warm bread that looked handmade, along with pouring out balsamic vinegar and light olive oil for dipping.

The server described the day's special, but we all ended up ordering eight inch pizzas (a lunch only size.) I had bacon and chose to have it cooked in the optional brick oven for $1 extra (not sure why they offer it seperately, but exp. at other places made me like the way it cooks better than reg. oven.)

It wasn't much to go on, but the food was good, the service friendly and efficient, and the everything was clean and neat. Recommended if you're in the area.",review,0n2jq7LIPQOzs74kPLCDng,0,0,0,1
fhe6HAP9_IAMDyH8OEEIwg,2012-03-14,IaG7bMOPppuiojRXnvVzTA,2,"I was excited about the concept of a haircut and a beer.  So, when I saw an offer from Livingsocial I purchased three coupons.  Here's the trouble... I went on a Tuesday night at 6:30pm and was told they will not honor the coupon until 7pm.  However, I was told if I wanted to pay for a cut at the standard rate, they would take me ASAP.  Nobody was in the joint and they refused to take my Livingsocial coupon until after 7pm.",review,LzT8mSfliJHhs68RTwQW5w,0,0,0,1
OmxAvtMyIvCVm16NFIOOUA,2011-07-06,a_V9wwlIeoD6VvJ9eYtwQQ,4,"Fast service, attentive waiter, food cooked as I ordered, clean restrooms...What more could I ask for? I was on my way to a meeting at the Marriott so I stopped in to grab lunch beforehand. I was in an out in less than 45 minutes. Perfect.

I'll be back the next time I am at the Desert Ridge mall looking for a place to grab a quickbite to eat without ordering fast food.",review,Q6FaSZpCtVv7PXECwDL1bg,1,1,0,1
IXB3PGgSmw4bjTe9ll-tQw,2011-03-09,ljqWjeQK4Oxo04K7sWbBRQ,3,This place is your standard hole in the wall pho. They've got good tasting pho and spring rolls for cheap. :D The cleanliness is definitely lacking but more flavor fo' yo' noodlee!,review,iKDDbFu1lyA8-CVlGLFHcw,0,0,0,1
68euKezXqyvsE49cIGdL2A,2012-04-18,LrWCKKhPE15xO-j7_NWPew,2,"This place used to be really good, but it just is not the same. The price is now the same as a sit down Mexican restaurant with real plates, and the food is microwaved and served like a fast food place. The things that are deep fried are greasy, and the things that are microwaved are tough. The prices just don't fit anymore, and that might be the location, and landlord problems. I miss the old day's  There is no way Maria Munoz would ever consider the way the food is made today. The food, while it is still good, is over priced and microwaved. Real sad, and the amount of people going there is in decline.",review,8leoUQELdWao6zLgRlAt3A,0,3,0,1
I7cItiwL8NOPM45ipSf1QA,2012-02-24,8f1qXD2WIWL4c8l9y_U9dg,2,"Ok here is the deal, I am sad to only give ground control 2 stars because it should be way better. This is in walking distance to my house and I come here almost every day. I have coffee, muffins, salads,and so on.
The coffee is usually good, the muffin was great, the salad was so so bad, and the service is kinda strange. 
   Its a small area you would expect this place to be really friendly and helpful, not the case. They usually are busy talking to the other workers or have some small project going on, never are they happy you are there its almost like they are bothered by you. the salad i had there was really bad, the lettuce was wilted and slathered in dressing, I sent it back and it looks like the ""chef"" just put it on a new plate with a little fresher lettuce and a lot more dressing. wasted my $7.00 bucks. Please Please Please Ground Control get your act together so I can give you more stars.",review,CyRKjjsDl6a56vyr7lS1YQ,0,1,0,1
PjBeWzCOCveiPuF-xqUaoQ,2012-04-07,oi8YMJNkAFvMyIRhuy7qeg,2,For my hubby and I on a Saturday night Grimaldi's turned out to be pretty lame. The restaurant is decorated well and the hostess was friendly enough but the actual pizza was SOOOOO BORING. I seriously took a bite and wondered if I had missed the slice altogether. I will say I tasted a lot of garlic but that doesn't count for much when the pepporoni is bland and the sauce is useless. Now I'm a deep-dish girl at heart but I've had AMAZING thin slice at Classic Italian Pizza in Tempe. This place made me feel like I wasted my money and I woudn't ever want to bring anyone here including myself again!,review,gsyguOgT2Dnjw-OYw14XDw,1,3,1,1
cqIHyZ3Q0D4vBi-vb4mi-g,2008-02-16,KeoQ3YfRQjRxBH0tj0n_yw,5,"Do you like trendy shit-music and half dressed plastic surgery queens gyrating all around you, while you pay twelve dollars for your appletini? If your answer is yes, don't bother coming here. 

Dive bars are plentiful in Phoenix, but the Bikini is in my 'hood. It's a dirty, unassuming place, with a couple of no-nonsense bartenders and a good jukebox. 

There are a couple of rules to follow when visiting the Bikini: 

1. Bring cash. Cards aren't accepted, the atm machine is there for decoration only, as it hasn't worked in at least two years. 

2. Don't make fun of the guy in the overalls and farmer hat. He's my neighbor. 

3. Don't piss off the bartenders. Tip them well, treat them nicely, and don't order more than three dirty martinis. If you are nice to them, they will be nice to you. This includes, but is not limited to: the strength of your drinks, the price of your drinks, and whether or not you get a drink at all. They take no shit. 

If you can't handle it, stay away. The place gets crowded enough as it is.",review,N7lSh49zQ13sG3Jpa9E6cw,2,2,3,1
ar90fbRbQtiyZLtwjwwXUg,2011-05-18,jIoRhEZ8Bogj-skNLVtnZw,5,"It's just a terrific steakhouse.  One of the most upscale, all around dining experiences in Phoenix. 

It's expensive.  Very expensive.  But probably worth it.  Figure $150-200 for a couple.

I had the double filet medallion with blue cheese melted and a wine demiglaze.  Absolutely outstanding, amazingly tasty meats.  Equal or better than Morton's or Ruth's Chris or Capitol Grill (that's on the menu for tomorrow night).  Smashed potatoes were very good but nothing to write home about.  Veggies were pretty good.

Started with the ceasar salary, with a big pile of anchovies.  Perhaps the best Caesar I've ever had.

Desert was the mouse cake.  Good, but not to die for.

Their happy hour is also an excellent value.  Come before six and drinks are half off, and they serve little mini steak sandwhiches, which are very good.

Hint:  If you have kids, go to happy hour and have a drink or two.  Cocktails are in the $7 range happy hour price.  Cucumber cooler was quite nice for a cocktail.  Let the kids eat the sandwiches, and then head to the dining room for a couple of filets.  The kids are pretty full, you are nicely primed for a great steak, and the complete lack of a kids menu doesn't matter.  

Honestly, otherwise, there really aren't any good kids options.  I know, it's not a great place for kids, even well behaved, but sometimes you want to celebrate a special occasion with family.  

It would be nice if they offered a mini-filet for 12 and under for like $15, or a burger and fries for $10 for the kids.  Just a thought.

Anyway, great experience, great food.  A really upscale, while linen, old style steakhouse kind of place to have prime beef.",review,jvwnIG5wEjdOsqkYJgN29A,0,2,0,1
N9iPqBRI47bewLAeKBlkIg,2008-11-23,j01IrAml7fGI4CORTM_qpQ,4,"I actually love the Waterfront Grill. I have never been there during bar hours, so it might not be a good later in the evening, but I usually go around 5-7 for dinner and the food has always been excellent. I usually get the buffalo chicken wrap, but sometimes I go with the fish tacos. Both are excellent and the service is great (because usually my and my friend are the only ones in there - I often wonders how it stays open). The cookie desert is awesome! It is like the Piezooki and Oregano's. Just as good.",review,zCC6huLkNBEr3JUgQyxJbg,0,1,0,1
F3SEkW6v2LJ5y6Ldo5pPaw,2009-03-01,jLxo_UgnGfKHSPK7gGa5LA,4,"This has always been our favorite local Chinese take out - and especially on Chinese New Year, the special menu.  OMG its good.  We always call for takeout, one or two items and we are so close that by the time I get in the car and drive there, its done...less than five minutes.  

This place gets very busy, and if you get a chance, try out their Peking Duck, Hong Kong style.  Soooo delicious!

Another favorite is the snow pea leaves (not on the menu!!!  cost extra), and the Seafood Bean Curd Soup.  I love the soup here, so many delicious morsels, you can't go wrong with it ever.",review,LT3L8-tthzD0IakgXm81pw,0,1,0,1
KV-yJLmlODfUG1Mkds6kYw,2008-06-29,cns5AxuPI8FzxtzNKN6CNA,4,"Went here for dinner tonight.  Service was great.  They still bring out the plate of pickles, but now they also brought slices of challah bread and rolls (the onion one is awesome).

I had the Vegetarian Delight Sandwich.  Very tasty.  The vegetable cream cheese on the sandwich was excellent.  Huge portions.  The tomato soup was good as well, but not as good as the soup at Bravi.

I tasted some of the onion strings.  Delicious.  They had a dipping sauce that was a bit spicy.  It was good too.

My husband got Aaron's Choice - some kind of pastrami/corned beef sandwich.  He liked it, but prefers Miracle Mile.  

Overall a good dining experience, and I got some bagels to go!",review,LN4cXKGPaGMDHm4nP9Idtg,1,2,0,1
zDfs1Kyk8orFF8bRnSPx-A,2013-01-04,F7VG9EWMQJtnFlCloVf2RA,4,"The building itself has that Frank Lloyd Wright 70s vibe going on...not my taste, but our City isn't very old so I can live with this minor aesthetic annoyance.  (Remember when they almost tore the Orpheum down? Not cool. Fight to keep history here folks...)

Anyway, anytime I hear people begrudgingly ask ""What is there to do in Phoenix?""  I would have to suggest: We do have culture here, if you're willing to venture outside of your comfort zone and outside of the suburbs. 

Phoenix is privileged enough to have an Opera Company and Ballet Company who are great at what they do. I saw the Nutcracker most recently and GOODNESS, they all had impressive resumes.  The conductor, and costume designer were definitely stand outs.  

As audience members we are supremely lucky because the venue itself is small enough to ensure you will have a fantastic seat no matter where you are.

I will go back. I can't wait to go back. My soul craves this, as should yours.",review,oKzkyfGalJC3-BOeLLCcIw,1,1,1,1
52QtjHlHoa7V611bOvv1aw,2009-03-09,wBNgwzIHJRE_P6nGZ50nMg,5,"We showed up out of the blue on Valentine's night looking for food. We got a seat at the sushi bar right away, but the place was otherwise packed. I guess we were lucky. We passed on the V-day prix-fixe menu and decided to order as we ate.

Our waitress was visibly perturbed by my wife's order of tap water to drink and vegetable tempura to start. Judging by her expression, she took us for deadbeats; it wasn't offensive but hilarious, we're old enough to be confident in our own opinions of ourselves. Anyway, the vibe at the W was definitely people trying hard to be cool and of-the-moment.

In any event, we struck up a conversation with the chef behind the bar where we were sitting. We initially ordered some basic sashimi dishes, but when I asked the chef for suggestions, he started rattling off a series of custom creations he could make. So we let him do his best, and he turned out a great collection of sashimi dishes, none, at least as far as I could tell, on the menu. 

We had a great meal, and we would definitely return, at least if we didn't live in San Diego.

(The waitress eventually warmed up, probably thawing as she watched us eat through plate after plate of sashimi....)",review,oSzxMYgem8Oi3f9wfoS_cA,1,1,0,1
won3i4Cpc4M8YnbWBHHUqw,2011-03-23,1twmYoqVmZUky9X2in-43A,4,"Used a Groupon here, and it was a great experience! The express mani/pedi wasn't express at all - they took their time with me, and everything felt great!

The woman who did my pedicure was fantastic. My toes and feet look wonderful!

The woman who did my manicure was pretty good. The only issue is that she accidentally cut my thumb. When it bled a little, she just painted over it. It's now been a few days, and my thumb still hurts. 

Overall, it was a good experience though, and the staff was very friendly! I would return for sure.",review,xFG4Ca2HHmbxDTkMlmHnjQ,0,1,0,1
EExUrv6rX1ajgayj8oP7yg,2012-07-19,ZZT9NNxZziCjSJTVuWo_7Q,5,"If you want a deal for your buck, this is the place to go! You'll find Dewalt, Makita, Oster, Cuisinart, Farberware, Keurig, and many other banded items for a fraction of the original retail price. Yes, some items will be out the package, missing a manual, or may have a scratch or a dent but I rather pay a fraction of the price versus paying full retail at a department store. I rather save money and get a ridiculous deal for the same exact item I would have paid 10X more at a well organized and clean shop. From what I know this store has been open for nearly ten years; the owners are one of the nicest people I've met; they even offer free delivery with the furniture or any other large item you purchase. Stop by!! You'll get a kick from just walking down the unorganized, messy aisles; but once you get to the register to pay- you'll be happy!! ""Get more for less!""",review,00WpjbkLkxLhjd3oHUU7ag,0,0,0,1
