business_id,date,review_id,stars,text,type,user_id,cool,useful,funny,bucket
R2FuwuSjmyvzNWNfqzKUvw,2012-06-10,Lja31nq6KERYwYUi9f8a0A,4,"If you got a craving for pizza and don't want to feel too guilty about eating it, this always seems to satiate that fix. The pizzas here are ultra thin and there are many varieties available. Bryan and I always get 2 pizzas because we would still be hungry if we just order one without an appetizer and we can always take the extra home. Today we ate the pepperoni and mushroom pizza and the potato and feta cheese pizza with olive tempanade. Both were yummy in their own way! We ate the tomato, mozzarella, and pesto bruschetta as an appetizer which came out unbelievably quick while waiting for our pizzas. Sauce's pizzas are unique in their own right that I crave when I want something lighter than regular hand tossed pizzas yet don't want to spend as much for gourmet pizzas. It's a comfortable yet yummy in-between compromise!",review,HR_Lxh2ycv0t745Ohiziew,0,2,0,0
xHI3saK0sAJEHeMK4IGVvg,2010-08-25,cDnoAoysSDEiSwyswOAbDA,5,"Just had my first hot dog at Short Leash Dogs and quite honestly, I can't call it a ""hot dog"" because that just conjures up images of, well... a hot dog. And Short Leash Dogs are so much more and better than ""a hot dog"" the way most people know hot dogs. Know what I mean? No? Well, go have a Short Leash Dog. 

Really unique combinations, various dog options (all local meats and produce) - bratwurst, beer hot, veggie... 

My friend and I shared an Aiko (we chose the brat as our dog), with mango chutney, red onions, cilantro, mayo and jalapeño on a naan (you might have read that in other reviews, no traditional buns here!). 

You can find the Short Leash Dogs truck at the Phoenix Public Market on Wednesday evenings and Saturday mornings, and if you follow them on Twitter (@shortleashdogs) you can find out when/where else they make regular stops... scottsdale, central phoenix... Track 'em down and eat their food. And talk to them - Brad and Kat are smart enthusiastic folks with a great sense of humor and offer superb food and service! What's not to love?",review,KICFDhBX25ruK_iW6gLgTA,1,1,1,0
MJBkq0blIF7qbbxn4AJTzA,2009-09-24,xzDqK4ejkJHItZxETcFzzQ,5,"I love the Tempe Library. The Culture Pass is a great program, the audiobook selection is good, and the seemingly unlimited resources are wonderful.",review,SVw1pW_7t0YmnvyAEOovoA,0,0,0,0
WM8sy8FjrU3PpxN_NI02ZA,2012-01-08,m7Mj9f6ncn0lfZ43yfCLgQ,2,"To even admit to serving tex-mex is the first clue about how bad the food is there.  And whoever that nit wit was that said Arizona has bad Mexican obviously knows nothing about Good Mex food.  Ill admit right from the start that I don't want authentic Mex. food.  Go on down to Nogales and get some authentic Mex. food Ha!  What I want is authentic valley of the sun sonoran style Mex. food the way its evolved for a hundred years from the early Mexican Legal Immigrants.  Ihave been all over the USA and true you can get some decent mex food in cal, new mex., west texas.  But to get the best Beans, enchiladas, red, green, chile, tamales tortillas you have to get it right here in AZ.  Here are a few great places.  Don Joses, Matador, Carolinas. Manuels, Some Burro, Juans, Ajo Als, Macayos.  The two best are Ricardos and Papagayos, oops,  They closed because the new management wrecked the food and drove away the faithful.  And thats THE TRUTH, from ""The Truth"" Ciau!",review,KD2t6YxMPCdwtCpHt-HT8w,0,0,0,0
qcylQLL-fXdFHrdXC2jZFw,2011-04-15,ujtHr8BSjWAn-itkm_CfcQ,3,"I loved the old menu, but the changes gave me a change of heart. They had the best sandwiches & it was always quiet from 5 until 8 so you could sit & eat. The new menu is okay & we liked what we got, but we would've left if it wasn't happy hour. Even though the servings are big(maybe too big) the prices are retarded now. The buffalo chicken tenders were pretty good, but perhaps too spicy in the wrong way. I used to go & send people all the time, but without those yummy sandwiches & with the higher prices, we prolly won't make it back again. The servers usually are slow & fairly unattentive, but the menu was bringing us back.   :(    sad to see it change that way.",review,LoSifdxmrOj-a8xcDrRJDw,0,1,0,0
rRaiIoDbmPt1NzFxL_1vsA,2011-11-06,pJvIn--GYx2WT5JIRflksw,4,"The food is really good. I can recommend like 5 dishes that anyone would like. If not, try the soup and salad bar. My favorite dish is the Chesapeake Catch, but their Ultimate Chicken Sandwich and California Club Quesadilla are amazing also. The staff works well together and the managers know the value of loyal customers. The GM was GM of the Year before and he wants to make sure every customer who leaves is happy. The kitchen staff is also great.  Keep up the good work!",review,H_JsAwjiGEOr_RlZmwfNsA,0,0,0,0
cgNIBHS2mLdbTRiodAT6EQ,2009-07-29,Cobm9lynyhhFIo3ACeXdrw,4,"Good food, good service, good price, shitty location.

I had the carne asada plate which came with guac, beans, and corn tortillas.  The tortillas were amazing, the carne asada was above average, as were the beans.  Unfortunately, as good as it was, it's still Mexican food.  Not that I have anything against Mexican food, it just, for the most part, all tastes similar.  Nothing really stood out as AMAZING.  If I'm in the area (god forbid), I'll def. eat there again, but I'm not going to drive from the E. Valley to go here.  Bonus points for having 7-Up in a bottle, made with sugar.",review,waD2euOMPTnTzQ0thq3H6Q,5,6,4,0
oxsCvEkQNNIbOPDt_QK_0A,2006-08-23,uQGpCZ7D5NgFbYDzWXzYaw,3,"If you're heading to a show at the Scottsdale Center For The Performing Arts, this is your best convenient bet for dinner (if you like Indian food).  It's average but can probably satisfy your curry craving.",review,y4JCKsEm0KlwtmHpZhbA4A,1,2,0,0
NM2j6Y5NEyAseOi2sKzwGg,2012-09-19,yyWWvQcm1xi3HjMFtlM7HQ,3,"If you go prepared and early, you can be in and out within an hour. If your not 100% sure what you need, go online and check BEFORE you go. Save yourself the time and hassle of making that second trip. Not bad overall.",review,pQ6ij6cOBRB3yJGHbVZHUQ,0,0,0,0
hGQsnkndreW7b26XC2HVRA,2010-10-31,-8UWqon-jBdys6wMRsh8vA,4,"In my opinion, Zipps is the king of the local sports bars.  They've got decent bar food, great beer specials on Sundays, and I've always had attentive, friendly service.  What more do you want?",review,3TGup17SCV6uHsifmTKirg,0,1,0,0
zOCdVUKUN3b-obT67Qjyww,2012-09-03,X4cEQgYfVUF96fheEgzSDQ,5,"This place makes me want to learn German every time i go.

I would get my Polka clothes out any day of the week.

Great food, great prices, great atmosphere.

The fall months are great to sit outside and enjoy the weather to a Brat sampler.  LOVE IT!",review,N4h_3ZR-7slX_BeaokL7kg,0,1,0,0
3398Ccw-mUHbzYcIToDi6g,2007-09-07,mQRd9mdpBCEjzIPe_c4k-w,5,"I am proud to say that I sent Kristin S. here for her awesome hair transformation (8 inches is a lot, girl!) I just had my second hair cut here today, and I was just as happy this time as I was the first time around. First of all, the service is top notch - they take care of you quickly, kindly and enthusiastically. They are not snobby, which is a welcome relief when living in Scottsdale. I have always felt welcome and comfortable here. 

Moreover, the prices are amazing! I have very easy and basic hair, and they charge me $45 for a hair cut - if you want to spend more, you certainly can, but I am fine with the ""stylist"" level (who charges $45). In Tampa I paid more like $65, but I much prefer Par Exsalonce. This place is a well oiled machine, and they know how to run a salon. They carry B&B products, which are fun every once in a while.

I really love this place and will not look for another hair place in the Valley. This place knows how to treat customers, style hair and create a pleasant experience. The Market Street location is a bonus, too, because you can even do some damage shopping when you bounce out with your new 'do.",review,9FbgqZ5u9WTLAs28nNafIQ,0,0,0,0
ML1RJdeZ7bbfMrHvJ7m99A,2012-10-29,4i4kjVnODPRRFacN5wNqHg,5,"Back when I lived in Phoenix this was one of the only places I bothered with eating at. Started by a Chicagoan who moved to Phoenix, they get deep dish right and make just about everything else in the style of delicious. I was in town last week to hike the Grand Canyon and stopped in. Man, I miss their food. Thank God I live in Chicago and can get something similar! Be warned though. Their food is BIG.",review,3iuZFgxUFKLxOplkDrFmyg,1,1,0,0
jGldmslgIegQNM5kvb851Q,2011-06-24,eUm7AAXNuBtYqGIqvEGBpQ,5,"My husband and I eat out a lot and we had the best dining experience ever the other night! We sat at the bar with the bartender AJ and he was such a delight! We had happy hour which was probably the best deal in town! 5 dollar glasses of wine and half priced appetizers!?! My favorite was the steamed mussels. We loved it so much we also had dinner. The classic pasta deal was the best. Getting to take one home gives you at least two more meals, the next day. It's hard in this economy to get more bang for your buck but Maggianos they are doing it right! We will defiantly be back for more!",review,OWeLkbeU0Gq3zamP-SjtfA,1,1,0,0
AeoJkr_dlNshB078OepP8w,2010-03-02,FubrebQ3LpIG9UFBC7DtFg,3,"The best example North Scottsdale has of traditional Phoenix sonoran mexican food.  Los Olivos restaurants have been around forever - at least since the '60's.  The food is great if not fancy, and the place is pretty free of gimmicks.  You can get your fix of cheese crisps (aka quesadillas for you CA transplants), deep fried tacos, chimichangas, combination plates with so much sauce and cheese you can't tell what's underneath but it all works together to taste so good.  Los Olivos still plops down the free chips and salsa right when you sit down so you're good an full when that combo plate comes and glad for it.  The atmosphere is more like a nice mexican diner than mexican cantina and service is solid. They often have mariachis playing on weekend nights.  Margaritas aren't great, but the beer is cold.  Don't bother with dessert.  Cheap eats for all the food, especially since you won't be hungry for another 24 hours.  If you're in North Scottsdale and in the mood for traditional Phoenix style mexican food, Los Olivos is a great choice.",review,FktbKOzznpoKTNXMVtc8EA,1,1,0,0
KTF-E3NfkJy2wiwcgOPyVQ,2012-12-26,j2G9iV9c8uBC0Y5I6ykhvw,4,"Great place for all your favorite kinds of Asian food.  Wonderful service...it's a big place and they were busy, but since someone in our group was in a hurry to get to a flight they still managed to hurry things along.  Overall good food and huge portions.  The Happy Hour specials are great, too, so be sure to come during that time.",review,rotKO3R8h23YbiLFaZ-BLg,0,0,0,0
JokKtdXU7zXHcr20Lrk29A,2009-03-04,aYjwrhDseptZ6lF0KmNVvg,5,"Great beer, Good atmosphere, Non annoying music and great wait staff make this my favorite place to spend an evening.",review,JDVbRaxrjJaLX75UQ8Q3Ng,0,0,0,0
WNy1uzcmm_UHmTyR--o5IA,2011-01-19,ejs2WFrw9-lBWAGlpvKP3w,5,"I've eaten here twice, and both times enjoyed myself immensely.

  First, note that this is the smaller location; the one in Mesa has more tables and space. This one is closer to me, so this is the one I go to, but if you are looking to have a large group, you may wish to go to the Mesa location.

   That said, I really like this one. The mood is very raw, because of the small size, even at a table you can see the cooks behind the bar, hear the clatter and clang of the kitchen. That said, you can still have conversations here without issue; you just have a bit of background noise.

   The food, though...the food is spectacular. Seriously, look at that menu, look at those pictures. The first time I was there I had the chicken tikka masala pasty. Not as good chicken tikka as a straight up Indian restaurant, of course, but still phenomenal, and the pasty just made it that much better. I also snagged the bananoffee pie. It could easily provide dessert for two people; I ate the whole thing. It was just that good. Not too sweet, very banana-y...

   Eat here. It's really that simple. 

   Also, as a tip, there's a parking lot 'round the back that is usually not full, unlike the one on the front. And, though the address is off of University Drive, the front is really facing Hardy. Threw me a bit the first time I was looking for it.",review,mB7533hZM30GIULkWFBfhQ,0,2,0,0
UmhTiNOKareQDP7D9aAnKw,2012-03-17,kbZaFBKI7GxW1ft1aJS1nA,4,"Like the other reviewers have said the service is really not that great.  Luckily they're saved the  really good food that they have.  We ordered so much food that our little two top table  couldn't possibly handle it all.  The mussels  might have been the best I've ever had. We also shared a Frito misto, which is really good except they're pretty chintzy with the shrimp they only gave us too.  The pastas were clearly handmade which appreciate and they're quite good. The owner came over to check on us a couple times which I appreciated.  I'm definitely coming back soon.",review,wfvmwhhadHfpM9UoTV0OMA,0,0,0,0
U605aUo9MJn5vgLfP3yYKg,2010-08-12,RueAtv9IGLLPoOtTyB4odA,5,"I've gone back a few times since my last review. Every single experience has been fantastic! The burgers are pretty good, BUT do yourself a favor and get the pork tenderloin OMFG!!! Sooooo freaken amazing! 

Also their onion rings are pretty much perfect! 

And the fried cheese curd...just get it! I was a little creeped out eating something called cheese curd, but holy deliciousness!",review,6ts41fCsDKHbFZaKOMNmVQ,1,3,0,0
iJo2rZOjhWevF-OXP-FQgQ,2012-12-31,lgg_dZFZuvV7zcHyw-GT5Q,2,"$8.17 poorer after getting two dry cupcakes with hard frosting. Not sure if this is because I had refrigerated them for a short while until I finished my dinner, but I don't think frosting should make an audible, snapping sound when I sink my teeth into a cupcake. The quality of my cupcakes was comparable to baked goods purchased at regular grocery stores. Very disappointed. I wish the cupcakes reflected the charm and appeal of the storefront and its employees - the young lady behind the counter was very nice and helpful.",review,0O8zLqElJsR9yOmvcMsInA,0,0,0,0
un3KC2gyMrSG6yqjVRctXg,2012-07-13,mWHdv5Y4Fc51kl7gwoidzg,5,"Loooove this place! Yes it's pricey, but good sushi usually is. The guys making the rolls were friendly. The atmosphere is nice. Hubby absolutely loved the quail eggs and I couldn't get enough of the spicy shrimp roll. Seriously, try it. You won't be disappointed!",review,Zz-lHlp5gJdPg3LgFRRrRQ,0,2,0,0
6imLt53br7SJ3av07jjH7w,2009-03-03,qX7PnzPkPt7Zg8be_sq-hA,2,"I don't know of a single Phoenician who wasn't absolutely ecstatic about Hanny's opening.  We were all excited for this cool new ""destination.""  The husband and I were the second pair of people to walk through their doors.  There were literally hoards of employees working at the time.  There were about 15 upstairs staring at us, about 5 at the bar, and 15 or so more servers just chillin around the restaurant.  Somehow, with all these people, they managed to completely ignore us for most of our meal.  Making a typical 45 minute to 1 hour dinner experience turn into a 2 hour ordeal.

The decor of this place is beautiful.  Cool, clean, and modern.  The music fluctuates from being too loud and inappropriate for the setting to being perfect with an eclectic but well blended mix. 

The pizza is decent, but very appetizer-ish.  It is cracker thin, which turns a lot of people off, but I actually like it.  The onion strings are to die for when they aren't completely grease laden.  That's an off and on thing, not really consistent.  I don't like their sandwiches.  They are unimaginative and bland.  There really isn't a lot to choose from on the menu.

Unfortunately both times we brought friends along with us, the place was a buzz kill, and I am not really sure why.  Maybe we will try the place again now that it has been open for a while.  Hopefully Hanny's has figured out what he wants to be when he grows up.",review,W_QXYA7A0IhMrvbckz7eVg,2,4,2,0
UKgSs_SJzW9fu4CwhIV1yA,2010-06-13,eig_QEv_BZcBlijoOnCCqw,4,"I lived in Phx for 7 years and never heard about this place, but having to come back for a friend's baby shower, I needed to find a good hotel. This place was surprisingly awesome, considering it's right next to Old Town. 

Walking up to the rooms part from the outside/back is not very impressive, they kind of look kind of like converted apartments. But inside is contemporary looking, little older, but still nice. The landscaping is awesome. 
Beds are really comfy, the kind you sink into. Which is a huge plus for me, since i'm expecting and my stomach is pretty uncomfortable at the moment. 
No dated tube TV's, yay! We had an LG LCD, and the channel selection was decent, they were all in analog though.
I was worried about noise since this is right next to obnoxious Old Town, but it was really quiet. The only noise we had was a neighbor's dog deciding to bark at like midnight... (They are pet friendly and provide beds, bowls and walks for dogs)
All the rooms have patios so, if it's not bloody hot it's nice to sit outside in the morning, listen to the birds, and people watch. 

Our room came with a bucket'o'beer deal as well that we didn't use, esp since I can't drink. It was all crappy domestics of the bartender's choice. 

The only complaint I have about it was that the pool was packed most of the day.. We went back to the pool around 10:30pm to relax and there was still 5-6 children playing in the pool and the spa. What little kids are doing awake and at the pool at like 11pm, I don't know. Those are some responsible parents... 

But for $92 a night and all the stuff they include with it, it's definitely worth it.",review,Z2G3xprEHqOgTSYto1tpfg,0,2,0,0
kk85ivM6MQUtH8u642p1Ew,2008-05-22,NjRNpMO_bLIa0vW0_RCiAA,5,"I enrolled my 2 year old son and 4 year old daughter into Hubbard. They've completed 2 swim lessons each and the results are dramatic. They have made huge strives in their water skills. Plus, it seems to enable them with confidence and self esteem after each lesson.",review,lgAgkEspbjBm5fyq8aeRVw,4,4,0,0
zLhfnbcnGg01_lltvrHVBQ,2012-03-13,EGivUqw8wLXW0uXw_JVFlg,5,"Dr. Kanarish was exactly how I expected he would be by the other reviews I read on Yelp and Google. His staff was very friendly and the facility is extremely clean. I have an 8 year old Boxer that needed a large tumor type growth removed from his paw and was given very high estimates from different hospitals. Phoenix Mountain Animal gave me a very reasonable price on the initial exam and the actual removal, stitches, etc... ended up being much more affordable than any place I had called. I was originally offered care credit( a payment plan) but I ended up not needing it because the bill was within reason. I just picked up my dog and he was a little sleepy from the local anesthetic, so we will see how the next few days go. A great first experience and am planning on transferring all our future visits to see Dr. Karanish. It's great to see there are honest and compassionate Doctors around. I hope anyone looking for an exceptional Dr. will consider Dr. Karanish.",review,fRexc9P14_3Rq7113synAQ,0,0,0,0
V6BYjHM9SnXscfkln3hCdA,2008-10-25,yC7V2o2I78CRqHtYS1o-Ig,3,"A buddy of mine takes me to this place for dinner, usually, and once for breakfast. It's an interesting place. As others have noted, be prepared to wait a while for service and don't be afraid to go get your waiter if you're feeling abandoned. Also, there may be a wait for a table, and the environment is loud, so be prepared to shout a bit if it's busy. 

They have beer-tasting on certain nights. I did not partake, but my Dad (who was visiting AZ) did. The food varies in quality (or perhaps just varies in quality of recipe?). My Orange Table friend and I shared a 'special' pork chop dish, and that was pretty blah. However, I highly recommend their grilled cheese sandwich on some sort of yummy bread (the lower end cheese sandwich ~ I have yet to try the fancy one). 

As for breakfast, I don't recall it being particularly spectacular, but I think it was better than your average diner breakfast. I may have to go back to try again... The flavored iced coffee seems very evil and full of calories, but it is really quite good. That did stand out!

Orange Table is recommended if you want a place to chill and chat with your friends. Just try to find out what others are eating so that you pick something good from the menu. : )",review,Qa2arVXyiHhxRM6HqUfEVw,1,1,2,0
YkFBelUWinftlweJzuiIAw,2010-10-02,G3u-H_tzh-RJ1IDyvxoDCA,5,"Husband and I have been trying to go to Urban Cookies for a while now. For one reason or another we kept missing its store hours. We finally made it today, and boy, were we glad. 

I had a vanilla cupcake and he had the urban cookie, which has chocolate chips and walnuts. The cookie was the perfect balance of moist and crispy. 

The guy behind the counter told us that the vanilla cupcakes was a special, but when they rotated it out people yelled at them. After taking one bite, I totally understood why. The cupcake is the best I've ever had. The vanilla frosting is not too sweet, perfectly creamy and melts in your mouth. 

I just hope they get more business so they can expand their hours!",review,TEs7S-ICJHD_aU7DQdsoIA,0,0,0,0
_CG5zJAoNN6gszjhSyUcww,2012-10-27,Q0iDQpaHOY2BvAr-JN3Qag,1,"I had such high expectaions after reading reviews but I was so disappointed.  The food was not good, the service was awful.  They got all of our orders mixed upo. Will never go back and cannot recommend this place.  PS  one dish was good and some enjoyed the soup.  There are 100 places I will visit before returning to this place.",review,4UmzR0mTv3_8JunST1kh-w,0,0,0,0
xY1sPHTA2RGVFlh5tZhs9g,2010-04-06,Te0MEKdoGufnxK4DcoUwNA,4,"In a sentence: Culinary Dropout is a foodie mecca with its plush and lux furnishings, amazing location in the heart of Scottsdale but away from the duche-ery of Old Town, on point entrees that range from classic to what I call contemporary chef-y food, and its trendy lil touches like dishtowels for nanpkins and placemat menus. 

After a short afternoon of shopping, I and the other Musketeers ventured into CD in search of yummy goodness... we weren't disappointed. We scarfed down the Pretzel and cheese fondue. Sorry, I can't remember the exact cheese used, but it tasted like cheez whiz without the nasty chemical aftertaste. 

Musketeer #1 had the Shrimp Po' Boy sammy and was overwhelmingly awesome! With its fresh baguette, crispy shrimp and cole slaw topping, this po boy claimed to have died several times. The fries were good, I'm sure they are awesome with the steak. Musketeer #2 had the truffle egg scramble. She said that it was good... not bad... but not terrific. We love the truffle, and this did deliver however... it just missed something... je ne sai quai... just something. I stole a bite and concurred... the low point in a overall great meal. 

and me, Miss Musketeer #3 had the coq a vin... a MUST! If that or braised short ribs are on the menu... they MUST be ordered! That's the rule my friends. My braised chicken was good, kind of on the sweet side, but over all very good, although the chicken did have an odd texture, it seemed to me that it could have used a few more hours in the oven. I think this is a dish best served before closing when all the flavors had their chance to really marry. We arrived at the top of dinner service and so the chicken was done... but barely.

Musketeer #2 and I both NEEDED bread and butter, our cooler-than-thou waiter was happy to oblige, even though it took a VERY long time t find him to ask for it in the first place. We capped off the meal with their ""famous"" Monkey Bread, it was definatly worth going bananas over! Warm, gooey, delicious and crazy sweet with its pull-apart goodness it didn't need the ice cream it was served with, but we certainly weren't about to send it back! The three of us died over that one! 

To my yelpers I say: if you have the cash to spend (three of us cost a lil over a hundred clams), a few hours spend on dinner (we were there a while) and a NEED to reach foodie nirvana in order to keep from jumping off a cliff into the chain resturant valley... then this is the spot for you! Bring your most expensive IT bag, a pair of oversized shades, maybe a sweater (the outdoor heaters really didn't work) and your most predestroyed designer deconstructed jeans and get ready!! It's gonna be a blast!!",review,vF4B6eFdoDmyV_l7MLHMzw,2,3,3,0
LYLGCIqNQQrpMwOxJ1hlrg,2012-05-10,ba02iPp9hBhoD9bVymsaPg,5,"There's the sweetest (and cutest) guy who works there and one time, my total came to 5.45, i had a 5 in my hand as I was scraping for change in my dance bag but he was like ""its on me."" and took it from his tips! I know its just 45 cents and i could probably find that under the seats in my car but he truly made my day with something so little like that! I LOVE this place!! :D",review,-_ilQMnX9m3hthIioMGNwg,0,1,0,0
