business_id,date,review_id,stars,text,type,user_id,cool,useful,funny,bucket
PEHJjxdw11TGFma9Zhz3ng,2009-01-07,VBP9ceHTaV8yFkUm7s5cLg,4,"So, for more than a year, I drove by this place on my way to work but never checked it out. I wasn't sure what to make of a place with a walk-up takeout window. Last night, I followed a group of friends there for a late dinner. Didn't try any appetizers. I just split a 14' Italian special pizza--sausage, green olives and fresh garlic. The pizza was pretty good, not spectacular but definitely a couple steps above a place like Mamma Mia's whose pizza has a fast-food quality at times. Red Devil is very generous when it comes to toppings, at least on this one. I am an olive lover but haven't had green olives on pizza before. I enjoyed olives in every bite. But if you think olives are just okay, you might have found it a bit much. The pizza was kind of big for two people and with tax, it was about $18. So, I'd say it's fairly priced. 

I have to say that the service, more than the pizza, would draw me back. Servers who think of the little things before you even ask are much appreciated. We had a party of nine and our waiter was super patient. We also brought a birthday cake on the premises, which they allow. Our waiter started clearing all our plates and silverware and before I could ask, he said not to worry, he'd bring us clean plates and forks for the cake. He also saw someone with a camera and asked to take a picture. He just gave off a genuine vibe of being helpful. I would definitely consider it if in the mood for something casual but not carbon-copy fast food.",review,ZrUZtLgLOn15v2NIZl-oKQ,6,4,0,5
MAFjNfDWJRgWCw8IOC7mew,2012-12-11,2vxPe652QNAcAcNqdyeKiw,4,"I'm giving this 4 stars for the grande margarita.  OMG, it was tasty.  It is not cheap at $8.50 but it is soo good.  One of the better margs I have had in a long time.  It ranks up there in the top 5.

Wasn't real busy when we went here and I haven't been to this particular location.  I decided on the taco plate.  My only complaint was that the machaca was a little salty IMO and I like salt.  The beans and rice were just ok nothing special.",review,UM6ARMpyqvM2aJ3Wnzwcog,0,0,0,5
eTbtfgUtfewdncgVf2CbWw,2009-09-29,F6V61TngJ1P6DqmW4yQEOQ,3,"Very good food but a little overpriced for the amount of food you get so the price is the only reason I am giving it a 3 star instead of a 4 star.  Cost about $11.50 for a small sandwich side salad and an ice tea.  All the food seems to be of the organic nature so definitely taste is higher quality.

I have been there 3 times and each time left still hungry; however, did feel that I had a healthier lunch than other options in the area.

If you are in the mood for a high quality / healthy light lunch and okay with paying $10-12 per person definitely give Essence Bakery a shot.",review,WEuIqh8ygm-bH81s8lwD0g,0,0,0,5
90FMI917WPqmn_CIT31pyw,2012-11-04,WTwRsZcGWd12VjAk4dirWg,2,"...for selling broccoli at a good price I gave them a chance.
...for selling celery that was already rotting I won't do so again.",review,5lq4LkrviYgQ4LJNsBYHcA,0,1,0,5
5BXNeSwzOy1nhU9PtCHvIw,2006-09-02,G2HIOsIDyY9C3wjq_V5rQA,5,"I walked in and uttered, ""I think I found my new home"".

1) Miller High Life on draught and bottle.
2) Buckhunt (the lil orange gun has even been taped together-double buck bonus!)
3) Bowling videogame...god, I love these things
4) Indoor smoking lounge!!! With a large screen TV, two tables and a lot of pleather seating, the large fan won't mean much but WOW-exciting! There is a french style door separating the lounge from the bar area where the stage is so you can still peak at the band while sucking tar.
5) Well...even the womens' bathroom is pretty gnarly...which would normally subtract a star-but I was so happy to pee in the unmarked restroom I won't touch it!

Other notes: all bartender, barbacks, security were extremely sweet and friendly; all other patrons were either pretty chill, excited to see the band that was playing or willing to strike up conversation; tons of televisions everywhere; they had a lot of beers on tap-cheap too; this place is HUGE. In fact I would consider it a liability since there are a lot of steps connecting each section-at times I found myself balancing precariously-and that is b/c I am a klutz-wasn't even drunk...ok, not that drunk. Most everyone had tats, black hair, laid back. This is def. not a scene-and I love that!",review,mfvezpz6ohS0NQk3DZdvqQ,3,4,1,5
WUZxVr_CaRqEQgzvyeK5tw,2008-02-29,a-5c6Co8swgwUu4joh9t4w,4,"I LOVE IKEA

I really don't understand how or why some people just hate this place, but for me it's the only nice way to interiorly design on the cheap.",review,A_O8wZOsMTPwyeYA4-Rsow,1,0,1,5
eBslbGvlDI92ppOi6CnTDw,2012-06-26,-WDXYJ5BL60JK-cS9oMV7g,3,"Okay so lets clear one thing up.. this place is a dump. 

But for under $20 a night it is a-okay for me. With all the money we saved I've got some extra cash to hit the strip club that sits directly in front. 

All kidding aside this place has impeccable location and is pretty much only a couple miles away from anything you can think to do. Of course the rooms are a little outdated and boring but its only a place to rest your head. And you can do that in peace. This has to be one of the quietest hotels I've been too. Almost seems like everyone is scared away from Christie's out front..",review,7i8MGa7zyWmaQli6o2-29g,1,2,0,5
Lfn_7TNBPNu9c2v_d2nE4w,2011-03-14,LaxqD3cR2nIJAQoqVS_j4g,4,"Okay so the only reason I'm giving Rigoberto's 4 out of 5 stars is because I'm currently on a diet and it's not diet friendly. So I'll write the rest of the review based on my pre-diet dining. 

This place is some serious mexican food. Not the fancy stuff, the good, mexican-at-home style. It's good at 6am, lunch, dinner, midnight, and even the 2am drunk-I'm-hungry meal. I have three favorites here.

1. Bean and cheese burrito w/sour cream - the beans are refried with good ol' grease. It's delicious and the cheese is legit cheddar.

2. Super Nachos - I don't understand how you can not finish this one. They give you a ridiculous amount of chips with a mexican buffet on top, but once you get the hot sauce on it, you can't stop.

3. Carne Asada burrito, no pico, with sour cream and Guacamole - Cooked fresh on the grill and wrapped in the biggest tastiest flour tortilla. They even will sell you the tortillas by themselves if you ask. 

Enjoy!",review,P1XofswxyEb90r2bVN4LJw,0,0,0,5
YKOvlBNkF4KpUP9q7x862w,2012-02-10,EDw6iljkLMSePlIPYo_D0A,5,Guacamole was best I've had!,review,2-xLV_tit_LV75rYOPdtYw,0,0,0,5
JokKtdXU7zXHcr20Lrk29A,2008-01-14,6EDCixSnNJCoKqhjp1p8lw,4,"This place has great food - some of the best ""bar"" food around. But you really go for the beer. It's a brewery, right? 

I haven't tried a beer I didn't like here. There should be one that fits your taste, even if you're not a big beer drinker. The prices are reasonable and even better during happy hour which has two convenient times during the day (regular and reverse). If you're unfamiliar with the beer choices try a sampler and then grab a pint of your favorite!",review,7kRN8IkOWlLblEltNlnfRQ,1,0,0,5
sI-2c9HZ0RjZX1OU-5DW0A,2011-01-10,aLoHo_2P6f-CxCR_bfd-Rw,2,"Well...I wouldn't get the dragon lady roll again but the shumai were good, and the rainbow roll was good.  Too many mayo/cream cheese rolls on that menu. Not even busy on a Sunday night with the BCS game in town.  Nice atmosphere.",review,32yCk5GTLAjcxUxvUOhWyA,1,2,1,5
w19cemjVR8u02PgjFpJ7Mw,2012-11-25,Hjf_sb1aIo9f5xgWEuBdBg,5,Still flying solo.  My friends took me for dinner here and it was excellent.  Humus appetizer was great.  For main course did broiled chicken pita wrap and it was perfect.  Recommend!,review,BHWnl3JztynNABGfmAryPQ,0,0,0,5
E4Q-78EG6f2aRv7zGQLuAg,2008-05-27,g8HTHavL-ovkkJ05XJaf0A,3,"Michael C is right. This place is very charming. I love the inside decor, with brick walls. I love the ""No Sniveling"" sign hanging behind the bar.

It's a small place, but that's part of the appeal. There's a small upstairs patio, with a fireplace (wasn't on when I went) that could be a great spot to hang. It's not much of a view, but there's something cool about being at a higher elevation. 

Finding J. Chew was a little bit of a challenge. We ended up stopping at AZ88 to ask for directions. LOL! When we arrived, my friend and I sashayed up to the bar. Immediately we had a drink menu in front of us. I was more intrigued by the huge crystal ball-esque 20 Questions game. I wanted to play!

When I asked about beer, the 'tender motioned to the shelf above his head. Ahh... Not a great selection, but it'll do. I went with the Honey Brown. $4.50. Great price. Okay beer. I'll order something else next time, if I can make up my mind. Stella? Fat Tire? Hmm... 

The whole reason for venturing to J. Chew was for a celebration. My friend was getting married, and this was her final Saturday night as a ""single."" So, the group of women sat outside on the small patio area. It was a cold, chilly May evening and they had the fireplace going. They also had a couple heat lamps working, but most of them were out of propane. Bummer. We Phoenix Dwellers were shivering our coconuts off, if you know what I mean. (Praise Allah for fingerless gloves, which were a big hit that night.) But, the bartender did try and keep them going, so we appreciated his efforts!

Overall, I like J Chew. Yet I can't rate it higher than 3.5 for a few reasons. Yes, one is the beer selection. While it's small, it's also doable. Yet, their mixed martini list looked disgusting. Then again, I don't do martinis. Nor do I throw down $11 on a mixed drink. 

But the real annoyance came from other patrons. From one guy in a hockey jersey throwing himself against the glass door (even hitting his head on the glass, when prompted) to a crazy D'Backs fan yelling in the face of a calm Braves supporter, those couple of guys just totally zapped the cool, calm and collected from J. Chew & Co. There's something defeating and sad about seeing another man yell ""Lock it up!"" at another man, during what could be a calm, mature discussion about two sports teams they individually love and follow. There's something even sadder about watching an aging man with a cigar hit on a married woman. He just wouldn't leave our group alone. Oh well...Maybe they won't be there when I go back... because I think if they are, I'm gonna have to say something. How obnoxious. 

If you're in Old Town and looking for a chill spot to hang, this is your place. Plus, I liked the music they had on rotation... From Modest Mouse and Postal Service to 90's grunge and alternative rock, I was diggin' the tunes, along with the laid back atmosphere, the great service and the knowledge that there was a chill place in Snottsdale to hang. Who knew?! I just don't think there's a strong enough draw to hang at this place all night. This is more of your ""before dinner"" or ""before another bar"" type of estabilshment. Only problem is there's not many other cool places in the area I'd be interested in going, especially on a Saturday night when Snottsdale is out in full force.",review,APLIPfq1Rf8QyhHHk2uAyA,1,4,0,5
ho4Te6bO2tGs56h9PF2vuA,2008-05-21,p0I-j3Ja76ftLyQbie4fFQ,2,"Where do I begin? 

Let's start with the server who literally yelled everything he asked or said to us. Oh, and then he rammed a chair into my leg and was just not very concerned about our experience overall.

Let's move on to the cheese crisp, which had plenty of grease cascading off the pieces, and virtually no ""crisp."" Did you put some cheese on a tortilla and microwave it? 'Cause I could have done that at home.

Both drinks were quite tasty- my tea was strong like I like it, but not bitter. Hubby's lemonade was very good, but he drank it so fast I didn't get a chance to steal many sips.

Let's discuss the entrees, shall we? Hubby's carne adovada chimi was decent, better than my carnitas. In fact, MY carnitas is better. (I keep aiming for Chef Hector's at Sam's...) Yes, the pork was very tender, but the salt was -shall I put it nicely?- aggressive. Sam Kinneson aggressive. The ""tortilla"" was an inedible science experiment. Thick and doughy, and made even more appetizing by the charred side, it reminded me of the salt play dough we all made as kids, formed into a pancake. Truly nasty.

As for the legendary salsas, Hubby found the green to be tasty, but he did not care for the flavor of the red. Neither was especially fiery to him either. 

Riding on reputation, are we?",review,N-D-d1Z4UybdlkK1HxlNPA,3,4,2,5
D1T1jtCfTfXD-cQE3QViow,2011-09-10,_7IJAWxTgGA6ir8mkV7f7Q,5,"Super friendly. Joe was there greeting everyone, refilling coffee, and sharing how we uses local Arizona suppliers. Great diner food and decor. Loved the biscuits and chorizo gravy.  Will definitely be back.",review,8DqQNOVzZZqSCHdXI945eA,0,1,0,5
TpQMR-JFE5V0UPzTjjuwFQ,2012-10-28,OzLuYcpWmm-5cq8RrCqReQ,5,Excellent,review,3p_muaP7a652QYtHUZNsFQ,0,0,0,5
Bc4DoKgrKCtCuN-0O5He3A,2011-06-05,rYzOP5_LWimUy15531PYSg,5,"My first visit to Sweet Republic and when I was done my first thought was, ""why did I take so long to come here!?""

I sampled a few of their ice creams and let me tell you.  All delicious.  In particular the mint chip ice cream was delicious.  It tastes like fresh mint because get this... it is!

Service was quick and friendly.  We got in right before a rush and let me tell you, the staff were able to handle it like pros.

Each of their ice creams are homemade and you can just taste the love mixed into each one.  You can tell how proud they are of their creations.  I wont go into the kinds of ice cream they have but can tell you that whatever you choose, you will love.

Stop on down, took me 30 minutes to get there from Gilbert, and enjoy a cone or cup.  Do yourself a favor and don't delay for 3 years like I did!",review,OwCEsC0-oRxsSpTHZ0rrvA,2,2,2,5
jsvIv9NRRBXdmCe8b88b4A,2011-12-30,p8f5SRmv17OZeQiXowTzmA,5,"We-Ko-Pa has been prominently listed as one of the places to play if you are in Arizona.  I first played it several years ago, and it has become one of my favorite desert courses in Arizona.   There are two courses - Cholla, and Saguaro, and although they are both desert courses, they are somewhat different. The cholla course is an older, more mature course and doesn't have the same feel as the Saguaro course.  The Saguaro course can be walked, but has a wild side to it and to me, seems to have more elevation changes. That said, both courses are immaculate, wonderful condition, and a joy to play.

Over the years, I have played the Saguaro course more, but lately the Cholla course has grown on me.  Now when my golfing buddies come down, I always make it a point to play both courses with them.  This has led to some interesting memories.  

The first time we played, despite my warnings, one of the players wandered off the Saguaro course and found a Jumping Cholla.  He liked it so much, he brought it back to us - stuck all down one side of his body.  It took us quite a while to get them off of him - and then he wanted us to give him extra strokes. Not a chance.

Another time, one of my friends teed off on a par 3 on the Cholla course, and hit it into a dry creek bed. He seemed to lose his composure, and hit five provisionals, which also went into the desert. Then he found his first ball, and ended up with a par!!  Of course, we haven't let him forget the five provisionals...

I have read some comments about the marshals on the course, and in the past would agree. However, the last two times we played, the marshals have been very good - very courteous and very helpful.  The last time, while we were playing cart path only, one of the players was very slow (as usual) and the female marshal most diplomatically asked us to speed up.  She was one of the nicest, most courteous marshals I have had experience with, and consequently, one of the most effective.

The courses have a nice driving range, chipping and sand area, and putting greens. Unfortunately, they no longer allow you to use them, unless you are playing one of the courses (you used to be able to pay a daily fee to use them).

Finally, the service is friendly and courteous - from the drop off, to the restaurant, to the desk personnel, I have had nothing but pleasant experiences with the employees.

I think any golfer should experience these courses at least once - a visit would be well worth it.",review,w_hcSjqLeSZQL9Rx1UP-Tw,0,0,0,5
jJhNOhuGpIsJX5SEUFFWYQ,2008-07-17,1HwtNOm11v0I3QTfSUO8FA,5,"Not many places that you can go and get a natural casing charred white hot dog outside of western NY.
Folks I know from Western NY love this place, and I have to agree (even though I'll still take a good Chicago dog any day).
I know where I'll be going if I ever have an itch for a white hot. :)",review,P2vHl_ZzSzeu07W29KsKgg,2,2,1,5
rr13jM6SUmfPPPGHHMHCgQ,2010-11-07,R1Oj0OC4d0-i9QIC60rekg,1,"We were driving around Chandler area to find a decent place to eat and Mido Sushi caught our attention. ""Oh, Okay!"" - I thought and walked right in. We were greeted right away with a good waitress, but somehow I found her voice was really annoying!
The food came out after 10minutes and I was disappointed with the sashimi! It wasn't as fresh as I expected. The soy sauce tasted very weird and too salty. By far this is not the most decent sushi restaurant I've experienced. 
Kabuki and Masa sushi are still my best choice so far.",review,M9mayv89c7zxgUS-EKWtHw,0,0,0,5
kr3EFhoSwbJPrL_e_RD39g,2012-06-06,hQu7FMhTBxYl3TxPsDxf-A,5,"Dinner for four at the soft opening.
The food kept us talking about the tastes and combinations far into the night.

Small/shared plates will fill you up quickly.  The Hamachi Crudo was a fresh, light starter with peppers, fennel and sea beans to fire up your appetite! Grilled asparagus and a delicate, cheesy risotto were great sides but the smoked beef rib was a taste sensation.  Sweet and savory, smoky and succulent, sticky and sumptuous! Bleu cheese grits and grilled peaches were the perfect pairing.  ahhhh, sigh.  I think I'd pass up the tater tots and save room for something else.  

This restaurant is just what Phoenix needs.  Close to the ball parks or walk off your dinner in an invigorated downtown, Blue Hound Kitchen is a great addition to the energy.",review,m21EE2_CqPzpXdKsYsbVIA,2,5,2,5
Yiw1ml0XVBDIQBTLXHNGmQ,2010-06-03,eSkNW469JWtJw8wYTqN0UQ,1,"I went for family birthday on a Friday night. Only a few people in dining room eating. (1st clue to leave.) Ordered a margarita. It's extra to have it shaken... But I ordered that way. It was mostly sour mix. An it was awful (How do you mess up a margarita?(2nd clue to leave) Server is surprised we wanted to order dinner! (3rd clue to run!) Very disappointing. I got the chicken fajitas, they had sauce all over them. Shrimp appetizer consists of 3 shrimp $8. Salsa was good.  I will never go back. Good luck Salty. I love your decor. Why don't you care you could be so cool!",review,PA3ztLFGwZgbV_q1FqwcAA,0,0,0,5
MKKihkKRtemuyCzAjEZyvg,2011-12-07,-8DRrwUePpDUw3hWbwxGVg,1,"I give this review a total 1 star If I was able to, I would have rated no stars at all!.... I would NEVER reccomend ANYONE to live here. The office staff is horrible and made me feel uncomfortable the whole year I lived there based on THEIR MISTAKES! I can not express how disappointed I am with the way that they have treated me.....",review,KXSpx3GxpcT5CtWcnHo1aw,0,2,1,5
rLAeltELaGdQKh_LYIllEA,2010-11-07,yl-z0rKr4PfwfEMBXNzIpg,5,"What an amazing place!!  I had an incredibly enjoyable time staying at the Royal Palms Resort, and recommend it highly.  So many excellent points:  absolutely gorgeous accommodations, polite and helpful staff, excellent restaurant (breakfast/ brunch outside, with a delicious cup of coffee, is a must), a great spa, and a relaxing atmosphere.  My boyfriend and I stayed here for a conference in late October, which is a great season in Arizona.  Our stay was a pleasure from beginning to end.  The resort is well-suited for special occasions (there was a wedding reception and an outdoor conference dinner during our stay).  Our room was very comfortable, with excellent set-up and a great view of the mountains from the balcony.  The resort includes a pool, a small gym, several lounge areas with firepits and fireplaces, and the wonderful Alvadora spa (with massages, facials, outdoor-facing showers, and shaded lounge areas to your heart's content).  There are several mountain trails a short walk/ drive away from the resort, and downtown Scottsdale is 10-15 minutes away by car.  In all, a beautiful place for a special occasion!",review,gQyOwXDSPGgZ_ngw89Dkug,0,0,0,5
KHeM4cO2DWK1C09zWCFLFQ,2012-06-08,dGo4wlJ5ijCziTkmx_LHSQ,5,So many flavors and the ice is melt in your mouth soft. Add cream to make it a little better than a normal icey treat! Lots of sugar free flavors too! Mmm!,review,CjL3FtpiDzhNXTQPw0-RBw,0,0,0,5
R8VwdLyvsp9iybNqRvm94g,2012-06-01,t45o2bR4PW-sEKIDKqe35g,4,"i love lgo and have to stop myself from going there more than i already do. while their pizza is delicious and the commuter sandwich is bomb.com, i really go in for the sweet treats like crack cake, brownies and salted chocolate chip cookies. on top of the food, the atmosphere is great and they have an assortment of treasures in the shop. only 4 stars since they keep the music too loud for me to want to stay too long and parking stinks if i want to go outside oft he hours of 9 - 11.",review,LUDHnXp0VxoHlAb10GpEvw,0,1,0,5
OdD1GuGNQ64ssJmMJ_D9RQ,2011-04-27,--8hpKO4bkweLyEucdxI_w,4,Great place and experience. Food and beer cocktails were great. The scene is laid back and fun. There is something for everyone here. Enjoy it for what it is a great retro bar serving old school beer you wont find anywhere else so don't be whining for the latest micro brew or looking for the Scottsdale scene here. Parking is easy in the back alley and side streets. On weekend nights I'd like to see a separate entrance if you want to go just for the food and not have to pay the cover for the band. A fun place for kids too.,review,A8KAUGlzA8gaCoe5GMMKVQ,0,0,0,5
mp9hMnOobCLNB_iR4sqm_w,2011-08-01,Xweq4Rg4yXIEtXPPGshmIQ,5,I'm a big fan of their strawberry water and if I'm looking for a better lunch than what I have at home I'll swing by and pick up a salad from here.  They have a good selection- and it's constantly expanding.,review,dUDzN6zl3j12zhByOrnF9Q,0,0,0,5
xdwPHc25l7_roZ9Kfea13w,2008-04-05,II7eMeFtPg9l_FMLQFLiwQ,2,"I finally got the chance to visit Lola on my way home from a poetry reading at the Phoenix Art Museum Last night..(Side note: If you get the chance to see Aaron Johnson read, do so.)

I somehow feel the need to appologize for the lack of stars to all of you who seem to love this place. I would certainly be willing to give it another try but I was not impressed.

First the music is loud, and therefore everyone talking in the place turns up the volume and as my girlfriend and I were seated across from each other at the communal table we could barely reach to share the food let alone hear each other.

Why are the tables so big if the food is so small? Maybe I am a bit of a glutton, but for 8 dollars I essentially ate a mushroom for dinner...Don't get me wrong it was tasty, and I understand Tapas are appetizers, but 8 dollars? I was disapointed. I used to go to Firefly in Vegas and it was cheaper and tastier.

We just wanted to try this place and move on someplace quieter, but I was really looking forward to it...We decided not to have drinks and simply share one thing so we could get to said quieter place before it got too late...I think because we ordered so little, the waitress considered us a waste as far as her tips were concerned and therefore seemed not so friendly...and those little bitty glasses of water they bring...I drank immediately and it was never refilled. 

I was overall not impressed by anything except a patron's sweet ass Salvador Dali Mustache. I can see the charm there and I probably will give it another shot but based on this trip 2 stars is fairer than fair.",review,6WrOT1dj6sigl_voiwQ7HA,1,3,2,5
WNy1uzcmm_UHmTyR--o5IA,2011-06-30,mcQH6CoUTCxPuEDI5LAVOQ,5,"My gf and I just tried the Oggie bc we werent super hungry.  Even with that, the food was super yummy.  I wonder what would happen to us if we are actually starving.  the sauce that came with the Oggie was excellent too, so I suggested that you shouldnt eat the pasty without the sauce.  The decoration in the store is quite unique: church pews and wall and table deocrations.  It's a must go if you are around the area.",review,rOpHWQXgXSnAT99-QE0QoA,0,0,0,5
Bc4DoKgrKCtCuN-0O5He3A,2010-09-04,Ce7p7Lr2YqbJ5sHohJ0vgw,5,"I dropped in to @SweetRepublic, finally, because they tweeted about their Chocolate Guinness, and a limited edition Jameson Irish Cream.

I have had their ice cream in the past, both from the truck, and at other events, and was already a fan.

Now, I'm fanatical.

The Jameson was amazingly good! I couldn't believe how well the flavor was represented, without having the harshness of the alcohol bite.

But the Chocolate Guinness won the day. It was so good, I ordered a pint to take home. (Unexplainably, it is still in the freezer. I will remedy that today!)

The location is right by my work, so I anticipate returning, again and again.

Jan and Helen are wonderful girls, and they have created something truly amazing. I congratulate them, and look forward to more of their creations.

And their commitment to using local ingredients makes me happy to spend my money there, rather than a chain, who doesn't concern themselves with the area.",review,7cR92zkDv4W3kqzii6axvg,2,2,1,5
