business_id,date,review_id,stars,text,type,user_id,cool,useful,funny,bucket
-yxfBYGB6SEqszmxJxd97A,2007-12-13,m2CKSsepBCoRYWxiRUsxAg,4,"Quiessence is, simply put, beautiful.  Full windows and earthy wooden walls give a feeling of warmth inside this restaurant perched in the middle of a farm.  The restaurant seemed fairly full even on a Tuesday evening; we had secured reservations just a couple days before.

My friend and I had sampled sandwiches at the Farm Kitchen earlier that week, and were impressed enough to want to eat at the restaurant.  The crisp, fresh veggies didn't disappoint: we ordered the salad with orange and grapefruit slices and the crudites to start.  Both were very good; I didn't even know how much I liked raw radishes and turnips until I tried them with their pesto and aioli sauces.

For entrees, I ordered the lamb and my friend ordered the pork shoulder.  Service started out very good, but trailed off quickly.  Waiting for our food took a very long time (a couple seated after us received and finished their entrees before we received our's), and no one bothered to explain the situation until the maitre'd apologized almost 45 minutes later.  Apparently the chef was unhappy with the sauce on my entree, so he started anew.  This isn't really a problem, but they should have communicated this to us earlier.  For our troubles, they comped me the glass of wine I ordered, but they forgot to bring out with my entree  as I had requested.  Also, they didn't offer us bread, but I will echo the lady who whispered this to us on her way out: ask for the bread.  We received warm foccacia, apple walnut, and pomegranate slices of wonder with honey and butter.  YUM.

The entrees were both solid, but didn't quite live up to the innovation and freshness of the vegetables.  My lamb's sauce was delicious, but the meat was tough.  Maybe the vegetarian entrees are the way to go?  But our dessert, the gingerbread pear cake, was yet another winner.

If the entrees were tad more inspired, or the service weren't so spotty, this place definitely would have warranted five stars.  If I return, I'd like to try the 75$ tasting menu.  Our bill came out to about 100$ for two people, including tip, no drinks.",review,sqYN3lNgvPbPCTRsMFu27g,4,3,1,5
wzP2yNpV5p04nh0injjymA,2010-05-26,ChBeixVZerfFkeO0McdlbA,4,"This place is great.  A nice little ole' fashion homemade ice cream place that looks like it has been there for forever.  The place has a real nice vibe to it.  Sorta reminds me of Sugar Bowl only smaller, not as busy, and easier parking.

The menu is ginormous.  I couldn't decide what to get but that didn't matter because the other 3 people I went with chose for me.  I wanted something basic but they insisted on sharing the 'patte' thing.  It is a few scoops of ice cream over a brownie and topped with whip cream and caramel.  While it was very good it just wasn't what I wanted.  Next time I'm just going to get a scoop or 2 of the ice cream so I can really taste what the ice cream is all about.  It is just too difficult to tell when it is topped with a bunch of stuff.  The ice cream we got on the brownie though (butter brittle I think) was excellent.  They have tons of different flavors and they all sound delish!

Anyway I can't wait to go back if I am ever in the area again and need a sugar rush!",review,rLtl8ZkDX5vH5nAx9C3q5Q,0,0,0,5
qB-qsaSnhbHCt18_AN4Quw,2011-12-21,1FvrC35rTJ6BWFvRog7tuA,3,"Everything was nice. The ice cream was delicious, no overwhelming alcohol taste & an interesting variety of flavors. Service was fine, place was clean. I'll go back, but only because I have a killer sweet tooth and they're in the neighborhood.",review,66PQJEHC0tCWGMI4V9KT-Q,0,0,0,5
6Ry-gjGqApTSRZkfdYlLmw,2011-05-04,LN4l4wklQB0IVBjm-vq9TA,1,"Not busy at all but took nearly 45 min to get our meal.  Ordered the trout and was shocked to see lots and lots of bones. Hmmmmm. Well asked the waitress about it and she said ""they try the best they can""  hmmmmmm isn't this a ""fish"" restaurant? 
They comped the trout but still not sure I would go back.",review,rWN1pg3mCF2btJWtG6JmJA,0,1,0,5
5GpvSL1tlAjpgdJKZ5eLpg,2012-12-30,1RSEAeAWilUywt1B3SAkSA,4,"Great place to have a meal with family, can be a little on the loud side cause ita always a busy place, recomend calling ahead and getting name put on waiting list, reservations party of six or more only price range moderate, but well worth it",review,P-9g9-6OriX0ElKpZknUKA,0,0,0,5
COc06ScpJTN15NXMf4gkqA,2012-06-17,MbLozRSxSjtMJ3YmPCms7Q,1,"See the huge sign outside that says $2.50? Yeah, that's for shirts only. I was caught off guard when I brought in my skirt and got nailed for about $3.79. As I sadly handed over my $5 bill, the lady at the counter said a lot of people had told her they felt betrayed by the sign outside. No kidding. I had originally been heading down the street to Regal on 7th Ave.--who does a fine job in half the pickup time--for the ""advertised"" fake price here. Trying to make the best of it,  I told the lady at least I'd learned they had an onsite alteration service, and maybe that was worth a buck. UH OH. Picked up my skirt a few weeks later with some Jersey Shore-type chick at the counter, and was told I owed another $3.79. I flat-out refused to pay twice. She screamed at me, chased me to my car, wrote down my license plate and said the police would be visiting. Ni-i-i-ice.",review,UfMHoQ4lic1aCkXFa4TxlA,0,2,1,5
rZbHg4ACfN3iShdsT47WKQ,2010-07-13,hh1L68RTi1FCHNfXGHkc7A,5,"That darn Smokehouse burger is awesome. 5 stars. 

The smoked corn was a little Meh... it was oily like not butter oily... not a huge fan of the texture either. I like corn crunchy and it was not. 

Service was great. 

I did see an unmentionable bug running around near the back entrance towards the chicken rotisserie thing, but bugs have to eat too right? (still 5 stars lol)",review,C6IOtaaYdLIT5fWd7ZYIuA,8,9,6,5
St3jS0PnF1lulH1ggA4Jgw,2010-12-28,VyAIpPxEpMO581PoRB5G6A,5,Great place for brunch or to relax with a coffee. Their hot chocolate is amazing.,review,UHxBIipD-7xb60CGB8rOuQ,0,1,0,5
MUsqPXthMdHoPEow9M3MfA,2007-07-28,EuC1SHR55UGShkq3iovTEQ,1,This place is not there anymore.,review,VBEbhE0ISjg6xowGNiGmgQ,0,3,1,5
hBHkHYOk_E-6EgObC6MTdQ,2010-11-14,Rfu5grIwYtiEQbbMZtGwTg,5,We went to The Farm today for lunch to enjoy a picnic on such an awesome beautiful day. I had the Tuscan sandwich and it was awesome. I had expected it to be good but was surprised at just how enjoyable it really was. I'm sure sitting outside in beautiful surroundings on a perfect day helped with the experience. This is the prefect place for lunch on a beautiful day. My date was equally impressed so I'm sure I will be back!,review,i0A-c2yoHySmFhRV2sDR1g,0,1,0,5
VVeogjZya58oiTxK7qUjAQ,2011-01-25,h2c-jLW9cLVIiiubGqTaog,5,"On one of my many visits to see mi amore, he took me to this fantastic little pizza joint. The aesthetics of the place were overwhelmingly perfect. I believe the maximum seating capacity of the dining area is 45, yes folks, 45. So the 2 1/2 hour wait was expected, and very VERY worth it. The pizzas are baked to order in a classic brick house oven. The toppings arent what youd find in your local Pizza Hut, either. You can choose from fresh slices of mozzarella, slices of perfectly seasoned italian sausage, pepperoni slices, salami slices, arugula, fresh basil leaves, tomatoes, etc. Basically what Im getting at, is this is beyond words delicious, classic LEGIT Italian pizza. Around the dining area, you will see freshly baked loaves of focaccia bread, that is later served to you with extra virgin olive oil for dipping once you are seated. The smell in that place is heavenly.....incredibly reminiscent of my grandmothers kitchen!!

PS GET THERE EARLY!!",review,qklF6QU-bi4Y4Bt4g6Sv8A,2,2,3,5
q1nDSpmV-FdTBNj6UuZvTg,2010-08-29,IZrBk5XXvCEO-7Ce3XYGOg,2,"I've never eaten at this location; both times I've had it was to-go. The first time I had a pulled pork sandwich, and a side of the beans. The pork was extremely dry and tasteless without the sauce. The sauce I found was overly seasoned. And the beans had way too much pepper. 

The second time I had HB's was a work lunch that we had this delivered. Once again, the pork was completely dry, but not as dry as the pulled chicken, which my coworkers complained about. 

I prefer Hap's BBQ over this place for sure.",review,2ARM6NFVciTzV21r7p8jiw,0,0,0,5
91n02N35x38nvR1XH-jOAw,2010-12-05,abVV1guPWL3mK08A3a8ajw,4,"This place is wonderful! The service is amazing and food is delicious. 

I especially enjoyed the Clams Oreganato appetizer.  

The Eggplant Parm lunch special came with pasta and choice of soup or salad.  What a great deal!",review,UfGlNf7MbKeRPp4ASUVTcg,0,0,0,5
J7zXaGgQ7U6rWlaUBVEjjQ,2011-03-04,7DvxqVS6o6QRxAFv3wRP0g,4,"A friend of a friend recommended Lou/Autoplex and I couldn't be happier.  Lou provides honest, fast service and is a pleasure to deal with.  No runaround, no nonsense, honest auto service.  Extremely difficult to find these days... I went to him for a muffler/tailpipe and then later for a catalytic converter and was completely happy with the outcome.  Additionally, he pointed out other things that I should see my previous mechanic about that they needed to fix/finish.  :)",review,LKJswnMTubEGjJXFDseHKA,0,1,0,5
gMY_3RkmK2eeD9SHlBKfCg,2012-05-25,qtOMqRS8K03QTisX-2ddYQ,5,"My favorite Starbucks in Mesa. It's not even the closest one to my home, but worth the experience. GREAT staff.",review,8-mw_aotUGmP0k0s6QKwOA,1,0,0,5
7U8TYNW4Mvx6m3zexsO0sg,2010-12-28,SWHnJvsZVqBJzDSGS0YwLw,4,"Yum!
Steaks were great! Corn bread

large portions
definitely worth the price!",review,6XDBxbqC3kD5xvQMCkwhNQ,0,0,0,5
iLtSto_Tgu2yaj_r_iohAg,2010-03-11,gC60r2BGT14QGZ8Zbe6ptw,4,"Large Goodwill location (formally a PetSmart), but dark like a cave. This one is hit or miss... It is clean for a Goodwill (I've seen some pretty dirty ones). Just need to keep checking to find the treasures here.",review,CP-IE-zyc2Mv3jlaceElVQ,0,2,0,5
lVHtVCyFJOqAH0ltn7pLuw,2009-02-04,W3R-lEDWBooITQOgwwblKw,3,"I had been craving sushi steadily for about two weeks, so I decided to try somewhere new. This place happens to be just across the street from my work and the reviews on here were a vote of confidence. 

I had the cherry blossom roll and rainbow roll, shared edamame, and hot green tea. The cherry blossom roll was good, not amazing, but good. The fish was fresh enough, and I did like the eel sauce drizzled on it. The rainbow roll was much less rainbow than I'm used to. The rainbow roll did have a bit of a fishy taste, and the whitefish on it was a pale yellowish brown color, and not as moist as it could have been. The crumbled macadamia nuts were and interesting and kind of fun garnish. The edamame was tasty, not over cooked, but could have used a little more salt. The green tea was boiling hot, with the kind of walnutty aftertaste you get from good green tea, I was disappointed it came in a single glass, not in a tea pot diffuser with a teacup like at most restaurants.

My girlfriend had pork katsu, the sauce drizzled on it was sweet and vinegary, but not too overwhelming. Gauging from the fact that she ate all of it I would assume it was pretty good. The salad that came with it was a bit strange, iceberg lettuce and a cream sesame dressing. The miso soup on the side was better than the little packets I get at the store, but didn't taste home made. It was not too salty, but the tofu must have been dehydrated, it was in tiny little shriveled squares on the bottom of the bowl. 

The waitstaff was very attentive and friendly. It wasn't too busy when we went, about 5pm. The music was typical pop music, but thankfully unlike some places (RA for instance) its not blaring. 

I would say its definately not the best sushi I've ever had, not even the best I've had in arizona, but it was ok. The rainbow rolls at kobe are better.",review,K46kUag6aS0Vd4JjiaqNsQ,0,0,0,5
6imLt53br7SJ3av07jjH7w,2012-11-06,SPDbkT9WXghJedf1xxYnOg,5,"It's the place to be. 

I went before heading over to Symphony Hall and seeing Ballet AZ perform Giselle. Having heard great reviews about the place, it's food and the vibe... I had to try it.

Restored into a restaurant and bar from an old department store, Hanny's has the feel straight of of New York City. The lighting is dim enough to give that sexy, intimate feelings and with long, pew style seating with individual tables, the vibe is very posh.

My roommate and I ordered the bruscetta plate and the margarita pizza. Very good choice! The bruscetta plate was on the saltier side, so be wary of that but it was delish. The pizza was much bigger than we expected. For $10 you really do get a good deal. 

We each orded drinks. A orded the peach martini and a glass of giseling. Wasn't a HUGE fan of the martini and I thought it tasted like cough syrup but it was also my very first martini so I am not holding Hannys against anything. My roommate on the other hand said it was the best Manhattan he'd ever had, which I believe.

Hannys has a modern feel with a touch of Mad Men and I simply cannot wait to go back.",review,Ypz7hxOCnrg8Y8vxHJU-sQ,0,0,0,5
5IO32LUAX4b-nD13fxKsIw,2012-10-24,O6a4VlSMLKwmAMjH0BUQyg,5,"New to the Scottsdale area, I've been searching for a nail salon for a few weeks. I stumbled upon this place and was very happy. Although it's in a weird strip mall, it's really relaxing inside. My gel manicure was perfect, and the shoulder massage was a nice added extra! Totally recommend!",review,oaz8Fhe38u2DbeTguvLkPA,0,0,0,5
vYvT8J9uEh4Fqt7f9ILKlA,2012-01-24,KFG2OFPaX0N4omAILlq37Q,1,"Food middle of the road... The staff is rude.. Seems like it starts with the owner. I think she makes the staff pay for everything that goes wrong so in turn they dont want to fix issues with poor, wrong food etc.  I think she tends to forget the customers are actually what keeps a business open. For a long time it was the only choice in the area. Now there are multiple choices.  If your in the area Chili's or Connolys is much better choice in my oppinion.",review,-US_SpFlEAsu3ZRWY8Bsvw,0,2,0,5
HhNY3X0kyrN5682La6N6Cg,2011-05-12,4qZB6JCWSeUwWoCPu5_UWA,5,"I love boba drinks but hate the word ""boba"". I always feel like an ape when I say that word. 
 
Anyways.

There was a period where I use to drink this stuff at least 3 times a week when I was living in San Francisco, so when I say I love something, I really do (or is it more like a creepy obsession?) So! When I found a boba place here I got excited, especially when I saw that they had green milk tea.

I can't vouch for all of their drinks, as I've only tried the green milk tea and avocado snow, but every time I have ordered them they have been super good.",review,b6CyeouS97Y8YSTi8T2xRg,1,4,0,5
6Lo25bdGe3qEdFLGygBsPw,2011-08-21,qbw_6lX5pyM7YBWxHrBbbw,5,"Like others, I found this studio through a Living Social coupon.  It is a great studio.  Kim is so friendly and fun.  I would highly recommend the yoga classes.  They are both challenging and relaxing!  It is a small studio, but that gives it a really nice, intimate feel.  I definitely recommend it!",review,Y_iCmH_z_T5cOy3_8p_pQw,2,2,0,5
jPhmaY35qGP2qNc68viXPg,2007-07-11,Mp5GMmdgNr5UzlIBm2J_Aw,4,"Nice resort located next to the Desert Ridge shopping complex.  If you're from out of town, this would be a great place to stay since you'll be across the street from a ton of restaurants and bars.

I went to an event here, and haved stayed here a few times.  JW Marriott has hosted a few wine tastings that I've gone to, and the resort is super nice, with a staff that is ready and waiting to help you no matter what it is you need.

The rooms were decently sized and the bed was big and comfy.  The bathroom was nice as well.   The resort has a lot of fountains around and huge windows so you can check out the great views.

The pool area is where it's at though.  They have a great lazy river to nurse your hangover on, and a water slide for when you're feeling better.  Of course you can get drink and food service out there and you can even rent a cabana- which I recommend.   It's not that pricey- around $100, so if you get a few people to go in with you, it's no biggie smalls. The servers are way more attentive to you when you have a cabana and you can choose different packages that come with water and fruit or lunch and so on.",review,0CMz8YaO3f8xu4KqQgKb9Q,3,3,0,5
FKlr2XmPA7G5MlMFpka1OQ,2010-10-16,wHEBxpIC34f6NiZc578vfg,3,"I don't like mega-chain pizza.  I don't like Domino's.  I don't care for Papa John's.  I've never had Hungry Howie's because frankly on their flyers it looks horrifying.  And I will never ever eat Little Caesar's again in my life . . . but I gotta admit, Pizza Hut makes a decent thin crust pizza

There were a few great locally owned pizza joints where I used to live in Tempe.  Tessio's and Boulders On Broadway stand out, but ya know what?  Sometimes you don't want to pay $20 $25 bucks for an extra large 3 topping pizza.  Sometimes you just want something decent for only $10 $12 bucks.  Sometimes you really DO want a decent cheap pizza delivered to your door in 30 minutes or less

The three years I lived nearby, I probably ordered Pizza Hut delivery or takeout once every couple of months, and I've never had anything to complain about at this location on Broadway

PS - the boneless spicy bbq wings are dangerously addictive",review,VcN9i7sPrGSOn4BnpOJ9tQ,0,1,0,5
9U7_UWXXJZOW14L0kAdCNA,2009-10-12,6ufiyRAvzqLlgIA2a0SHPQ,2,"No cover and outdoor misters. Decent crowd, overpriced drinks, teeny dance floor, good selection of d'bags to giggle at. It's A.) a club, B.) in a chain hotel, C.) in Scottsdale, fer chrissakes. What more could you ask for? My only hangup was how dark they keep it in there. People in Scottsdale are generally good looking, so a little more lighting in there isn't going to hurt business one bit. 
Overall... this place doesn't feature anything that really stands out.",review,Xm8HXE1JHqscXe5BKf0GFQ,4,4,2,5
1NZLxU5WvB5roPFzneAlLw,2008-11-02,llMrv3u6jOOz2E9T7214mA,2,"I've been to Barrio twice now.  Simply put, I do not believe that it is worth the prices that they charge. The first time I went there was with the pseudo boyfriend and he adored his meal, and so I embraced it and loved it.  The second time was last night for Dottsy's birthday dinner.  

Dottsy and I ordered up the guacamole that everyone raves about.  We were unimpressed, as we had huge chunks of avocado in there and have both made our own guacamole and didn't see what the big fuss was about.  

I've had the enchiladas suizas and enchiladas de hongas and although they weren't bad- they were not amazing.  Not worth the 16 bucks, at all.  Don't get me wrong, I wouldn't complain about the cost if it tasted like it was worth it, but not so much.

Because it was Dottsy's birthday, they brought her a complimentary flan which we both agreed was pretty tasty flan.  So, if you are a flan person, this may be a place to check out.  I am not a flan person- too jiggly (which makes me think of what fat looks like on a person's body which stops me from eating it).

The two things that make this place worth going for are the margaritas and the service.  The margaritas are 50% tequila and fabulous- I usually just stick to the house margarita and am satisfied.  The people that work at Barrio are friendly and cool.  I imagine that they all enjoy working there.

I don't really ever need to go back to Barrio, unless I'm craving a serious margarita served up by a cute hipster.  I'd go for a drink or two and then go elsewhere for dinner.",review,0lxf4v5NuJ1U6Bk7SGAJ5w,10,9,9,5
KoIRdcIfh3XWxiCeV1BDmA,2012-09-07,t2QTyQKMagNguZBBlou2GQ,4,"Great white sangria and margaritas!!!  We went for dinner, but ended up ordering appetizers and a pitcher of white sangria. All I can say is the service was great but the drinks are amazing!!!  The tortilla chips  were fresh and homemade.  The ceviche was so tasteful!",review,I4GolEA9L0k2RfH4CauL0A,1,1,0,5
pdxyZdnwltQXcu-kD5rpXQ,2011-12-05,5_mXBgsLxVqs8Yaa3Qvbbw,3,"Was super annoyed by this Sephora. The first three times I was asked if I was ""doing ok?"" was not bothersome. By the tenth time I was asked, I really felt like the employees were going to frisk me. I had a baby with me! I really hope I don't have to do any holiday shopping here. I'd rather go somewhere else.",review,Ske6pb78p1AeeBh0GulEJA,0,0,0,5
w8D3DAby1nVgU8a4s3z88w,2011-06-02,nTem0s2r5HX74DXs25WXaQ,5,Amazing clothing and fantastic deals! As a photographer this is my first stop for designing shoots when I need amazing wardrobe items. The owners are really nice and friendly and very helpful.,review,8SFpYIJed0i6NMr_2rYJhg,0,4,0,5
luCSjoNQ9q_0QIjKKOy2pQ,2010-08-07,RfpcyW2C579dHixRbwa9XA,4,"If you like beer, you'll love Papago.   They have a huge beer selection and the prices are very good.  When ever I'm in Scottsdale, I make it a point to visit them.",review,IESg-R-NaG8yQwNdxxftyw,0,0,0,5
zruUQvFySeXyEd7_rQixBg,2012-03-23,KnBBQ-r_eP9h3MNEBhhNrA,4,"We arrived at US Egg on St. Patrick's Day at 10:00 am before the A's vs. Giants Spring Training game and only had a wait of 15 minutes. Not bad to start! Promptly seated we were brought a pitcher of water and ordered our breakfast. The Denver Scramble is delicious! My husband ordered the Hash & eggs - reasonably priced, quick service and a ton of food to start your long days off right!",review,RgqU8dg9zaSSkwAlyB5Isw,1,2,0,5
QHyqYUZ0WdxHYPAenIuLjw,2010-05-18,ZceWozc1QEY0c3K4Xz5HYg,4,"Recently ""discovered"" Rosati's in Ahh-wuh-too-key.  A friend (a former New Yorker no less) ordered us some thin crust, and I was surprised to find good ol' squares instead of slices.  I was even more surprised to find that it's the best Chicago style thin crust I've had in my 6+ years in the valley.  How have I not run across this place sooner?

I wish they had a ""junk"" or ""garbage"" pizza special, but the Classic Sausage will do.  Nice spicy hunks of sausage in almost every bite

Avoid the wings though!  Horrible.  Wings should be deep fried or grilled . . . maybe I got a bad batch, but I think they actually BOILED them?  Is that possible?  Irregardless, they were terrible. 

It's a huge kitchen with a small counter area for takeout, so don't plan on eating there.  It's in the strip mall with CK's . . . I wonder if CK's would let us bring in Rosati's pizza while we drink and watch the games . . . ?  Wings aside, it's my new Go To for pizza",review,VcN9i7sPrGSOn4BnpOJ9tQ,0,1,0,5
XWvht_1ZLdK7EHJ3jo4q0g,2012-05-22,nK6jxzqS5pVVTDYtva_Lew,5,"Weekend plans prevented me from kicking off AZ Restaurant Week on Saturday. So on Monday, Venyse and I headed to White Chocolate Grill where we both had our cherries popped.

We started out with the spinach artichoke dip. The blends of cheeses made this perhaps the single most spectacular dip I've ever had the honor of putting in my mouth. O.M.G. Venyse and I were practically clawing at the bowl to get the last of its creamy loveliness. But when you hit a home run so soon in the game, the rest of a meal can seem at odds.

However, I was not daunted. She ordered the New York Strip with a side of mashed potatoes (with good gravy...what exactly is that?) and roasted carrots; I the blackened Mahi [*back story to follow] topped with crab and a side of Israeli couscous. We didn't share our protein, but we sampled each others sides. All were very good, but the carrots really stood out. The gravy and the potatoes were good and I loved my couscous. But halfway through here steak and by the last few bites of my fish, we both hit the wall. A food coma was certain. I persevered but Venyse relented and boxed the rest of her meat and carrots.

Then came the white chocolate brownie. So sweet, so rich, so topped with vanilla ice cream. It was all we could to to make a dent in it. We both felt bad, because isn't white chocolate supposed to be their signature ingredient? 

Regardless, this was a terrific first restaurant to go with which to begin. And we both agreed it would be a place in our future dinner splurges. I also must admit I love LOVE the belt buckles. Having about 42 myself, I was intrigued when I first noticed what I thought read ""SWAG"" after staring for perhaps too long in that general region of one of the staff. (Really super sorry if that creeped you out.) It's actually WCG.

[* When a group of us went to Key West one December to escape of the harsh winter of NWOhio and Detroit, we went to a restaurant the listed ""Dolphin"" as one of its menu items. I asked in a slightly shocked voice if it was really dolphin, to which the server responded it was actually Mahi. 'Oh,' I responded. 'Then I'll have the veggie burger.' Because even in 1998 I was a food bitch.]",review,nc3cqVN0UuB3m50-CcMftw,1,4,1,5
ss5gVggeSmAgMUeL65UvYw,2012-03-28,OHEPhyLR6NoadE9BlBcPkQ,4,"Congratulations on opening the Gilbert location. Glad to see you guys making the shift to the far East Valley. As to be expected, the bruschetta was great. We really enjoyed the Syrah and the Sangiovese. It's really hard to beat the $5 glass/pitcher deal before 5pm, and the board + bottle ($20) on Monday and Tuesday night make for the perfect date night, though it can prove to create a long wait.

It was nice to see staff from the other locations making the move out here. Small mishaps and things that get confused in the midst of opening a new restaurant are bound to happen. No worries though, we've been 5 times in the first 10 days, showing that you guys are right on target. Looking forward to getting to know the staff and becoming weekly regulars.",review,vTvxsif_dlYJOtFxS-t2RQ,1,4,0,5
