business_id,date,review_id,stars,text,type,user_id,cool,useful,funny,bucket
D_VXbq6sCuqXuBbdPo9zpA,2008-11-11,xsCpYN_4gmRi7ZcnW_hHfQ,4,"This place is usually packed late after coming back from Dos Gringos or whatever since it's right around the corner. There's a reason for this, their pizza is good. Big, wide slices... in fact their slices are double what you'd normally get anywhere else. Thin crust, chewey crust, great sauce flavor.  If you do get pizza here, order it by the whole pie. You won't be disappointed. I only will order a meat slice if I know it just came out of the oven. Personal preference and this is for any pizza by the slice joint.

When I was there Monday night, the owner was singing softly. It reminded me of my mom when I was a little kid and how she used to sing to me............ i told him to sing more. I'm kidding, it was a woman singing.....so I'm not knocking this place, just pizza by the slice places in general.",review,PWjdlug88aWpFEfPMJbSVg,4,4,2,16
GJ7gPJGl0r-1jPhp2Qz8BA,2012-10-21,V8ZrnbiYZ4kwEZucG3LhVQ,5,"Outstanding customer service!!! Great camping firewood bags!!! HUGE bags of high quality, long burning wood for $10!! Cannot be beat!!!

Cash, check or use the ATM they have in the office ($2 fee).

http://www.bbfw.com/",review,mA-7ol53a2RrfsS0oM5mEQ,0,0,0,16
2nzUx_M8Szyzsf4CszHasw,2009-03-13,F0DGyl572Fa3L9FDV21tEw,5,"This is Mesa's best breakfast, hands down! This is one of my family's favorite Saturday/Sunday brunch places in the valley. 

Crackers & Co. is great food at great prices and we always take out-of-town guests there when visiting!

I was never a fan of eggs unless they were scrambled or in an omelette, but Crackers showed me the way to delicious fried and poached eggs!  The Eggs Benny is great, both Traditional and California-style. Their omelettes are huge and never overcooked (my fave: Spinach Mushroom) . The skillets are mighty tasty and really satisfying (my fave: The Vatican with eggs over easy). Try their French toast... it's got great flavor and is delightfully crispy. 

If you get a chance, try lunch there! Their soups are so scrumptious and the sandwiches are to die for! The Cream of Spinach and Artichoke soup tastes just like a bowl of spinach and artichoke dip, and they don't skimp on the artichokes at all! The Chicken Dumpling soup is seriously the best I've ever had (I'm not even a fan of dumplings!)! The Roma Tomato Chicken Melt is my favorite sandwich on the menu (such good flavor!), followed closely by the Drunken Chicken sandwich. Their burgers are quite good and along with their salads, they serve up a hefty portion!

Beware though of 30 to 45 minute wait times on the weekends in the winter due to snowbirds flocking for breakfast. The wait times let up about 12:30P though, so it's great for those who can't decide between breakfast or lunch!",review,HUsAVJOGZgsiJA265R7JFA,1,1,0,16
CMvCbtkcHH9Gp0S3w1_aQA,2011-07-15,2SA2NztY3RaA-jGppeoO6A,5,Best in south chandler.  Glad they are out here,review,KrqafLanxNm4iDxbC74R1g,0,0,0,16
Y6CrVJ60m8vJvpPsHwUT9Q,2012-05-26,_eMicN4vqkoH560wzrv0pg,1,"I have been a ""regular"" customer at this salon ever since it opened.  At first it was great!  Clean, relaxing, and welcoming.   After a few months without a manicure or pedicure I decide to treat myself to a manicure this past week.  I went in and a lady did a beautiful job on my gel manicure.  She paid attention to detail and didn't rush through the whole process.  I didn't have time to get a pedicure so I decided to come back the next day.  I only wish that I had her do my pedicure yesterday ... 

The guy who did my pedicure had some sort of infection on his thumb.  I didn't notice it at first because he was using gloves but when it was time for the foot massage he took his gloves off, revealing it.  Tracy was doing someone else's nails right in front of me and clearly saw that he had some sort of sore or fungus on his nail.  It was completely black and it looked like something was growing out of it.    I was shocked that she didn't tell him to at least put his gloves back on.  The ""massage"" that he gave me was hardly any massage at all.  He did the same motion over and over while concentrating on the tv.  Definitely not worth the $25.   The worst part is that he gave me an ingrown toe nail.  The whole right side of my nail is swollen and I just hope that I don't get an infection.  This was by far the worst pedicure that I have ever received. Even though I had a great gel manicure here, my last experience was so horrible that I will not be back.",review,eZZwcrpbf9M8AlEQT3DsCA,0,1,1,16
qd1ajiZRCwqEQJqCgoN1wg,2008-10-29,o6XthGhcUosK9LAFopu4gw,3,I thought the place had a lot to offer with the atmosphere and the ingredients used in the all of the dishes.  I only thought that the menu spoke louder than the dish.,review,5KF1Tdo0ZTwyvzpv6LLWUQ,1,1,0,16
pwpl-rxwNRQdgqFz_-qMPg,2011-09-08,nYSFIsS_ZwDoHPTyeWkK_g,4,"Not too shabby. Decent drinks, cheese/meat plate was standard but good. The beet salad didn't have many beets on it.. more lettuce. I think we were wanting it to be all beets. The highlight of the whole dinner was the squishy bread that came with the cheese plate. Pizza was also good. Big negative was that all 4 pizzas were soggy in the center. Other than that, no complaints. The one with fruit on it was the best. The sausage was typical, but good, the margarita didn't seem to be a winner with the table, I thought it was good. I like that rubbery cheese thing though.. The one with seafood on it was my least favorite.The tiramisu with pine nut brittle was tasty, the chocolate cake was fine.",review,FRPfzzoSL4KKjLcy0Dm0OQ,0,1,0,16
1zDCfNgtfyh-Uw8j3JxhHA,2010-11-27,3rLNWqt0kXQI9SrAILhBeQ,4,"I've only ever had the carne asada quesadilla and churros, but they are damn good.",review,kXT3pVtElactR8nFmeLbbg,0,0,0,16
PxeX1M8WtyPxX1MuuGIh-g,2011-07-13,8mFHCHOT-9MkihwvaEs-Kw,4,"Bottom line: Scott's has a matzo ball soup so good I can't imagine how anyone could ever hate the Jews. Best bagels in Phoenix, hands down. Take your Einstein's and shove it.
Scott's has an expansive menu that ranges across breakfast, traditional deli offerings, and a strong but semi random assortment of 'home cooking' type meals that your mom makes but you never see in restaurants. I haven't spent a lot of time in delis in New York, but Scott's reminds me of the ""New York deli"" I used to live around the corner from in Houston, down the street from the JCC - tasty, simple, and unapologetic, about anything. I love their soups, although their pastrami is not the best I've ever had. They have every flavor of Dr Brown's imaginable. The portions are huge - too huge, actually. I'm minuscule, so the prospect of a sandwich that is 3x what I can eat in one sitting is daunting to the point that I only go if I know I can take a box home. The service runs hot and cold, but I've never not gotten what I wanted the way I wanted it, and if the waitress isn't looking at me with vague disapproval, I feel like it's not an authentic New York experience.",review,kDd9xHsUOg_HYOvxkQcnXA,0,0,1,16
A3xyx-Y_-t3TwBD9E--Zzw,2012-11-18,xMry1S85Ll13vi4mrg3E5g,5,Went here last night for the first time in years. I used to hang out all the time here when I was younger. It was packed by 1030. Great music mostly top 40 and hip hop..no techno yay! Good looking crowd and not as pretentious and the rest of Scottsdale. Everyone had a blast..dancing everywhere. Friendly crowd. Reasonably priced drinks for Scottsdale. I cannot wait to come back. Patties still has it!,review,iIQbATX70Jsbosv4OE2tHQ,1,0,0,16
OFBJtqWGSx6n6CchtVmoRw,2009-05-04,9yc5vhQCCPgHWPWcM72xJw,2,"This place is essentially a copy of the old Father's Office (www.fathersoffice.com) in Brentwood, CA.  It took me a while to get over that fact and give it a decent try.  Among the things Delux has copied from FO is the famous ""Office Burger,"" which Delux calls the ""Delux Burger.""  They also bring out the fries in a shopping cart just like Father's Office.  What Delux fails to copy, however, is the quality of the food and the high-end nature of the original.  At FO, the wines changed weekly and are all incredibly rare selections.  The beers at FO also tend towards the more obscure.  Delux seems to concentrate almost exclusively on beers and does have a decent selection, but nothing you can't find elsewhere.  Wines are available, but as an afterthought, and definitely not of the quality served at FO.  For Phoenicians who never experienced the joys associated with the original Father's Office, you're missing out.  It's like being an Eric Clapton fan but not even knowing who Muddy Waters is.  But all the imitation aside, I have to say that Delux does a pretty good job with everything and they have taken the FO concept and adapted it to the PHX strip mall environment.  

Food wise, everything I have tried was ok.  They did change their sweet potato fries a year or two ago because the other ones weren't ""crispy"" enough.  The problem is that these new crispier ones have no flavor.  When they were testing out the new fries, the manager asked me and a friend to opine and we told him the truth: We said the new ones are flavorless.  I guess we were the only ones who thought so because they went ahead with that change.  That lost them 1 star from this review.  I would rather have the soggier more flavorful ones (who knows how they make these new ones so crispy anyways?).  

When I go here, it's almost always out of convenience and late at night.  Not many places of this caliber stay open until 2 am, so it's about all there is when you are in need of a late night meal in this part of town.  Their 2 star rating is based on: clearly knocking off one of my favorite places, Father's Office (minus 1 star) and for ignoring my feedback on the new crispy tasteless sweet potato fries (minus 1 star).  They also lose a star for retaining the FO prices but substituting Phoenix strip mall quality.",review,5JSrHtH-aK69OjUxdt-k5A,2,3,1,16
c0zhbiffge6fGl_Nzgxbqw,2008-08-20,Qt0QQvOCLO35QSMS_wCNVg,5,"I found some great t-shirts for friends here, including one from a local PHX artist with a grinning skull.  

If you're a hipster or looking to buy gifts for one, then this is the place to go. 

Plus, the clerk was using a Mac (not that I would expect anything different, but bonus verisimilitude points for fitting in with your surroundings Mr. Clerk).",review,8eNEP7Yj7JwfOQPwgh4Prw,2,2,1,16
YkFBelUWinftlweJzuiIAw,2009-09-11,QA92__P11LL4bkTUzp20vA,4,"i adore this place! cute little shop, sweet owners, delish cookies - what more could you want?!?!?

the urban was made for me. dark chocolate, coconut, and some nuts. uhhhhhh, hello, did i just wake up in heaven?

their ice cream sandwiches are good - but i really wish they would make them on the spot, so you could get whatever cookies you wanted - right now it's all just standard chocolate cookies. a bit toooo sweet sometimes. i also had a special chocolate mint cookie sandwich, which was pretty good, but i had some serious chocolate overdose afterwards.

not a huuuge fan of the cupcakes; i tried the brown velvet (i think that's what they called it). doesn't taste like red velvet, even though it's supposed to. but i mean, the place IS called urban COOKIES. 

yes, they are pricey, but what organic thing isn't?",review,jqs0xPGhZwlyijqWLEgRyg,0,0,0,16
mxrXVZWc6PWk81gvOVNOUw,2009-09-20,4rPHbuypxzE1QqX3D27kew,5,"This is a fancy fine dining restaurant with a casual feel. The food is definitely under priced. For most of the summer, drinks are cheap and food is half off for the all day happy hour to entice the locals. During the winter, you can't get into this place. It is packed, so reservation is recommend. The food is described as American Southwest. The best three choices to have for the first visit. Is the Famous ""BIG_ASS"" Burger, Green Chile Pork Stew, & Lamb Fondue. These choices will hit the spot and hit the wallet for 10 bucks with tip a person.",review,WQX1Hio90vjGkASKM0v5kA,0,1,0,16
XJv7dUb5fMRaZAWVZjhtvw,2011-12-18,Wy0CZN_PB2OFzkcXQxpjOw,5,"my son loves the splash pad! His dad or uncles stay with him at the playground while I can run in the store or two that I need to! There are quite a few empty retail spots, hopefully they can get some new stores in there as well,",review,CYKz4de61gfOfZEB7MbaDg,0,0,0,16
z3yFuLVrmH-3RJruPEMYKw,2012-05-13,EJkXPUa0IVeDCdSyLdsbrQ,3,I love Defalco's.  I hate Defalco's.  The food is always fresh and I'm never disappointed.  The big problem is that the service is so slow.  It's  great that they have a market for you to look around while you are waiting for your food.  I know I can get quality tasting food but I have to here when I know I'm not in a rush to be somewhere.,review,2h0A-NirfNl2p2SquFWYHQ,0,3,1,16
QnAzW6KMSciUcuJ20oI3Bw,2010-10-23,e_JFgj3gljVvzpI_3e4jeA,2,"7/07/10

Don't get me wrong, I still love JFG; I just didn't care for its BBQ pulled pork sandwich and fries.  The coleslaw was good, but not so fantastic that it's worth the pain after.  I thought that the pork had too much of the cloyingly-sweet sauce.  Wasn't so sweet when paired w/ the garlic toast points.  However, if you look at the included photo, you'll see that the two pieces of bread were under the pork, and therefore completely saturated w/ sauce.  I like accompanying bread to be crispy/crusty (love that crunch!), so all I had to enjoy that afternoon w/ the pork was the part that stuck out from under all that sauced meat!  What a waste (tsk, tsk)!  The boat of fries was just a complete soggy mess.  I should've asked them to sub sweet potato fries instead, but why must I pay extra to get a perfectly crisped product?  Then again, one (wo)man's treasure is another (wo)man's trash, and vice-versa, eh?

Today wasn't a great day for me w/ regards to Mr. Johnston's two restaurants (see my ""recent"" Coffee Shop review).  I hope my next visit to a Johnston concept yields a happier adventure!",review,0bNXP9quoJEgyVZu9ipGgQ,3,7,2,16
ORLTCEgKfdxMuGPhIc1O9Q,2010-11-08,4mjNx2hgXRBw1dqD5Lv1ow,3,Very small selection. I am used to seeing a larger inventory of fine dresses and only found one that was nice! I also felt like I was maneuvering through an obstacle course with all the people in there and the poor arrangement; this is a messy and busy store.,review,_ZXThWhgLL94mAXOntLDXA,0,0,0,16
UAzZDOlg_Fp4-8YhHDpo2g,2010-03-09,_ajr6Nkx59331w7xNs2atQ,3,"Just so you are aware, phone calls are now 50 cents for 3 minutes. So proclaims the hand scrawled sign behind the bar next to the register. Even dive bars need a bit of order amongst the chaos.

Ducked in here for a cold one after walking the fest in Melrose, I'm just a sucker for a dive bar. Once my eyes adjusted to the darkness, I saw an amazing mix of people. Some almost hipsters, Indians and traditional barflys. 

The Dos Equis was frosty and cheap, there was a back door for quick getaways or for smoking. Times truly are tough as I noticed on a trip to the men's room that three of the flys were passing around a hand made cigarette.",review,bcZd4ohK6CIT_BOQ0_O53w,4,4,4,16
r4ggW7POeNX0ta6spkT4Kg,2012-06-04,lCCr4wN6IJqCf0OiVAn1Gw,4,Wow! I am definitely impressed.  I've been to a different Massage Envy years and years ago and vowed never to go back because it was the most mediocre massage I had ever had.  My girlfriend was telling me about how great the therapists are at this location so I relented.  I scheduled a 90minute deep tissue/trigger point massage with Joshua.  It was probably one of the best massages I've had in a long time.  My back neck and shoulder felt so much better afterwards!  I was so happy after I even signed up for the monthly membership....Something very unlike me to do without thinking about it.  I guess this location is the only corporate owned store and not a franchise. No wonder! :),review,d95On_QNeQPr01pRNzHa5w,1,1,0,16
P5a2hK5G64J7DcNwLAPhuA,2012-05-11,fFzKn4Mi5twA29c5emJXQA,4,"Loved my visit here. I was talked into the meatloaf for dinner. I have never ordered meatloaf at a restaurant, but tonight I did. The combination of meatloaf, and a bit of mashed potatoes and gravy on my fork......HEAVEN. I was sure to chew in every corner of my mouth....my taste buds were going crazy.......",review,gN4JuiRC2sIssc1qijg4Zw,0,0,0,16
AryNioF9fxl8RYGiIE7fSA,2012-10-04,gAwXPbAmmy73sbGPhrvXmw,3,"I think this place is hyped up a little more than it should be. I've tired their bruschetta, pizzas and salads. They were decent and I have no complaints but nothing to rave about. A decent place to pop in to for lunch since they have counter service that you order at.",review,Mgm6xZjahS3HD7qqOyGtbQ,0,0,0,16
E2F25cRcYf_bWtvbCht0EQ,2008-08-25,cE1d9sRmPhK0rEWycLvUqg,4,"I thought I disliked brownies, but these are damn good. In fact, every flavor is delicious. I was pleasantly surprised. Holla!",review,g84VjttN28PWiv_WtdhnSQ,4,4,4,16
l0c2pmxGYvCfeaCRiYGAvQ,2008-03-06,irmdZNNl1DmyNX43bzZN8w,5,"I'm giving this Urban a perfect rating, for it never fails that when I walk through its doors, I always find something I want (or could) buy - even if it's a gift for somebody else, like my younger sister or best bud in Detroit. I even found one of my favorite sweaters here on clearance for $20. I think this Urban has a better selection for women than the one in Tempe, so if I had my choice, I'd come here to browse and buy. 

Plus, it's within walking distance of Scottsdale Fashion Park, Borders and Olive & Ivy (the perfect spot for brunch/lunch).",review,APLIPfq1Rf8QyhHHk2uAyA,0,0,0,16
WNy1uzcmm_UHmTyR--o5IA,2011-07-28,0E4CY0FSqaZyaRvmc0QEmA,4,"Couple things.  First, I am reviewing a Delivery order that I placed.  (If you didn't know that they delivered... Now you do!)

You start by looking at their website, which is modest.  It's a black background with White text.  Pretty much all of their food is available for take-out, except for the alcohol.

*TIP* Make sure to look at their PDF Menu.  It has TONS of more choices than what is listed on their Website.  I wasn't even aware of this fact until I had ordered my food.

At this point, they do not have online ordering set up, so you call and place your order that way.

Cornish Pasty's (pronounced Pastie, not Pastey) are amazingly delicious.  They take whatever filling you choose (from the Chicken Alfredo to the Bangers and Mash), and they place it in a thin, crisp dough that surrounds it.  Think of a Calzone, except the Irish version.

Now, these are very, very filling.  They are modestly priced (all of them are less than $10), and they are EXTREMELY DELICIOUS.

Make sure you give them a try.  I will sure be eating here again!",review,OAhO2G3tOfMpO40UlMqbiA,1,3,1,16
WyJRPTn2FCFdj2cYT9pqyw,2011-08-22,WphtWBE2tTkHCg2ilEtgFw,5,"Excellent food! I do say the service isn't always the best, but the outcome of the food exceeds my expectations. Definitely recommend ordering the Artichoke Salad! Not what you'd expect out of a typical boring salad! Not just stuffed with a large amount of dull, boring lettuce, but filled with spices and tons of flavor.",review,h3ZuEh28kwBd2iI5oAFWgg,0,0,0,16
aRkYtXfmEKYG-eTDf_qUsw,2012-06-07,98QoCid1LWZ_XBhV08VTnQ,5,"I need to stop going here so much, but it's hard to stay away.",review,aqmtZa9o9K4casagyyfpyA,0,0,0,16
jtzhY-P4H6WSYpv5rWhxtw,2011-11-29,7MkFCDQtCDZF-b_ABKG3ZA,5,"Really good, healthy food.  Owner is super friendly. Would definitely recommend. :)",review,f01B5tRtqf3k6ak1pPSAWw,0,0,0,16
LHzVPddSPzMECho55zCf0Q,2011-07-31,Ft40qHyfMCejSTG5Xu-x3w,4,"Great gelato. It's actually very creamy so kinda taste more like an ice cream but still incredible. Lots of flavors probably 30+. Haven't had a bad one yet. Love the Roche, chocolate and pistachio.
Just had a pizza last visit- they have a new pizza oven. Good thin crust, tasty ingredients, soggy in the middle kind of like Pomo. 
Give it a try!",review,ofPkm7BTBJeaD0OkmZNdNQ,0,0,0,16
1eBJyYf3JEccqXUFxG1VWQ,2009-09-23,-M9Ek478gmatw8zr8lHwbQ,4,"yummy! that's all i have to say about my blazin' buffalo sandwich on foccacia . the foccacia was a perfect specimen: light, appropriately herbed and airy. the sandwich fillings (sliced roast chicken, tomatoes, ranch, lettuce, and buffalo sauce) were fresh and yummy. i had a coupon for a free drink which made my sandwich, chips and a drink $7.47. a pretty awesome lunch for less than $8 makes me happy. almost as happy as buffalo sauce makes me. i have a tendency to be obsessed with buffalo sauce. a word to the wise: my co-workers got pasta salad and it looked awesome. they said it was tasty too. i was jealous. there's no up-charge for pasta salad - i recommend you get that instead of stupid chips you can get at the grocery.",review,GyFmGA5UQZ4pXdx1lUH86g,1,1,1,16
XK5FFbrKWMjRqc6ZbSTknw,2011-04-03,G59gfZmTbAYD02Yy0kKtmw,1,Good service but the food was horrific. The pollo fundido was dry & no flavor.  Could not eat the tamale it was so bad. Will not go back. I had better Mexican off the neighborhood roach coach.,review,iW5hQ7GD6qc-Px2bamS1sg,0,1,0,16
3EEVGDngt4DEhoOQZIUNUw,2010-06-22,Kr4tb3kJgfYviNFn22gVTg,3,"After hearing good things about the Scottsdale location, I was looking forward to lunch at Arcadia Farms when visiting the museum for the Ansel Adams showing.  Unfortunately, it was a little disappointing.

Service was painfully slow.  I'm not sure if that was the kitchen or the server, but in either case, I was not impressed.

We started with the baked goat cheese.  For some reason, I envisioned the caramelized onions and roasted tomatoes atop the cheese, but everything was combined.  While it was quite good, only the bottom portion was hot.  The rest of it was only lukewarm.  I wondered if perhaps the dish is prepared ahead and refrigerated, resulting in the uneven temperature.

We also shared the smoked turkey and warm brie sandwich with white bean salad.  They generously served each of us a full side of the salad with our half sandwich, which was more than enough.  Although the sandwich had just been grilled, the inside was still somewhat cold.  I also would have preferred just a little more apple, but overall, it was A-OK.

The white bean salad with red peppers and possibly cucumber if I remember correctly was sorely lacking in flavor.  Salt helped, but not enough to save the dish.  If it was dressed with anything other than oil, I missed it.  

Arcadia is just fine if you're already at the museum and looking for a bite.  Otherwise, I don't know that I would return.",review,wHg1YkCzdZq9WBJOTRgxHQ,3,3,2,16
9T7eOkHOjWfE21KxgPxo3Q,2010-12-07,ARLjebDoDC3heC015nIHtg,5,"Thank goodness for Sue at Mill Avenue Travel. We contacted Sue to book our honeymoon trip to St. Lucia at one of the Sandals resort.  She was great with setting everything up, booking airfare etc.  When our original airfare decided to cancel the flight, she made sure we had a comparable one booked.  The best thing she did for us was encourage us to purchase travel insurance.  

When we arrived at our Miami hotel at 10:30pm the night prior to leaving for St. Lucia, we had discovered Sue had left us an urgent note to contact her.  We found out a hurricane had hit St. Lucia and all of a sudden our honeymoon plans starting crumbling apart.  Because of Sue and our travel insurance (thank goodness we listened to the expert on this one!), we were able to change our honeymoon to a Sandals resort in the Bahamas and didn't miss a beat.  Sue was in constant contact with us, which calmed the craziness I was feeling (and I'm sure my new husband was relieved).  The airlines even took care of our baggage fees on the way to the Bahamas.
  
If we had booked this trip on our own, we would have been up a creek without a paddle.  I most definitely would not have purchased travel insurance and our honeymoon would not have turned out to be the amazing trip it was. 

We will definitely be using Sue again.",review,lhbSR25Am5ZYnGA_vDafGQ,0,0,0,16
RXEsxL_fituMtbNACe5a3w,2011-07-15,OgNr2AoQm8VdIEYW8F785Q,3,Very nice and helpful staff. One guys always asks me too many questions but I figured he was just trying to be nice. They're on top of trying to sell you a new phone and service. But when you shoot them down they get off your ass about it.,review,-J06hZ3w7N2oV5QwaAjtwg,0,0,0,16
7SO_rX1F6rQEl-5s3wZxgQ,2011-05-30,USt-wMQR-rKCpHNr7HOPZw,5,"My friend has raved about this place for months, so for her birthday the girls and I got together for a little pizza field trip to LGO. It was amazing! Just as good as Mozza Pizzeria in LA., but around 400 miles closer. I also love the little grocery store. Very cute things to buy.",review,NPoOEAPspruMOik-9sKQtQ,0,1,0,16
NtRs2Xd64mRLe6jGUTXziw,2011-09-20,6AdvAZT-v9SZUzRj2Wf-SA,5,"I love the story time program here! I started coming this summer after having a baby and wanting to get my toddler out of the house while beating the heat. The staff here is amazing! It is a 30 minute session of singing, dancing, stories and bubbles. We look forward to this every week now. My daughter loves the take home cut out and coloring sheet. The first thing she does is come home and color it. I am so thankful for this free program.",review,QQVQTz_dYZk_Nat5O-EBkg,1,1,0,16
Mng1FUcW-xRSdsDkowQm2Q,2011-12-02,f3DDgRGNznU0Yk7WMPv2eA,5,What can I say I love AJs especially the Boulangerie or coffee bar.  Jason is the best.   The pineapple ice tea with a slice of pineapple is deli-sh with a yummy cheese croissant.  I admit I usually get something from the coffee bar and bistro more so than the actual grocery store.  Oh and if you go check out the display/decorations they are usually pretty cool.,review,hqnySkbeUJGoC6h76gtSIQ,0,0,0,16
