business_id,date,review_id,stars,text,type,user_id,cool,useful,funny,bucket
supigcPNO9IKo6olaTNV-g,2008-10-12,HXP_0Ul-FCmA4f-k9CqvaQ,3,"We went here on a Saturday afternoon and this place was incredibly empty.  They had brunch specials going on, including $2 bloody mary's and mimosas, but we were more in the mood for lunch.  Except for the bloody mary, I had to try one.  It came out in a high-ball-sized glass.  Boo!  But it was really tasty. Yay!  The hubby remembered a sign outside the restaurant a few weeks back that said they had Arrogant Bastard, and he got a 22 oz bottle for $4.75.  Hey, that's not fair!!

Next up: the wings.  We were a bit hesitant to order them when the waitress informed us that they are ""seasoned"" but not sauced, so they can't be ordered hot.  We did ask for them crispy though, and the waitress even asked the cooks to throw them back in for a few minutes when they came out not visibly crispy.  These non-traditional wings were actually pretty damn good.  The seasoning was a little spicy and salty with just a hint of sweet.  If I were in the mood for the tang and kick of Frank's Hot Sauce, these wouldn't cut it, but otherwise they were good enough to go back again for.

My entree was the Tilapia salad, and I was a bit disappointed.  The fish was a bit dry and uninspired. And the greens underneath were overdressed and wilted.  I ate the greens around the fish and picked out the almonds and Mandarin oranges, but I had to leave the mush hiding underneath the fish.

It wasn't bad enough to say I wouldn't go back, but I won't be anxiously awaiting my next trip.",review,SBbftLzfYYKItOMFwOTIJg,3,4,2,16
Pr9rQKypHgC_J1AfufxzIw,2008-12-28,vUuFuf4LYxfqbZH3lYxJfw,4,"They must have renovated this place in the last year. It is now spacious and airy and there is no longer the dreaded ""hover over a table to get a seat"" necessity.  It now reminds me much more of the dreaded ""Panera Bread"" chain in California, but the food is still much better and has much less of a ""mass produced"" feeling and taste.

The service (management, staff etc) were extremely attentive and responsive to requests as well as keeping the place extremely well clean and cleared.

I love carbs...Carbs with carbs and a side of carbs.  They serve warm syrup with their pancakes (yum!) and their bread is just amazing.  

The ""side of pancakes"" is plenty big for a meal and they are always consistent, fluffy, and tasty.  

They offer both a dark roast and a house roast for coffee and all the powdery loveliness (cinnamon, nutmeg, cocoa) to top it off just right.

Today, before returning to the land of freeways and smog and eternal sunshine(well, the other land of that anyway) we enjoyed their peppermint hot chocolate. I would highly recommend that you run on it and have this frothy goodness before the holiday season ends!",review,iFa0SLpNeLbx6aux65mNbQ,0,1,0,16
tA2DT7CGQPzgA6tTcTkXDw,2009-09-02,VyX6x7wnThr9g9Z6VBDIgA,2,"I have to add to Andrew's review.....

I just can't believe the things that happened!!

Yes the app was good.  The entree was good too, but there were bites of just bread with no chicken in the panini.  It definitely would have been better with more chicken!

But the girl working here is one of the worst waitress/bartender/hostesses EVER!

When we walked in, she didn't even sit us.  We stood there forever waiting until she finally told us to seat ourselves.  We went outside since there was nothing left inside.  It was too hot outside so we came back in and figured we'd sit at the bar.  Luckily a nice guy noticed us looking around and let us sit at the end of his table that he moved apart since his whole party didn't show up for dinner.

I was so excited when I saw they had cider on their menu!  And not just one, but two that I like!  Wyder's Pear Cider and Strongbow!!  
I ordered a Wyder's.  After I finished it and asked for another, she said they were out of them.  Okay, so I ordered a strongbow.  She came back and poured it into a glass for me.  When I took a drink it was disgusting!!  It was Boddington's!!!!  When I finally got her attention away from flirting with a man sitting at the bar to ask her for the correct drink, she told me they were out of Strongbow too!  How are you out of both drinks??  You're a restaurant.  Shouldn't it be stocked?  You're right across from a BevMo for god's sake!

When we ordered our food, he ordered the app.  Then I ordered my entree and she walked away!  She didn't even get his order!!!!  We figured it was probably for the best.  We'd split the app and the entree and eat less.  Stupid of the waitress to lose money that way, but whatever.

When she brought my food, she didn't bring the correct things.  How hard is it to remember?  She had maybe 4 tables to take care of!  Maybe if she stopped texting while she's behind the bar on her cell phone or if she'd stop having a conversation with the guy at the bar, maybe she could have done her job a little better.",review,UL9chyH0a4Pj8J_9M6WSpA,1,2,2,16
Xq9tkiHhyN_aBFswFeGLvA,2011-06-24,QqUj8brMiWkMicmlWtpPrw,4,"Went back to AB a few weekends ago, again for brunch, with a large group.  I was surprised to see that, although they advertise themselves as being a brunch place on the weekends, they have pared their menu down to basically 4 items.  The people that I invited that had never been to AB before were expecting more of a variety in brunch items since I'd told them that they had great brunch, but their concerns were quelled with a few bloody Marys and some good (if not diverse) food.  I had the egg sandwich sans bacon again (excellent again) and Sweet Pea and I split the french toast as well.  We'd only had a small sample of the french toast at the opening, so we didn't realize that it comes with this whole jar of cream and berries, in addition to the syrup.  If you come here for brunch and like french toast, you have to try it.  It's the best french toast I've ever had, and many at our table agreed.  The secret is that they bread it in cornflakes.  Yum.  And, the bloody Marys are in the excellent range, I'd say just below the phenomenal ones at Dick's/Rokerij.  The service was also friendly and quick.",review,GVH_iuoPc0aP3ZNYlWuKag,1,1,1,16
E8z9E0aFDYwC7KQuEU3GYA,2009-03-09,Y8GAudCnbK-05qkFzLsv0Q,4,"Had dinner and brunch, not on the same day...the dinner was good, although I thought the mandala masala could have used more flavor.  Brunch was great, tried 2 different tofu scrambles and both were very good.  Service is...let's say uninterested -- it's hard to be burdened with angst and chipper.",review,0NckJhx0qXykvvhsm-p7MA,1,1,0,16
F-ykHfGY9lWr12OJ_Ofy7A,2012-03-14,ty51pvsTv3KxBaeHFWFZrw,3,"Hit or miss food. I ordered the meat plate with corned beef, zuch and asparagus for the sides. Corned beef was WAY too salty, and same thin style you get on a sandwich. I sent it back for a chicken breast bone in, which was the driest chicken I have ever had. The side veggies were good (perfectly grilled no butter), and accompanied by garlic bread. I think this place has potential but I ordered wrong. I sat at the bar and service was mediocre. Price was pretty low though. Good place to watch the game.",review,DowPyTFtqen32BuOmzuBXg,0,0,0,16
uxoibUaXA-lRXM37ZV8Bsg,2008-12-20,OUhKpg-1LG7bpyxHLtbJDQ,1,"Absolutely horrendous.  This post office will lose your mail (repeatedly), laugh about it to your face, lie about it, blow it off, make it seem like it's your fault and make you wish you had sent it UPS.",review,VKiWDL608wBRQtk05ts59g,0,3,1,16
ht17atGW3tP8dFeiJkXI_g,2012-12-29,E7R_HyDkf4r0zVEuWxQl7A,3,"I met up with a few ladies here for drinks a few weeks back at the suggestion of someone else. We didn't end up playing pool, just enjoyed our drinks at the bar before moving over to a table. We were definitely over dressed and probably out of place, but it was a chill place to let loose. Drinks were okay, food was nothing outstanding, prices were to be expected.",review,6OWHDbEq23f24Vki_veHBA,0,0,0,16
HvfefhU4b38wcSulkBzA1A,2012-11-05,a5WztkUFN4onrcG1NMoYuQ,5,The praise and worship with Pastor BJ just sets up a God Filled service with the charismatic and awesome Pastor Maiden ... Going the Past 18 months has made our Marriage Stronger and Faith Magical,review,hLi9rdbx4cXBklc4osQEJA,0,0,0,16
E4b5OC_6mZ0V7B6Nyjncsg,2012-01-13,VdD-2K_izVXf9nd912TkXg,2,"My girlfriend liked this place more than I did. It may be that I'm spoiled by eating asian food in the Bay Area, but this place just didn't cut it. Unfortunately we both got red curry based dishes, so my experience was fairly limited... I got Duck w/red curry, and was not very impressed at all. The duck was tasty, but the curry was VERY bland. Honestly had I not been told it was curry, I wouldn't really have identified it as curry. The duck came with some plain steamed vegetables on the side, which as the meal went on, served to further water down my already bland curry sauce as the veggie water moved around on the plate. In addition to the curry lacking flavor, the vegetables really needed a boost as well. They should have been stir fried, or been served with a sauce of some sort. 

The service was OK, but not great. There was only one other table in there, and the waitress seemed to forget things, and when we asked her about the meals, I felt like she was giving us canned answers of ""everything is good, just order something so I can go home"". Admittedly it was about 30 or 45 minutes before they closed, so that may have had something to do with it. 

It wasn't a BAD meal by any means. It accomplished the goal of providing nourishment, and was better than bringing mickey D's back to the hotel room, but I won't be going back. The yelp definition of 2 stars is ""Meh. I've experienced better"", and I think that description fits my meal perfectly.",review,-V3CXSxnUzjkLVqi1xGrkA,0,0,0,16
8qrICL2tS2Rq7b5gxUdQwQ,2011-03-23,JBif92bIAelSfHoH39fSag,4,"I was fairly surprised to visit Line Thai and find some decently authentic, good-tasting Thai food. I'd always assumed that this area of Phoenix was (excuse me for the pun) totally dry on ethnic food, considering I had a hard time finding pho within a ten-mile radius of my parents' place in Surprise.

Anyways, I chose the pad si yew (spelling varies all over the place, I think they spell it ""phat si iew"") and my father ordered some kind of chicken cashew dish. Both were excellent, though a little more in the line of American tastes -- not as spicy, and the pad si yew wasn't cooked slightly burnt like I recall it traditionally is made -- it was pretty tasty.

The hot tea was a great companion to my meal as well.

The service was great without being too pushy, invasive, or sloppy. They always refilled my water in a timely manner and didn't interrupt my conversation with my dad. That's important to me -- that servers don't bust into your conversation with little to no consideration of personal space.

My parents had been there several times and enjoyed it, so now I see why they liked it. Oh, and their spring rolls and the accompanying peanut and hot sauces were also delicious -- not the best I've ever had but super-tasty.

The atmosphere is a little dry (what is it with this word? Sorry) but I can live with it. The booths were comfy and it's not like the place was musty or gross. Not every good restaurant needs to be chic and trendy, really.

All in all, it was a nice experience at a reasonable price and I'll definitely make a visit next time I hang out with the 'rents.",review,vOw4NYgKe57qcJ5fOjk6PQ,0,0,1,16
hh2lP4_2N-tk_OxmaTf_qA,2009-09-01,MFIB6AA1sP7gq49z0Bh29w,4,"Yes, the view is wonderful. Absolutely. 

Sadly, my table was near the entrance, limiting my ability to enjoy said view. Also, we are still in the summer months, so I was confused that there was a fire raging outside at night. 

The decor is wonderful, dark with different tones and moods. We arrived in the early evening, so I was surprised to see how dark the room would eventually become. I didn't find the table and its decor that exciting, but it will give it a pass. Not everything has to be practical art.

Our party consisted of five and we were certainly treated to a good sampling of what this place had to offer. Half of the party ordered off of the set price menu. This included a three course meal for something like fifty dollars. It may have even been less than that, but I'm not sure. This menu had an array of choices and wasn't limited to chicken or pork. 

I was impressed with the portions and the quality. The salads were crisp and the dressing wasn't overpowering, more of an accent, the way it should be. The meat was tender and flavorful; our table ordered the NY, Ribeye and Salmon. I do agree with others who said that the sides were a little small, but I do think they were worth the price. I know for sure the cream of corn was, as it was treated with green chili and a bit of spice. 

The desert was alright. Not a great deal of variety. The textures were spot on, but the temperatures seems a bit off. If a dish was intended to be served warm, it was slightly too cold, etc.

The service was bad. Probably the worst service I've had at any restaurant. Our server left items off of the tab, forcing her to return and run the debit card three separate times. I am okay with someone making a mistake, but it should not take two attempts to correct. Also, my wife and I ordered Mojitos. They were very average. No sugar, which I assumed was standard fare for Mojiots, and amount of mint was rather low. I understand that drinks are open to a bartender's whim, so I won't dwell on this fact.

Valet had a bit of trouble with our car and keys, which was annoying.

Overall, I enjoyed my experience, food and atmosphere alike. However, the service did bring me down a bit.",review,syF-6VzPdjmCXbTye6N9Eg,0,0,0,16
qMkIbQFrROSnPaQ7at85-w,2010-02-13,lkW5sIbOqiYRQbkpera8dg,4,"I agree with others that it seems a bit expensive at $15- but that still would not steer me away from going.

For the first time in about 8 years I found myself at the DBG with some out of town family. Wanting to enjoy the weather (since they had just escaped the cold grey winter of Detroit) the gardens were the perfect spot. The garden is equipped with wide paths and plenty of benches to help the old timers pace themselves. It helps remind us city dwellers of the beauty the desert can have and how unique Phoenix truly is.",review,gTCM7qlVrwdml-hFB6aJqQ,2,2,2,16
8oxnPoOS5wQzhl5LLOm7ow,2010-07-25,DCCqJzKnPARsxymujSUkAA,5,"Awesome country club. Great new remodled gym, heated Olympic pool for year round use.  Love the family like atmosphere, plenty of planned family events/pool parties. 

Only complaint, wish members who didn't pay for the monthy tennis membership could still rent a court on a need by need basis.   Regardless courts are top notch, great facilities and friendly staff.",review,_OLBq0aZR7K-UdPCrByatg,0,2,0,16
ntN85eu27C04nwyPa8IHtw,2011-01-01,s2NkuLh0UBmCvHvLwJFBPQ,4,"I'm  going to stop being such a taker, and give for once! I use Yelp along with other reputable websites to help make my dining, travel and shopping decisions and I never take the time to give back!! I know, I know....awful. I'm turning over a new leaf! Here is my first Yelp. Please don't judge. It's my first time.... Okay, here goes. So, I went to Matt's for the first time a few days ago....

Food- Amazing.  Best pancakes ever! I'm not sure what the secret ingredient is but they are beyond good! Fluffy little cakes of love. I also tasted the butter burger. Very, very, yummy. If you decide to dine here make sure you try the bacon. I don't think I've ever tasted anything like it. Sweet, savory and cooked just right.

The building is very small, the wait is extra long and make sure you don't overindulge on the free refills of ice tea because there is NO BATHROOM!! The seating is cramped and the service is rushed, but the food is worth dealing with Matt's shortcomings.",review,wdtoa9VgowEdiYudN8T1YQ,2,1,0,16
O-Xa9GCFWI65YiBD5Jw_hA,2009-10-29,nlQUxEm_5GouQdmgG8GXVA,5,"What an unbelievable night we had at Mastro's City Hall Steakhouse. Everything we ate was top notch, the atmosphere is fun, and the service is spectacular. How many steakhouses play Jim Croce, Beatles, and Beach Boys? It's a very welcome change.

It's dark, it's sexy, and it's probably the best steakhouse in Arizona. 

The seafood tower featured totally fresh and delicious oysters, crab legs, claws, and huge shrimp. My Kansas City Strip was out of this world and probably the best piece of meat I've had all year. Gorgonzola mac & cheese and sauteed mushrooms were real winners as well. I'm not a dessert person, but the warm butter cake should be illegal it's so good. I was stuffed already when it came to the table, and then I ate all of it. 

The only hiccup all night was our seafood tower was short a shrimp, and when I told the waiter don't worry about it he said ok, and then proceeded to bring us a fourth shrimp on it's own bed of ice. It was a really top notch recovery. This place is absolutely amazing.",review,JgDkCER12uiv4lbpmkZ9VA,1,2,0,16
M6fjHpkL9IRI-nI0BattRw,2011-01-24,9J6zDTYyPjMqDC-KUQIE3Q,4,"I'm still feelin the love. A most wonderful combination found I today of simple delightful food, a laid back atmosphere, warm staff, dog-friendly accommodations, a vegan-friendly menu and... oh yeah... all day Monday Happy Hour.  

Thank you TMI for the immediate bowl of water set down for my hound, the speedy $4 glass of red, and a yummy manageably-sized veg sandwich. I couldn't have asked for a better ending to this much dreaded Monday. It was lovely winding down and enjoying the sunset while other suckers waited in traffic.

I second Sarah G's enthusiasm for Sophie's salad sans mozzarella. Mmmm mmmm arthichoke. My next mission is the Cash Money sammie with house made cashew butter (wha?!) Cabernet jelly AND bananas. It's like Elvis met Sophia Lauren and decided to class it up. Soon will I be back to attempt such an adventure. Very soon.",review,FHDI8M5sm6lrZXNUBZAOfA,1,5,1,16
VEojEXbJ81eiPLSSF9jNEQ,2008-08-13,8ZC2ymJRf81mGgRKpBWOmQ,4,"It has been several months but I hadn't lost the formula (80/10/10 - veggies, meat, noodles).  Pat down some chicken-turkey (no taste difference as far as I can tell) with the wax paper.  Load up with mostly veggies (more green than red or white), add some wheat noodles to fill the bowl to the brim.  Follow with the sweet and sour mix but add some extra vinegar and orange sauce.  Add some pineapple and all set to have it grilled.  Fill a small bowl with peanuts and another small bowl with pineapple.  Fill the large red plastic drinking vessel with ice and low cal lemonade.  Then chow down...

My formula has more or less stayed the same since being introduced to YC's by Mike T and/or Erik T.  Both took different approaches and none tasted like the other despite selecting choices from the same line.  Amazing how three related people ended up with very different meals especially Erik T with cod fish and Mike T with who knows what kind of sauces except they were very dark.",review,J72XoQspNBmPsX2iKl2YvA,2,2,1,16
oLYOGtdW5RxvaBiSdv3WCw,2011-11-03,DvMquoPKQFWFkkmzbfFQOA,4,"This is my favorite breakfast/brunch spot. Fresh bagels and different types of cream cheese.

They even have Bagel Thins for those who are cutting their carbs. 

You don't pay the person who took you order, but move down the line to pay for your food.

Their iced coffee are a great deal!! It's a 20oz cup for less than $3!",review,chI2p-ROg2tXI2-tT2_G2A,0,0,0,16
B8ujMtvvpHyEQ2r_QlAT2w,2008-11-26,7yfWeorPMnVrI0X4xRgbnA,5,"I am ready to update you to a five because the last three times I have been there, your service has been better, the huevos rancheros has been consistently perfect, I have never had to wait for a seat at the bar and I want to hug the cute new bartender because she is quirkily cute!! 

If you were still serving breakfast at 6pm, I would come eat you now.",review,MWt24-6bfv_OHLKhwMQ0Tw,7,7,5,16
vN4mFODLd-gLmDg261wsyw,2011-09-05,-8a9TktdvoC01Xm69S6Q7w,4,Our visit to Scottsdale brought us into Fountain Hills to look for a home. While we were there we decided to look at the beautiful fountain we heard so much about. That's when we happened upon this place. The pizza was fantastic!!! It made us want to move here even more. Delicious!,review,cZgbUqTxXV0-EIzRZEKlQg,0,0,0,16
C6gkuLYG_NOobXxaXwUUpA,2007-03-08,WowIQci4KEfcKZEeAdydmA,1,"this another place that i would give no stars to if possible. 
it's been on the corner of mill and university for as long as i can remember, which is impressive since nothing older than ten years has been able to withstand the rent increases, and even more impressive because i don't know a single person who goes there.

i went in there one time, for drinks and walked past one of the foulest salad bars I've ever seen. for some reason, it's right by the door. instead of walking in to see a hostess stand you walk right into this brown mess of vegetables.

after seeing that first off, i wouldn't dream of ordering food here. the place is also dark and dirty and there's never anyone inside of it.

seriously, I'm really curious how this place survives. awesome little neighborhood wing and live music joints like long Wong's get torn down for high rise condos, yet gross, ghost town ruby Tuesdays hangs on the corner of main and main of Tempe. what is wrong with the world?",review,7GC9fVWKa4a1ZmBGLH6Uww,0,0,0,16
LYyGQgL60VKdV-p_9OxmWQ,2011-08-07,3UvVKx-DAJNFPbWb1F4Whg,4,"I have been here a few times, but mainly at dinner.  Dinner Has always been great, great waiters and staff, with a LCD TV playing almost famous famous bolywood movies.  LOL  It cracks me up when they dance.....LOL...anyhow, Great vegetarian choices for people who eat there veggies, but trust me, I am a MEAT eater,  Chicekn Tika masala, Little dry but still good.  My favorite is there Palak Paneer. Great for the vegetarian.  I have also tried there lunch Buffet for 11.00.  I give a Thumbs up..  Good, serve yourself, and pig out!!!!!!",review,Y_ZITL9cYCKgBgDCwUQrow,0,0,0,16
V1nEpIRmEa1768oj_tuxeQ,2008-11-23,zXODym69r8pyX7KOlOoXPQ,5,"Alright, went back last night, felt bad because we were the late nighters, and everything was perfect.  The pizza, the salads and the wine were all so well done.  And what finally brought me to five stars was the crepe with Nuteila and Mascarpone.  OMG amazing.  I'm currently craving it the day after.  Totally beats out the crepe with nutella and banana that I also love...",review,OqisxqKDGaZwEvLm1OG4dg,1,0,0,16
uKSX1n1RoAzGq4bV8GPHVg,2012-07-03,LAaZfL4zmsz495H-vME-oQ,4,"I have been to St. Francis twice - once for brunch and once for dinner. The brunch deserves 5 stars, we had great service and great food. Their bread was AMAZING! We had great service for dinner, but the food wasn't up to what I was expecting. Things were a little bland and the sauces on all the dishes was a little heavy. However, overall I would definitely recommend them.",review,7k5mTaDV609kLd8QFqYznw,1,2,0,16
QKGZajo_Xm6AW3lHkU9Mmg,2011-03-31,S5wVFzi3VreZMzi_EluILg,5,"Bring a flashlight. It is so dark inside you can not read the menu. But the waiter was so well versed we just used his recommendations. 

We all had filets cooked to perfection and served on a 400 degree hot plate. They recommend the lobster mashed potatoes but did not feel they were worth the price tag.

The wine list is extensive and expensive.  If you are looking for fancy this is the place but we went after a round of golf and they were very accommodating . 

Great special occasion dinner but not your everyday steak joint .",review,cMNHD4NWHvsKhmJlx5F3ag,0,0,0,16
ShUSw5yD7EFWBOiq_CuHMQ,2010-03-04,XYLQ-2MnnhKiwR3umVIVeA,5,"Oh, YEAH!!! Coming to Scottsdale. I have used RedSeven in Tempe and Mesa and excited to know that they are coming to Scottsdale. I work on the roads throughout the valley and have a lot of customers in Scottsdale that I continue to brag to them about RedSeven's Super Quick Service. Getting the job done quick and right and guaranteed to be the fastest to get you back to work!!!! Oh, and they talk to you so you can understand, not computer talk. Can't wait for Scottsdale!!!!",review,dKMzuhnwGh3hGxP0QH7m6Q,2,1,1,16
