business_id,date,review_id,stars,text,type,user_id,cool,useful,funny,bucket
4CsZK1YOP8lCLH9ZSf0LMA,2008-07-09,LLqoetmzmYnGlQyAFY5o0Q,3,"My boyfriend and I were searching for a dive near our house in Old Town for when we just aren't feeling the typical Scottsdale vibe.  I gotta tell you, I think we found it.  

We walked in around 7 on a Thursday night, just looking to have a few drinks and some time to talk.  I immediately realized this was not an Old Town bar.  I think I might have been the youngest person there and no one was pretentious at all.  They have a dart board and pool table, and seating with walled mirrors all around.  The patio was extremely well-misted, which was great since it was the day before 4th of July and everyone was pretty much sweltering.  Drinks were stiff and not too expensive and the crowd grew younger as the night went on.  I didn't meet tons of people, but the ones iI did either seemed drunk, super nice or both - not a bad combination.  

I would go back again, just not every night (what do you think I am, an alcoholic?)

Also - for those of you with bladders of steel and small wallets, I saw a sign that says they do bladder buster deals on Tuesday night.  Small cover and incredibly cheap drinks until someone ""breaks the seal"".  I would suck at this, but I'm sure many a person has taken advantage of this interesting drink special.",review,bfuVbKov5Uwcha6-l4ikFg,4,2,2,0
ntN85eu27C04nwyPa8IHtw,2009-07-06,4-YEkM3zfYdw4V2gGQvsuw,2,"Had great expectations after highly recommended by others. The breakfast was good, nothing extraordinary though. The service was a disappointment, server was very forgetful and put off by some simple requests. It doesn't look like they need my business though, considering the line to get in. I probably wont be back.",review,ZsqSDOeYGb-DinY6x3-YgQ,1,1,1,0
Tsff0UUVgrnawjI_xd2cKg,2010-04-14,tTYPCGbGhqm5keMpAIGcFQ,4,"I drove by last night and noticed the sign and decided I needed to check it out. So I stopped by for a late lunch and was the only one in the place which made for some nice time to chat with the owner and her mother, who was the one whipping up the great food in the kitchen. 

They've only been open since February and had relied on fliers and the painted signs on the windows to attract customers. While I was there, supremely enjoying the chicken curry roti, a few other people came in because they drove by and saw the sign. 

I couldn't decide between the jerk chicken or the curry for my roti, so I was given samples of both. I thought the jerk chicken was a little too hot for me, but the curry still was able to clear out my sinuses. Wow - slow burn! I was told they could tone down the heat upon request. I'm not sure I'd want to ruin the experience, though. 

The menu looked interesting - goat curry, oxtail - along with the jerk and the curry options. I opted for the guava nectar to drink (so yummy!). 

This is in my neighborhood so I'll definitely be back to try some more. The atmosphere was comfortable and I was encouraged to linger longer, but I needed to get on with my day. The food and the music piped in made me feel like I took a mini-vacation. Nice.",review,XwBwRIFEaWjT25bQew911Q,1,3,1,0
m3EKlucZuwnOazLrRfnWaQ,2011-12-30,HmkQwFSrUADN-_uIYFc2vw,5,"New owners are awesome!!!!!  Good people, earnest in providing a great product with great service.  The restaurant is beautiful too.  My mouth starts watering right when I walk in the door.  Go check them out!!!!",review,PqYFEM5fDDJmlxuVFB87Kw,1,2,2,0
R3sbDS0YcJDedSmUjwE48Q,2012-02-06,rtRPHXhtXAz4cGooTShXNw,4,"Stopped by for a quick bite on a Saturday afternoon. Did not realize that the place had just opened (or at it appeared that way). Quite crowded with patrons, a bubble machine, and a DJ. 

It was bit loud with all the commotion, but still within reason. The menu is compact, but offered all the usual suspects. I went for the Pulled Pork sandwich with a side of cole slaw. I dumped the cole slaw on top of the pork and went to town on the sandwich. Meat was moist and smoky. The sauce had a hint of of kick. Very tasty.

The service was a bit slow, but the place was pretty much full up so I expected it to take a bit of time.

Good joint. Would return.",review,5_JuHOYNL3skhzxZzPESSQ,1,1,0,0
YzHtlphJ-5LDtJdNzKs7Fg,2011-10-06,pqVP8OW7KZM8OWHZ7QQ7lA,5,"ALTERNATIVE!!

That's what this place is and in the land of BIG chains, this only could add some spice. We were welcomed here to the free screening of Dale and Tucker Vs Evil as part of a Yelp event. The personnel is totally committed to their project. 

If you are looking some retro movies or the gender I don't enjoy (but others do - horror), this is a good alternative.",review,LqgGgWi3FLHBViX9tmZ9sw,1,3,1,0
ToJ9eJ9pKZXhlVyUmCFnJw,2009-04-19,Bq9F2a-ydPcg8I09U-1dSQ,3,"About 1.6 miles roundtrip from the Maricopa Ramada.  Pretty cool little climb, but then you end up on a road heading to the summit.  Near the top, you get to go offroad for a bit to the very top.  You can see 7th St go all the way downtown.

Total time up and back was 50:12.  Pretty easy hike.  This was my third of four mountains, one Saturday in April.",review,pIm17SVRo8IdhGoBD4qbnA,2,2,0,0
5kuZhkdpKKu9d_dTflOh4A,2008-06-01,T2ccFelKcV0iD3KOKMpdnQ,4,"Totally a locals hangout.

This very unpretentious wine bar is a favorite.  The owner, Darlene, has a great selection of wines from smaller labels for you to try.  If you're not sure what to get they'll help you find a bottle in your price range.  They've got the cheap stuff all the way to the $80+ range (if you feel like spending some money).

You can buy a bottle at retail, open it up at their bar and enjoy it with a nosh.  Lots of smaller appetizers (cheese and crackers, etc).  Or, order by the glass/flight from their bar.

Checkout their website before you go.  Or if you live in the area, subscribe to their email newsletter.  There is something different going on every day (live music, tastings, specials, etc.)",review,v2rbY-d-yam7Qbfb9jkbQg,2,3,0,0
SOHp2b8quJEitFeuO58Syw,2009-03-15,yTJg-gv3kFDVYpdS-CoIlg,4,"This place is all about the seafood.  Don't roll up to the Fish Market expecting a cool place to hang or a hip crowd.  No problem on the crowd...lots of folks in a pretty basic seafood restaurant, chowing on the best seafood I've had in the valley so far.  The hip is not here.  Not until I showed up with my wife Audrey W to meet Kevin H and Marian H.  You could actually see the coolness spread around the restaurant when we walked in...a subtle ripple, sort of like a gentle wave at a spring training game.

So I arrived in Phoenix from Boston and have high standards for seafood.  I had been craving fish & chips for awhile and decided to give Fish Market a try.  I got a combo-fish, scallops and prawns.  The batter was light and not very oily...+1.  The prawns were very tender and done to perfection..+1.  The scallops were tender, sweet and juicy...+1.  The fish was done just right as well although it was not the haddock or even cod I am accustomed to in Boston.

Everyone else was pleased with their food as well.  I will be trying other seafood places in the valley but I'll keep Fish Market in mind as a standby.",review,P2kVk4cIWyK4e4h14RhK-Q,9,9,5,0
4VzaYvZntWBRbr8VmwCiWg,2012-06-21,5h0EVAee-RDbbKfhd6FB0g,5,A great value for a far superior hair cut than are likely to get from a national chain.  We have been going to Tara for 3 years and she has created a warm and friendly environment that kids love.  There are plenty of TV's for kids to watch a show if they are not big fans of haircuts.,review,feQpvbp8jGBWMuG5uqbk3Q,2,1,0,0
FV0BkoGOd3Yu_eJnXY15ZA,2009-08-04,vF2SFJC6-3U6qE8CheSr4Q,3,"Awesome location, cool place....the Chopped Salad is by far the most amazing salad I have ever had in my life (but way...and I mean way to small)...If it were double the portion for the price I would probably visit more. I had a flight when I was there...it took forever (as I know flights are supposed to)...but this was ridiculous...the buffalo meat is so gross...it reminds me of when a stray dog visits my lawn...

The BBQ sauce is good....the staff is just OK. Nothing mind blowing. I think staff in a place with a pricey menu should spoil the guests a bit...Give away a free desert when you know the service and meal is just OK...this may bring your customer base back to visit just because you redeemed yourself at the end.

Overall its a cool place. It fits with the downtown Scottsdale lifestyle. But stay away from the buffalo, because it will give doggy bag a whole new meaning....",review,02LanstxBzqF_foJ8kFTBA,1,1,1,0
vvMR0jgDoBA-g1XgZy8sEg,2012-03-10,IYPLbiHWGgfQxlBQm5w2Cw,4,Food was really good. You could tell it's good quality. Our service was not so good.  Workers are friendly but were having bad day on service.,review,EZ_Qltx0iJyDN--HzLcXQg,0,1,0,0
jEkaxdgLxUCf4jtUnCPVWg,2009-12-31,OYyRWmDTF0T4ywmGKMeqBA,3,"YogurtBuilderz provides a good sized dining area with many choices of yogurt and toppings. I did find it a little difficult to locate when I attempted to find the building - it is tucked away in the back corner of a strip mall parking lot. It was dark, late at night and took a few passes around the parking lot to zero in on the location. The staff was very friendly and the place was busy even for a Sunday night. For the staff and selection I give it a 3 star rating. It was good, but I didn't find it any different than the growing list of competition. 

I know this place is popular and self-serve frozen yogurt establishments are all the rage now. The economic model is great - you pay by the ounce and have your choice of any variety of yogurt and any topping available. Customers have the opportunity to build it as they wish, which allows those with specific tastes to have their wants fulfilled more so than a traditional store offering the generic selection of choices. 

All of that in mind, I don't like it (the industry). Too many choices creates an opportunity for indecision and slows down the lines as people stand around wondering what to put in it next. For those new to the game, you can create something that turns out to be rather nasty - for example, the white chocolate sauce is really very sweet and I find if mixed with other toppings makes it almost unbearable. The other reason I do not like these places is that I do not like to pay for food that I then have to make and serve myself. I go to restaurants and pay for a meal rather than cook it at home because a) I don't like doing it and b) I am horrific at it. While frozen yogurt does not require much preparation, there is still some assembly required. If I am paying, I prefer to have it built for me. But I realize I am in the minority. As popular as these chains are becoming I wouldn't be surprised to see ""FroYo"" overtake ""unfriend"" as word of the year in 2010.",review,zCC6huLkNBEr3JUgQyxJbg,0,0,1,0
8H1DwdAAgSBtwDeb2R-hmA,2011-03-02,g2c2DT7vafkVyBN_6vJwig,5,"Love Bagel Nosh! The staff is so friendly and of course the food is delicious! I have to admit that the pumpkin latte was no Starbucks pumpkin latte, but the pumpkin cream cheese was amazing! ( I do realize it's no longer pumpkin season, I was just wishing I had some anyway) It can get busy on the weekend mornings, esp since the bike shop opened up next door, but I find it well worth the wait! (Oh, and fyi it closes at 2:30 - so get your coffee early!)",review,GSZebDbIf0h_2MFv8xBGrw,0,0,0,0
jgbEZzERVI4yvAAtXWW93A,2009-12-10,cq6yROcgQteOA2n0R5C7XQ,3,"Food was good, I had the Frutti de Mare with red sauce and boy it is spicy, so be warned. Everyone else ordered the Spaghetti Pie, which was the special that night. It was OK, my mom's is better. The service was good, but the wait for a table was over an hour. Of course if was a Saturday night and they are having Glendale Glitters so it was really busy. The pizza is good, I have had it before, I am not the biggest wood fire pizza fan, because it is always burned on the bottom!",review,tfYiqaLU5swUfMO9JJp9Dg,0,0,0,0
ypEtwQHobNJCZvPONO38WQ,2011-10-08,EQwasbNyl0Hg74rzrkajdA,5,"Fantastic experience from valet to dessert!! Boyfriend and I were both very impressed. We were graciously greeted the moment we walked in by a man in a suit who walked us to the restaurant. Our server was knowledgeable about all the items on the menu and suggested some things to try when we were waffling between a few different choices. Cheese trio platter was sooooo good. I'll be getting that every time we come here and it was the perfect size for the two of us to share. I had the beet salad which was very good. Love the candied walnuts in it. Boyfriend had the lamb which he said was perfect: Tender, juicy and delicious!  The breads that came at the beginning of the meal were obviously homemade and fresh. Even the coffee was good. It's very rare for us to find a place that does it right so completely but I think we've found it.  Service was fantastic! Our glasses were never empty and we were well attended without being pestered. Could it be possible I can't find anything to criticize?! I can't. Love this place.",review,-IQPD7ZO9n7iwUeHBhLJ9A,0,1,0,0
0gQrhOYWdO0XVZEKtOrvaA,2011-03-03,qAstxuzTbZ71zWnnkdTNSQ,4,"Ok here is the deal with Red Devil Pizza.  The key to making pizza with crispy crust is to have ovens that great sufficiently hot.  That is why I like places with brick over pizza's. They don't use Brick Ovens at Red Devil but  I have been told that Red Devil has some really old pizza ovens that are not available any longer or hard to get.  I can't verify that, I don't even remember who told me that, maybe I read it some where.  Don't know if it is true or not. What I do know is that Red Devil is one of my favorite pizza place in the Valley.  Their pizza is consistently good.  Thin-Crisp and delicious.  I have had pasta's and salads there as well. They are fine, nothing to get excited about. But the Pizza at Red Devil is something I will stake my reputation on.  Actually I don't really have a reputation, but if I did I would lay it on the line for Red Devil Pizza. The long and short of it is, I am very passionate about their Pizza.  Period.",review,TxOR39w0Mlbd4h1siXyb_w,1,1,0,0
CFaRVxsnN4Zjf28cbORKIA,2009-07-22,0Xdu6erUtv2yEPfZngciDA,2,"Gross, tasteless food.  Good margaritas.",review,N2rvehlxiGV9uN7BjF1ocw,1,2,2,0
TgxDGx7L_JICWbuBUCGVqw,2007-03-29,OYvDDPx5bXoGFfzAS4nSbA,3,"Fajitas is one of those places where you may go for an occasional, unmemorable lunch. Nothing is gross. Nothing is exceptional. Everything is just, well, there. I've tried different variations of the fajitas theme over several lunches (chicken, steak, veggie, etc.) and they were all ok. Not a big fan of their tortillas, though.

If you work anywhere near there, then I'd say go ahead. It's a safe bet for lunch. You won't puke or curse the world. But is it a joint where I'm saying, ""Dude, you GOTTA try this place out""? Nah. You've had better fajitas elsewhere...

3 Stars.",review,htC49ZwXiKNka5cp0GKBfQ,2,3,1,0
uVMKdpleBePeFKjixU6AMQ,2011-12-04,tY-aFKrdW6A7vmD6v4Rcmw,1,"I am writing this review only for the optical department. I accidentally poked my eye with a branch yesterday and knew I had damaged it so I went to the Gilbert Costco optician and asked if I could be seeing on an emergency basis. The receptionist asked me if I could come back in 5 hours to which I stated it was an emergency and could asked the Dr if she could see me. She asked her and she said no she did not have time.
I find it very unbelievable that on an emergency basis they can turn someone away who has a Costco optics patient for years. I recognize that she had a patient at the time but I said I could wait until after so she could at least take 5 minutes to tell me if I should go to a hospital or not. Dont ever waste your time going here if you need immediate attention for an emergency because they will not make room for you.",review,chBwUUum9UHC9C2AVBOZfw,0,0,2,0
MLcXtnpzygZvQ9BtseLLlw,2008-03-18,QDNDXDz4yoOFblq1ffW1ig,5,love love love it! What a quaint little piece of heaven. Located south phoenix...I wasn't sure what this place would look like as we kept driving south but as we walked onto the property it felt as if you were no longer in the big overcrowded city. We went to the morning glory cafe for breakfast. The food was wonderful and the presentation was great! I highly recommend it. It would make a wonderful place for a baby or wedding shower!!,review,49lK33nuV1dVj3l2Jto8Bg,0,2,0,0
PXmR1MgOAWB066XH20HjxQ,2009-10-04,G2te72TqN0W0jcG-A0Q_bg,2,"I had dinner at the Thai Rama two days ago. It wasn't an awful dining experience, but I'm not sure I would go here again. 

My friend and I ordered the egg rolls (sorry, I don't remember the Thai name), and they were okay. Two pieces, small (but the price was $2, so what did I expect?), and an average filling - something I would expect from frozen egg rolls.

We're both vegetarians and were happy to see a vegetarian section in the menu, but were slightly disappointed with the options. Three of the items included oyster sauce, and the other three were either vegetarian fried rice or red/green curry vegetables. I ordered the green curry vegetables (medium hot), and my friend ordered the red curry vegetables (mild - and she stressed MILD). We waited 20 minutes for our dinner to arrive. I didn't mind my dish - it was waaaaay spicier than medium, but I don't mind a little heat. The sauce was very runny, and the vegetables were soggy and looked they had been sitting in the sauce for quite a while. My friend didn't like her dish at all, mostly because it was quite spicy for being a mild dish. We spent $25 total, and I'm not sure it was worth it.

The service was slow, but the waitresses were very friendly. Overall, I would probably not recommend this restaurant to a friend.",review,kMiQnYFmAYbjHyyIPGSwoA,1,1,1,0
V5QdxePG-pGPXVPHSLLM9A,2012-09-05,60EpHGOBKM9Pt2EwiFSjng,2,"I'm sitting here as I write this.I'm thoroughly unimpressed. 

With its bare white walls and sparse attempts at decor, this place is overly and unreasonably obnoxious. Despite not being crowded, and there never being more than one person in front of me each time, I had to wait on line.  With two people working behind the counter there's no reason to forget my order or make me wait 5+ minutes each time I needed something (to get my coffee, to ask for the Internet password, and then to remind them that I ordered coffee). Unfortunately the coffee supplied was  mediocre as best. Disruptive music selection that was too damn loud. Annoying..thank God for pandora.com, a good set of ear-bud, and reasonable wi-fi or I never would have gotten any work done.

The only reason I'd come back here is if my son had another concert to attend nearby. Needless to say, I do not recommend.",review,MKZh-O5OLJcR1exReXhJHQ,0,0,0,0
r4ggW7POeNX0ta6spkT4Kg,2011-03-30,oojL4rm4wxxUoEn5rfzviw,4,"Had a fantastic massage with Liz.  She knew all the muscle structure and pressure points.  Though not the fanciest of places, it's perfect if you just need to get a massage.  If you want to be pampered and get the spa feel, this may not be your place.  For me, my back hurt from sleeping crooked and I left feeling much better.",review,hGyKkRaJkOpl6jagEZAWcg,0,0,0,0
cLojUtqkFpVIHFEvA_5Atw,2012-06-06,n4I-pdVv7Ayk9Kzzkxfo8g,5,"I recommend making OpenTable reservations, as this place is small. 
I had a great dining experience and I enjoyed the drinks and food. Margaret (sp) was a great server.

I like to dine at local places like this, particularly those that make their drink mixes in house and use locally sourced food [when possible].

The drinks I had were great: Aloe Arizona, The Kingston Rum Punch and Piña Colada Redux

I had a dish with red snapper and vegetables; which was excellent. I had rice and peas on the side, the rice was not the best however; it seemed too dry.
My friend had the prawns, I did not taste it, but the presentation looked good. She also had the coconut water which was served in a coconut - it was great and she mentioned it complimented the prawn dish.

For desert I had a Créme Brûlée made with pineapple and rum.",review,LvGC0do89uWKWbNrqFFwHA,1,1,0,0
Xh7lpLo9TxodWgV5VdWeiA,2012-10-07,V-MMwDZ7GcxAsiIDqW7tpw,3,"In 1999 the AZ Republic Voted Abacus Inn Best Chinese in the Valley. That is sad because Chinese can be so much better.

 But I do have to say that Abacus Inn does something nice that I don't see too often in other Chinese Restaurants. They give you hot tea and water and fresh fried noodles with sauces when you are seated. 

I had the Yui Shan Chicken, it was a fail because of the inedible Shiitake Mushroom stems in my dish.  Trying to eat the mushroom stem was like trying to chew a car tire but, I do have to admit the sauce was more developed than any sauced dishes I tried from the surrounding Chinese Restaurants including Bamboo Cafe, Ginger China Bistro, and Shangri La. I LIKED the use of cucumber in the dish was light and tasty and successful. Unfortunately the white meat chicken was dry. Maybe a THIRD STRING cook was on the day I was here and maybe this dish is normally prepared better?

The sautéed spicy beef was more successful. The beef was very well prepared and unlike the Yui Shan dish this Spicy Beef REALLY WAS VERY SPICY. I am used to a more developed and balanced Szechuan sauce so I wasn't a fan of this dish from here. But I do note this sauce was better than what you'd get from surrounding Chinese Restaurants.

The last time I was here I had the sizzling rice dish and that one impressed me because they cook the rice quickly in a very hot oil and puff the rice.

It's a toss up between Abacus Inn and Shangri la . Abacus does some more impressive stuff but Shangri la does cook moist chicken.",review,p7dvahRPZIWL7T6pFA_0dg,1,1,1,0
t30AlUH_aankqRnsJ0wxpg,2011-12-23,6sJvjJXQtjJSjl65LEXEZQ,5,"I took my daughter there to get her nose pierced for her birthday, they were very nice and professional and made her feel comfortable.  Its a nice shop and they were very friendly and did a great job.  I will definitely recommend them!",review,O0B1CSVV8HQBN2ruLKckdg,0,1,0,0
rua7dvP6-SUXL4N8RTY--A,2011-06-03,nOO3ucT1scy031sCbTuN_A,2,"Please for the love of God, don't microwave eggs.

If not for that, this review would be a 3 or 3.5 stars, but seriously, eggs don't like microwavization. Just ruined the whole panini egg sandwich for me.

The coffee was pretty good. They had a selection of 4 going from light to dark which is nice. Lots of places have you choosing between a full city and a french which is frustrating.

Service was very friendly, but a tad slow for the number of people that were working there. I think they were focused on a lot of large pickup orders, but when you sell bagels by the barrel, you should expect that.

Saw some people picking up said bagel barrels, they mentioned how their office would cheer upon their arrival and heap laurels and praise on their shoulders. They boasted that their upcoming performance review was assuredly positive with such accolades. I smiled at them and wished them the best in their fantasy worlds. 

Scottsdale methinks is full of fantasy in this desert oasis.",review,-Q0yfgIXTRU2CSZNf4mcog,0,0,0,0
w7SrsFV4FL04bhQr-B6-4w,2012-01-12,l2evqKZLWTgTh8kDBiw00w,2,"2.5 stars

The short: Open and clean setup with friendly staff, but it's basically just-ok carby kid food.

The long: On the south side of Thomas, just west of 44th St., turning left into the lot can be a bear during peak traffic, but it's otherwise fairly accessible for people driving in from the west or walking up, like I did. The inside is wide open and clean with plenty of chairs and tables that were just a little too cluttered around the restaurant floor plan. Otherwise, it doesn't stick out much from other fast food joints. I went during the middle of a somewhat busy lunch period, and who seemed to be the head cashier loudly greeted just about everyone who walked in the front door on the other side of the restaurant. My cashier was friendly and quick, though he seemed a tiny bit frazzled by the small rush. 

I ordered The Box combo and a lemonade to go and headed back to my office a short 5-minute walk away. I hoped the freshly squeeze lemonade would be awesome, even if they did charge only about a dime more than fountain drinks for a regular. Although I could taste the lemon, the drink was so sweet, it may as well have been from a mix or carton. The Box comes with a small container of sweet coleslaw dressed in a lot of mayo, a slab of soft-in-the-inside, perfectly browned-on-the-outside toast, somewhat slightly crisp, thin crinkle cut fries, a container of Cane sauce (which tastes like burger sauce), and, of course, four chicken strips. Unless you're me and you get only three chicken strips . . . or two smallish chicken strips and one big chicken strip that maybe they counted as two, but really, halfway through the meal, you're so carbed-out full that you don't miss anything aside from the extra dollar you paid for that extra chicken strip. The strips were fine. It was real chicken, and true to advertising, it was fresh. Sort of crispy, but not as crispy as I'd hoped, or even expected. Tender and moist enough to not be bad. But not special. All of it was pretty one-note. I can't even tell you what part of the meal I liked best . . . maybe the toast. Coincidentally, every time I took a bite of that toast, I'd think, ""This is the most random slice of toast ever. What's it even doing here?"" 

So, it's fine if you're like me and want to try every new eatery that opens near my home or office and appreciate the novelty of places like this, but personally, I won't be making a return visit.

Edit: I almost threw my drink cup away before I noticed the giveaway pull tab on it--I won a free slice os Texas toast! How do you like them apples? =)",review,8EefXq-OSIKSqzyrpDNJMw,0,0,0,0
