business_id,date,review_id,stars,text,type,user_id,cool,useful,funny,bucket
ZRJwVLyzEJq1VAihDhYiow,2011-07-27,IjZ33sJrzXqU-0X6U8NwyA,5,"I have no idea why some people give bad reviews about this place. It goes to show you, you can please everyone. They are probably griping about something that their own fault...there are many people like that.

In any case, my friend and I arrived at about 5:50 PM this past Sunday. It was pretty crowded, more than I thought for a Sunday evening and thought we would have to wait forever to get a seat but they said we'll be seated when the girl comes back from seating someone else. We were seated at 5:52 and the waiter came and got our drink orders. Everyone was very pleasant from the host that seated us to the waiter to the server. The prices were very good as well. We placed our orders once we decided what we wanted at 6:02. We shared the baked spaghetti calzone and the small ""Here's The Beef"" pizza so we can both try them. The calzone was huge and we got the smallest one (personal) and got the small 11"" pizza. Both were awesome! My friend liked the pizza better and I liked the calzone better. The calzone does have a sweetish sauce but that's how I like my sauce!

We had to box part of the pizza to take it home and we were out the door by 6:42. So, everything was great and not like these bad reviewers. That goes to show you that  you have to try these things yourself because all these bad reviewers have some serious issues.",review,0a2KyEL0d3Yb1V6aivbIuQ,0,0,0,1
tdcjXyFLMKAsvRhURNOkCg,2011-06-28,LmuKVFh03Uz318VKnUWrxA,5,This place shouldn't even be reviewed - because it is the kind of place I want to keep for myself...  =),review,YN3ZLOdg8kpnfbVcIhuEZA,1,1,2,1
qsThMZ3lXWYLN4t08ScsNA,2009-03-13,fuY6Bf4EtW3UwrdLQJa9_Q,4,"I really really like Frances.  I love most of the clothes in there, but I can never have them because I can't afford it.  The store in general is pretty cool, there are lots of neat things in here from stationery to clothes to jewelry to baby stuff to dog stuff to vintage stuff.  There is a lot of stuff here.  It's all quite pricey though.  The sales they have every now and then are sorta okay, but still break the bank if you buy anything.  Overall they carry good quality products and the staff is super friendly and helpful.  I can't hate on a place too bad just because I can't afford it.",review,W_QXYA7A0IhMrvbckz7eVg,2,2,1,1
l4vBbCL9QbGiwLuLKwD_bA,2011-11-22,DJVxOfj2Rw9zklC9tU3i1w,1,"I have always been a fan of Burlington's deals, however I will not be shopping at this one again. I went to return a belt... pretty simple. Instead, I stood in the customer service line for 15 minutes thanks to an employee of Burlington buying/putting things on layaway. It took three other staff to help her out. There were no words said to me except ""Hold on"". I was pissed. When the lady was finally done, the employee at the service asked ""what do you want?"" Serious help is needed there!
 If you work in the area of ""customer service"" I think you should have some.",review,EPROVap0M19Y6_4uf3eCmQ,0,0,0,1
5kRug3bEienrpovtPRVVwg,2012-06-29,BslISEau8Pk2voEPN7kY-g,4,"Rokerij is worth the hype. We popped in last week for a late bite and left super happy. We scored a few seats at the bar, the place was SUPER crowded (which is a good sign on a Wednesday). I started with a beer called Banana Bread, which was awesome. Wifey had a glass of wine, but I can't remember what it was. We couldn't decide on what we wnated so we ended up splitting the entree of Blackened Salmon with Apple/Chipotle chutney and some potatoes. We also got three of the small Plates: mini reuben, crispy calamari and cilantro rubbed grilled shrimp. All the food was awesome. The salmon was cooked perfectly, although i think I would have liked the chutney on the side, but that's small fries. The calamari was cooked perfectly, the shrimp were awesome (although the bed of rice it came on was meh), and the mini reubens were great as well. I was super excited to try it, and it delivered. Can't wait to go back!",review,gcyEUr4DXcbjnGRAWFtfAQ,0,1,0,1
m9Wqqma30o-hH2fAX7dnug,2011-03-14,oTB_mpCKcu-8wayQQuCDZw,5,"Best food, super friendly staff, and great prices. Love it!",review,FpCmGLWHe5Y-kDS7ZYaF5w,0,1,0,1
YKOvlBNkF4KpUP9q7x862w,2012-02-16,_Ctic3_Iuw0ECtqH2Yw5yQ,5,"Took my fiance' there for Valentine's day/ Birthday.  I did a lot of research of romantic places around the Valley, and this one really caught my eye.  Immediately after walking through the door, you'll notice a dark and romantic ambiance with a lot of candle light.  Seating is a bit tight, but it wasn't bad enough for me to give it a lower review.  We began with an appetizer called ""Table side guacamole"" which was incredible to say the least.  It literally is made in front of your table.  Then it was onto the main dish... Build-your-own  Pork tacos.  Talk about tender meat!!  The shoulder of pork literally fell right off onto the fork.  The tortillas were exceptional, and so was the tasty sauce which included pineapple glaze.  So, the food was absolutely delicious...but the service was equally impressive.  My water level never reached the bottom of the glass the entire night, and I drink plenty!  Everyone was incredibly nice and cheerfully said ""Happy Valentine's Day!"" and ""Happy Birthday!"" to my fiance', which made the experience even better.  A fantastic place that I'll have no problem recommending to others to visit!",review,cCwj4RJSKU4-o9ZZ1VTtmA,1,0,0,1
R3UFldNkrGqOsDgD_cw6bA,2011-09-17,Qp7lu-oy_cLz71bjLgpNjA,4,"Yes this is a chain but after traveling in Maui for a week and then coming back home to Kahlua Pork from Rumbi, I can honestly say that the Kahlua pork here is better than any of the places I ate it at in Hawaii. Crazy huh? The Kahlua pork at Rumbi is so moist and tender and when its paired with some of their magnificent teriyaki sauce and Rumbi rice (rice cooked with coconut milk and beans), it is out of this world. The Kahlua pork plate at Rumbi has lately been the first meal that comes to mind when I want comfort food. This is a bit of a problem cause that is normally on a work day during lunch and after eating a meal of pork, rice, mac salad, and coleslaw, I am just down right exhausted and in dire need of a nap. 
I used to come here quite frequently but forgot about this place and I am not sure why. Besides the Kahlua pork and Rumbi rice, I can say that their mac salad, sweet potato fries, and their beach burger are really good as well. If you are looking for something different, yet tasty and satisfying, try Rumbi. I think you will enjoy it.",review,mlBC3pN9GXlUUfQi1qBBZA,0,0,0,1
qMkIbQFrROSnPaQ7at85-w,2007-03-12,uCdLSQa-bH_aYM-5DNuQJQ,5,"I just got back from an Arizona spring training vacation, and one of the highlights was definitely the Desert Botanical Gardens.  We came really close to skipping on a visit altogether because it was 5:00pm, but decided to give it a shot...it was worth it!  I was a little disappointed that the Butterfly Pavillion had closed for the day at 5:00pm, and several walking areas were being used for weddings/receptions (who could blame these people??) but still got to see a lot of beautiful desert plants and wildlife.  We managed to get in for free, not sure if it was because of the time of the day or all the people just walking in for the weddings though, which totally made the park that much more fun.  I am not sure I would have gotten as much enjoyment out of it if I'd had to pay $5 to get in...

The little desert rat-sqirrels, and rabbits were totally fun to try to find hiding in the many different plants and burrows.  I felt like a little kid ooh-ing and ah-ing at the different varieties of cacti and desert wildflowers, and have to give this place the ultimate rating .  If you're ever in Arizona, please give this place a try, it's very well put together and a beautiful site to see.",review,dxPBchN0OnHTENctEUm7NQ,1,1,0,1
supigcPNO9IKo6olaTNV-g,2010-12-14,O7jDv3ntT_rsFrd7qPrC4Q,3,"In addition to the nice atmosphere on the patio they serve a very nice brunch menu and the $2 bloody marys are a buy. Downside: parking validation is only a discount, not a freebie. Depending on when you go the service can be slow. During a recent happy hour the barmaid herself was left to tend to all bar patrons and the patio.",review,nDBly08j5URmrHQ2JCbyiw,1,1,1,1
cp39VURFby4A6u9m2It8jg,2010-04-23,pNv6lyBfJITFITz-iIKPzw,5,"A group of us from the IVAA Summit went to Zinburger last night. The food & service was great! I think we scared our poor server (Mike), but he was wonderful!",review,LH9q3LtJRVstt8Of4N1M1g,1,1,1,1
adKyTJT-RtaTP0krxLyQwQ,2011-12-28,5YVQIr0AJiiiJmkuhoRjzQ,3,"nice location , good service but a little slow. been here twice so far and both times the food i would give 4 stars but both times they screwed up our orders and burger was cold, they did take off 20 percent for the issue and that was nice.. overall i enjoy the food and would go back.",review,fnO1oH3N5QMG-PvHA4F-VA,0,0,0,1
mn1LFFcQwEpir38_mPYH_g,2012-07-14,AgZm8lHgL_R3bsGDQSs6NA,5,"I was sad to come back to lai lai's and they no longer had the Mongolian :( boo,, but i took my mom there and we were starving so we decided to order off the menu. My mom is allergic to  msg and they helped us with what we should order. and she didn't get sick!! woo hoo.. we ordered three dishes and an appetizer to share between her , my bf, and myself, and we stilll brought food home, and I dont think we spent over $30 bucks for all that food!! it was very good to! i love good cheap food!! Ill be back, they are always friendly.",review,TKiucSBuj9twVDW-BoAdrg,0,2,0,1
bts6jVczHJuWzpT8Y26UsQ,2009-01-05,d_2huUcM3ie0Zt-0tybnhg,4,"This has been a long time coming and is one more huge step in the development of Phoenix as an urban center of the United States. 

I have a stop three blocks from my house at Central & Thomas. I have ridden from there to Tempe and it only took about 20 minutes to get there. The stops at each station are very quick and efficient. Everyone is in and out and the train is on it's way again. The ride across the lake is a beautiful way to enter Tempe. From there, it's just a short walk to Casey Moore's and all the other spots I enjoy in Tempe.

The last star is missing from this review because service ends far too early on the weekends. I understand not wanting to deal with the after 2 am crowd, but could we get at least 1:00 am or 1:30 am on the weekends!?",review,gW-ukHucTfVCnFCKKxPJzw,2,3,0,1
8PYmv83XaJTioz5_A-SVxA,2011-08-01,iHw39WDbIi5qgurOkNNiWA,1,"Still quite poor both in service and food. maybe I made a mistake and ordered Sichuan Gong Bao ji ding for what seemed like people from canton district. Unfortunately to get the good service U have to speak Mandarin/Cantonese. I do speak a smattering but try not to use it as I never feel confident about the intonation. 

The dish came out with zichini and bell peppers (what!??)  Where is the peanuts the dried fried red peppers and the large pieces of scallion. On pointing this out all I got was "" Oh you like peanuts.. ok I will put some on"" and she then proceeded to get some peanuts and sprinkle it on the chicken.

Well at that point I was happy that atleast the chicken pieces were present else she would probably end up sprinkling raw chicken pieces on it like the raw peanuts she dumped on top of the food. 

Well then  I spoke a few chinese words and the scowl turned into a smile and she then became a bit more friendlier. 

Unfortunately I do not condone this type of behavior. It is all in poor taste...",review,Zgp9T6IOVFOozrWDw_mUGQ,0,0,0,1
2FqG3fBB2XffmRTnc6YI_w,2008-10-11,ujwc8ggO33vvhMJwAE0bHw,3,"My boyfriend and I were in Arizona on vacation for a wedding. The food was better than the average deli and they give you a free cookie with your order too. It is a shame they don't have these in malls near me. Although I read on their website that they have one at the Galleria which would have been nice when I lived in Davis, CA for college. 

Shopping really works up an appetite and this satisfied it well. and light enough not to ruin a dinner as we had a wedding to attend later that evening.",review,d0nD0TzD_NvzQLHE6zL-1g,1,1,0,1
ZdQbDVZWDsO-d7q2qW8E3A,2012-11-11,-Ieb92HyWYckqlJTAuf_GA,1,"My wife and I live around the corner, hadn't eaten here in a few months. We got food for take out, Mongolian beef,kung po chicken,pad Thai noodles.  Mongolian beef, there were more white onions then scallions and it was very bland. Kung po chicken,lots of white meat chicken the whole dish only had one peanut and the taste of this dish was non existent. Very very Blah... Pad Thai noodles,the dish was dry and came out of the container in one giant clump. It tasted like plain noodles, i was glad I had peanut sauce in the fridge to,add to it. Then it was edible .... We will not be going back to G@S.. Very disappointed !!!! From now on it will be Jade palace on 92nd street. For take out Asian !!!!  Do yourself a favor go elsewhere !!!!",review,P0Ki-xij91UU-_Hk4t6tGA,1,1,0,1
EcHuaHD9IcoPEWNsU8vDTw,2009-02-22,GJJFzEx4_zOhVRN7cMOJ4w,5,"This is my favorite spa in the world! Hopefully, I'll make it to others...but if I could only get to the Camelback Inn, I'd be in heaven. Here's the rundown of how I enjoy the place: Early morning appointment for massage - Rose does fantastic hot stone - I like her the best. Then I shower and get into the eucalyptus steam room. Next I head out to the pool and savor the view of Camelback Mountain and the amazing desert landscaping they've procured. I drink some water and as I lounge there, I order a small, healthy and very tasty meal (usually breakfast). I swim a little, lounge a lot - regardless of the time of year.  If I have planned it, I then head back into the showers and clean up for my next treatment. I spend hours there and if I feel like I might be pressed for time, I reschedule.",review,msgAEWFbD4df0EvyOR3TnQ,1,1,0,1
pxClzo2Ek5wGRJmYZcSkuQ,2012-07-09,GXXnhfTtNefRIktHo_ZGLA,5,Ask for Alex - he is very helpful and knowledgeable with products in the store. He is a young college student and works part time but always has a great attitude and finds the best deals for our family. Thanks Alex!,review,HBRvlxpo1PUQS9uU8csDTQ,0,0,0,1
6NHkOtivA_gb_2EbbJbJ5Q,2011-04-22,PN2CfYeUVri4e3l5GEMk1Q,1,They have some rude employees its unbelievable. I'm trying to give business to them and ordered 6 smoothies and the cashier and her employee gave me a dirty look. Not customer friendly. At all.,review,OfIm-r7GAv7p5JwzPUYDXg,0,0,0,1
OOCLVeqqMFfSnKa7liv0Kw,2012-11-04,9NrXM5p0sssVJiVgvFmwdw,4,"This is an open-air mall.  Unlike most malls which are totally enclosed, this mall is outdoors.  In the outdoor area they sometimes have ""events"".  The Batman ""Tumbler"" was there for a day once, we've heard concerts here, and this last visit they had a sculling team there with their boat.

They have many of the usual shops (American Eagle, Gap, Aeropostale, Victoria's Secret, etc).   The Harkins Theater hear is pretty nice.  We like the Genghis Grill for food (see my review of them).  The Paradise Bakery is nice also.  There are several other eateries here, but we haven't tried most of them yet.  However, several choices are available.

This is a nice mall to just wander and shop, and eat and drink, and enjoy whatever is going on.",review,Mb0psF4WQF7gZSuZafVr-g,0,0,0,1
m6h0xM8nvmjx-WeOjV6XbA,2010-01-23,wk-1KK8GkTNtPA1wM-SDVQ,5,"I am a huge Suns fan but my review is about the fundraising options that the Suns have to offer as well as their back-office staff.

First and foremost, talk about a professional, classy organization. Whether you have fundraising experience or are a total novice, the staff treats you like you are the only group they are working with. My contact is Kyle Pottinger and he is always a gentleman. No matter what questions I have, he always answers them promptly and never makes me feel like I'm bothering him. 

The fundraising process is easy and the tickets practically sell themselves because who doesn't want the chance to purchase discounted tickets? 

The process is easy and the rewards can be lucrative depending on the target audience you are working with. The Suns will treat you professionally and courteously. You won't be disappointed.",review,kG8jkVFgOAOq6Ht6RvAjEQ,0,1,0,1
c1yGkETheht_1vjda7G5sA,2011-04-01,RUe0yOda890ngDaz32MZ8g,4,"I read that the guy who owns GoDaddy shot an elephant...at night...using spotlights...I'm thinking his fully tumescent ""manhood"" must be the size and color of a 7 year old raisin...I can't imagine what he thought he was proving by felling one of these magnificent creatures with high powered/laser sighted rifle from 500 yards away, while it stood transfixed by the spotlights glare.

There was a word that we used for poachers that did the same thing while hunting deer, when I was a kid back in Oregon...""Asshole"".

He did prove to me that I will need to move any and all business I can away from GoDaddy...""vote with your feet""...but I guess that's another review.

The Beautiful Carin and I were in Scottsdale on business this past week and we take these opportunities to spend time with those near and dear to us!

At the very tippy top of the ""near and dear"" list is our lovely daughter, Whitney.

Whit is a Vegan...with a capital ""Vege""...and she was distraught by the wanton slaughter of an African elephant by some dot bomb misogynist.

So she was thrilled that her meat lovin' daddy was going to take her to Green for dinner...an experience so very alien to me that I made Carin pick up a pound of fully cooked bacon and bring it to dinner in her purse for me...just in case!

I am not a Vegan...I was born and raised on a cattle ranch...I do love a good medium rare rib-eye...I don't think it hurts Elsie the Cow to have a teat twiddled so I can have cream in  my coffee or cheese on my burger...and yet, the elephant deal brought a tear to my daughters eye and touched my black flinty excuse for a heart!

I checked Yelp and saw that while my Vegan friends on yelp love this place, my decidedly carnivorous Yelpy friends were also nearly unanimous in their agreement that Green is foodgasm inducing!

We ordered way too much food...Chili Fries, Egg Rolls, a Green Burger, the Secret BBQ Chicken Sandwich, No Harm Chicken Parm...I barely had room to choke down a couple of Tsoynami's and an oatmeal cookie sandwich!

Even after we were stuffed, Whitney took home enough leftovers for a week!

The big question about Green is ""why didn't I ever eat here, when I lived here...Why?""

I don't know...but I will be putting on my hemp cargo shorts, a tie dye t-shirt and growing a neck beard...and I will be eating here again.

I like to ""fit in"".

The menu is fairly extensive...the portions are plenty big...the flavors are bright and well defined and the textures and aroma's (always a big deal for me) are both exotic and welcoming.

I didn't have to break out the bacon (although I should have taken my flask...no cocktails at Green for Donald...oh well, agave sugar cola was a delightful departure from the ordinary).

I really could eat this way on a regular basis...it's that good...I probably won't, but it's nice to know I could!

I imagine that Karma will have it's own way of dealing with a self-justifying, trigger happy technotard...for me, the occasional dinner at Green nicely balances the Karmic forces at work in my life...and tastes good, too!",review,du6KeE54IFbPiXpU3LOd1g,13,9,16,1
7eUFOcfxuXDdrHGVSp3_9A,2012-11-03,ODykrO2NWH-RIAttQP7Q6g,5,"I have now visited Herb n' Flavors several times. I love supporting local businesses who have sustainable practices. This place uses local farms for their produce, safe from GMO's and pesticides. So, I was already a fan before I walked in! Everything I have tried has been delicious, and the owner is such a cool guy- always so friendly to the customers. The food always tastes so fresh, and full of flavor! They have a little something for everyone. I am a gluten free vegan and my husband has no dietary restrictions. We always both leave happy. I definitely recommend this place. I would like to see their business continue to grow and stick around for a long time! :)",review,DKi8rNg_jTZpVYs5BVVnRw,0,0,0,1
QnAzW6KMSciUcuJ20oI3Bw,2010-01-11,GFEr11tEyu07dlXlfUbfAA,5,Loved the burgers and the onion rings were fabulous!  This place is a must visi if you are in the Phoenix area anytime soon!,review,jvvzoDYVq3BD_Dy7eMRdhA,0,0,0,1
rFgSvsgo0BWnS03NFgI7Sg,2011-09-17,8JXFycbpW30ixl6VOeU6jQ,2,"Horrendously overpriced. ~$13 for an xlarge 2 topping that I had to bake myself? The pizza itself was better than average, but if you don't bake on location then at least make it cheaper than going to pizza hut and having it delivered to my door, ready to eat.

I'm glad I had the experience, but I don't see where the benefit to this is, at all. It isn't more cost-effective than going to the grocery for frozen pizza, and it isn't that much better than frozen.

On the plus side, the gal at the counter that made my pizzas was very nice, but it's a shame I don't see this kind of business surviving. I probably won't return, I am pretty disappointed.",review,yJ22u_1l01H4NM3wCowIKw,0,2,0,1
k8JnZBspVOI8kLcQek-Chw,2012-01-09,dGzFMtE5JQ3YkUHS6UU0uA,5,"I moved from Philly this past summer and I've searched all over the Valley for a ""GOOD"" Pizza. After eating lots of tasteless and cardboard pizza, I found Momma Mia when I moved into Arcadia! I love the hole in the wall vibe! Just like home :) The sauce is great and super tasty! The dough tastes slightly sweet and is fluffy..It's what makes the pizza so great and there is a brickoven!! I love it! My husband and I order the pizza/wing special .The wings are so hot and spicy ( we order the hot, but it comes in buffalo and mild) They have an extensive menu of pasta, sandwiches and salads. I want to try their Philly Steak next, but for the time being I still make mine at home. 
Every pizza place likes to say its ""New York Style"", but this place really does a NYC pizza. Well the best nyc pizza you're gonna get in AZ, Something about the water.",review,ED5xDqDU9JDtlVEOqNCB5g,2,2,1,1
90AXjqb4O-wrTHDKDoDUzg,2012-10-18,DTcud9LQcBwrC2OOZALS_A,4,"Great quality. Their Pad Thai with chicken is the best I've ever had. Fresh, flavorful, and perfectly cooked. Their Yupha's Fried Rice is delicious with the pineapple compliments. Their Red Curry gets a 2 star rating for just being Red Curry (it's not as creamy, fresh, or flavorful as Thai Basil on University). It's a neighborhood gem and I'm lucky enough to live right around the corner from Yupha's Thai Kitchen!

Also, it's clean, bright, and has an inviting ambiance. It's perfect for a sit in casual dining experience, and even nice for takeout. 

Staff is friendly and attentive. 

Come here. Seriously.",review,ZzaGa2nsW5bh71N3GOFO2w,0,0,0,1
yypKLRJxSjR2uNaTS_O6pw,2011-02-14,IP-mkqqLSLJp9IVd7VaHSA,3,"Been here several times for lunch and had the pizza. Today my friend & I decided to try the sandwiches. Very disappointing! I had the Roast Beef & my friend had the Turkey. Both were lackluster and smothered with slimy roasted red peppers. If you go to Humble Pie, go for the pizza (and the Happy Hour!)",review,tcWQQaDc0BH1dwhyl6ynaA,0,0,0,1
jQST5lkLGX9L52-A10TGTQ,2011-06-21,Rq_CS4yv-0x8odT4BMYnAw,5,I had Thai coffee and thai fresh rolls. It was good. The vegetables were fresh and delicious. Plans to visit again.,review,k5U-0FBwvWUob8dlT6RvmA,0,1,0,1
VDzgxHjMJj-1nMfJMtcSPQ,2013-01-01,YlAdlU2f1Fumt7U6OGUs0A,2,"Tried this for the first time today.  While my hubbies french toast was wonderful and the kiddos enjoyed their meal, my biscuits and gravy tasted much like bacon grease and flour.  Sending it back and trying something else is what I would have liked to do, but the server never returned to check on us until my family was finished with their meal.  The owner did apologize and asked us to give them a try again.  Maybe I will, if the staff gets some training.  Everyone seemed completely overwhelmed.  It's too bad~as I love going out for breakfast.",review,uQcl8Usm1cK9bQYbpXYdiQ,0,2,0,1
LzNJLEIo4gh-X_rmDkNkNg,2012-07-12,yHkvJxOyBbGT3MG-d487zw,4,"Great drinks!!!

Good atmosphere

Fantastic food (the bbq chicken pizza is a must)

Nice people to conversate with

What is not to like?

Oh yes, the creepy guy that kept staring at me. Oh well, he will not be there next time I go...I hope :)",review,mRAPMBM3dbw8KXNit1aDCw,0,0,1,1
kzZJjm56gG0aSpyA-dS3eA,2011-01-22,2ezengWz-lYIDWRCX5cfPQ,5,"I'm President of the Local scooter club so I know and deal with most of the dealers Valley Wide. Tylor the GM and team run a good shop. Very friendly. Don't get me wrong, they are there to make money but they are not push. You are free to hang out and ask lots of questions. Good assortment of accessories and they can pretty much get anything.

They know bikes and parts inside an out. Service on my Piaggion BV500 has been fast and fantastic. I did not say cheap, but fair.  Actually they had a Buy 1 tire get the 2nd for 1cent event this week. In the past they had a 1/2 price on all their helmets. Got a Scorpion $220 helmet for about $110. Just ask what and when they are having specials.

I don't buy the review below about bait and switch, pretty serious accusation. However, GoAZ and Gina over there are good people as well.",review,NlZE2Oir3HLV0XdELgkjcg,0,0,0,1
