business_id,date,review_id,stars,text,type,user_id,cool,useful,funny,bucket
EohIGivB0O1C7fSyQfNrqA,2010-08-28,Ppe0rgv6bbt2S6lIapHpuQ,2,"My wife and I were looking for a dinette table. We looked at many places and ended up at the RoomStore. We found a great table and decided to purchase the item. 

The salesman was nice and didn't provide too much pressure. 

There is a LARGE selection of items-couches, tables, chairs, dressers etc.

My problem was that we bought the table and had a deferred pickup due to moving into a new home several weeks down the road. I placed a small down payment to reserve my item. After several weeks, I contacted the RoomStore to pick up my item since I just moved into my new home. My item was not in stock and was told to call back later in the week. I called 4 days later and was informed the item was now available. 

Today, I went to pay the balance of my purchase and take home the table. Small problem, the table and chairs are not at this location.  I was given the choice to pick up the item at the distribution center 30 minutes away or wait until until Tuesday. I wish that during my several contacts during this process that someone would have told me that I wouldn't be able to pick up my item here or wait several other days. I was not happy! Now I have to go back once again to pick up the table and chairs.",review,9qCPmT6ovJjxL4tJB4ANCg,0,2,0,5
8Hn5X1AqgmSLHRG2KgBJBg,2007-04-01,-Qb3KcMONh4L5OF-R8y_zg,3,"3 and a half stars. 

I finally had my first ever Valley Oregano's experience tonight. You'd think I'd have gone to the one on Camelback ages ago, because, well, I live minutes away from it, but no, it was the Tempe location which sucked me in. 

Ok, not necessarily sucked me in. I drove my ass all the way out there to meet some friends for dinner, but still. 

Wait was an hour which kind of bit. We were tempted to just go to Thai Basil instead but as I never had Oregano's we persisted and stayed put. Once seated, we ordered things that I won't be eating anything close to resembling for the rest of the week: the spinach salad (ok, maybe I'd eat that), the cheesy bread, a large thin crust pesto pizza, and the pizokie for dessert. I'm a huge deep dish fan (I know, I know, thin crust is how real Italian pizza is) so I'm going to reserve major potential star wattage for when I actually have one of those. 

I thought the pesto thin crust was pretty decent - didn't blow me out of the water but it was good. The salad was flavorful and the cheesy bread was decent, but the pizokie dessert thing was awesome. Maybe it's because I I haven't had one of these since BJ's back in college (which is a longtime ago), but it was pretty damn delicious. Scene was pretty much college-y, loud, and full of ""like, I was all""s, but duh, what else is it going to be.

All in all, almost all stuff not good for me but whatever. Now that I've finally had my Oregano's experience I can go on with my life. Nothing like a local pizza chain holding you back.",review,htC49ZwXiKNka5cp0GKBfQ,3,1,4,5
JJi5HMpypL3xNB5HjTMeCg,2008-10-28,f3ZqeG3aZF2a1bWaxJ94xA,3,"I've been to Silver Spoon once, I need to go back to really make the decision if I like it or not.  I went in the summer, it was kinda hot in there-- like most places in the summer but, the heat makes me grumpy.  SO I need to go back when the weather is normal.

I got a salad-- it was massive, a little too much dressing for my liking.  Okay, A LOT of too much dressing but I ate it anyway. 

I'll probably try something else next time.  The staff was nice, the snarky guy that someone mentioned was snarky, buy snarky in a fun loving way, at least that is how I took it.  Snarky can come off all wrong and bad if not done correctly or if you just aren't in the mood for it, or if you yourself is snarky too-- then it's a disaster.  

It's close by my work so the fact that I have not returned makes me keep it at a 3 star review.",review,XBHJCDzNh--mBhJkzyM_iA,2,2,0,5
lVkDZZ8sTafPlq7f1i5row,2011-10-14,udh6QgSQM3dJqMbOAQBjkA,5,"Finally a raw food cafe that isn't in Tempe.  Love their drinks and raw food menu.  Just wish their prices would come down bit.    

This is the type of place I could eat at everyday.  I know it is good because the afternoon lull doesn't happen to me when I eat here.    

I do NOT go daily, due to pricing, but I would like too, because I would simply live longer eating here.  Your body buzzes with clean energy (non-caffeine) after eating here.  

If you are a person who wants to be nice to your body.  Splurge and give your body what it craves....Enzymes.    

Who knew raw food was the answer to avoiding afternoon coffee.......?",review,OESKxoNFZcKl47NrOubgAQ,1,2,0,5
1NZLxU5WvB5roPFzneAlLw,2007-11-04,AY6EQgNgY_dZnWaTRBP90Q,5,"Barrio Cafe is an amazing Mexican restaurant.  Chef Silvana Salcido Esparza travels to Mexico for many of her ingredients and you can tell - things are always fresh (they only have an ice cream freezer!), creative and authentic.  I am more than content w/ a mango margarita, the incredible guacamole and the gooey caramel filled churros!!  Even when the restaurant is packed, the staff is friendly and informative.",review,JRXRlaus7k2Mz3erUKnwyQ,1,1,0,5
Y-ci4KjSUdwfc6ru4XnX8Q,2008-05-18,0m-DMDSCVTv5fo-GQf37vA,5,"On my little trip around the city I drove over to Sweet Pea. Very cute store and great personable staff.

Nice selection to baked goods and great taste.

What nice find in the downtown area. I've got Wicked Bakery up north and Sweet Pea downtown... North and South is covered for those sudden cravings... now time to find something on the on West and East sides of the city.",review,kvhwo-rYxTWCGi3Sol5zIQ,8,10,6,5
IMGW6y8wHQCfr_6k-YXg_A,2012-11-24,VSQjiI2ulJhw2yYgFB_s3A,5,"The family and I love this place, as does anyone I've taken there. 

First time I went I had a cheeseburger pizza - huge and delicious. 

Their beer is great too - brewed right on the spot. 

My wife loved the fish tacos -- it says a lot about a place that every time you go, everything you try, is fantastic. 

You'll pay a little bit, but it's worth it.",review,VDCHcdTkrUUSLz0hcKK6vQ,0,0,0,5
zXg2O_QnpHQVD7e1azAu_w,2011-11-08,McpH7BVnp36pcqtELhaZdQ,4,"Someburros comes from the same family as the longtime South Phoenix staple ""Ponchos"". However, Someburros has somehow managed to take the family business to a whole another level! I've been to several different Someburros and they all consistently have good food, service and atmosphere. My favorites include the Green Chile Burro enchilada style and the tacos. The beans and rice are always moist and better than that you get free chips and salsa with your meal. I like how the atmosphere is more Mexican-American but the food is definitely authentic!  If you hate a crowd avoid Lunch hours like the plague. If you are in a hurry you can also call your order in ahead of time and pick it up through the drive through take out window.",review,rL3dPeKDTybG_ct9OCXGAA,1,1,0,5
ggKTLa0xVz-WGBGatscMBQ,2009-01-31,yt-Ye0Od5HrXowMq6aGjRw,4,"I'm not sure if Safeway is a national thing (let's just say I've never seen one of these babies in Manhattan), but it's definitely needed in Phoenix and Tucson.

I would drive around the city, looking at all the strip malls and low-end manicure chop shops and wonder, ""Where the hell do people go grocery shopping?"" And while Trader Joe's is GREAT, I'd be hard-pressed to do all of my shopping there.

So thank God for Safeway, right? Although Safeway is generally a little more expensive than other grocery stores, you can pretty much get anything you need there. This particular location was so clean it was beaming! Or was that just me?

It had everything you'd expect from a Safeway--from a lovely floral department to a mini-Starbucks to a sizeable deli counter.

Yay for Safeway and chain shopping!",review,ryxVMbCBq-cKOClTBAqkLg,3,5,4,5
kay6xcNSE93fM96uHhA6ug,2012-02-03,xtuAHT4aRsAXUhfqV7CoGg,5,This place is awesome they r going to replace a bad  tire for me for free that another discount tire put on they r awesome,review,JW9m7KU5QAESEWv4OKBHSA,1,1,0,5
9yq9xzYkYJZamqCXZ_wNvw,2012-08-11,JquvaBH5m4yY34g40kHcKg,5,Heather is awesome. She did my initial set of lashes and I've already gone back for a fill. Her prices are great and she does beautiful work! The compliments are rolling in. Absolutely recommend!,review,zcgggMqoYxQxLN9zwKE7vg,0,1,0,5
3RrRw6ZCsLgHEdqJQj5wvg,2011-05-20,MKd8D5RlOxaazVbh_y58MQ,4,"Not bad.  Very large story that has about everything you'd want, and open 24 hours.",review,iKi-FUw5x7A220fVvEcNuw,0,1,0,5
kode9F27RF4C7XdSsnokiQ,2012-11-25,psr0oqLvdB7zpmU1D72HzQ,1,I will never go here again. So disappointed when I went in its a cute store don't get me wrong I would buy so much there for my dog. But the day I went I went to get a treat for my dog for his birthday. The lady was on her phone the whole time talking personal business while my mother and I stood they're waiting for her to get off or put the person on hold. All we wanted to do was to ask her to get that dog cookie for us. So after 10 minutes of waiting we decided to leave and while walking out the door the lady shouted thanks for coming. That pissed me off cause she put down the phone to say bye but not to get an actual freaking sale. I'll continue going to to petsmart. Tried to support a local business but I guess when you own your own place you can have poor customer service,review,QMYURmVQVAx1t7BxIb2dXw,1,1,1,5
8T8B_xK10FuO6MBOFcVQ3w,2010-02-24,H3aTGuva6rpRZMY1sWyHuw,2,"I was elated when I searched yelp for places to eat near my office and found Culvers. I ate there two days in a row last week, and ordered the follwing:

bacon butter burger, lettuce style - SO DISAPPOINTED. I had high expectations for a burger cooked in butter. While not terrible, this is not even comparable with in-n-out.

chicken fingers - Decent, although I've been spoiled by Shane's BBQ tenders which are made in house. I'm assuming Culver's came frozen in a big bag and then were deep fried. Still, pretty good for fast food.

green beans - Not cooked nearly enough for my liking, forced down several fork-fulls then threw the rest away. 

Would only visit again if co-workers dragged me along. I'm sure I would have a different view of the place if I were in glutton mode chomping on the custard and french fries.",review,ukA4tAsH05itDYqhl7qBMw,1,1,0,5
OSlTIcDNSSt_83ciKwT1Xg,2011-04-10,Mv70EIrm0GyjzjC8OON1vw,2,"5 star view...
everything else is average...
bar is small, food is ok, drinks are blah",review,4r4vhVSc3bYpRdKSAAivEA,0,1,0,5
BINYfrtGp3A4w0d5E7kbYw,2011-03-05,gK6j3l1HKgR8_O8Vn7u5Hw,4,Great setting to enjoy good food!,review,8DZZkj4m3VO8dnZzB5Gykg,0,0,0,5
Zx8_4zKdDBSO3qGrkukBIA,2011-04-01,ismc4frvSipf8G1A6uZcEQ,5,"I have been coming here since 1996 and the food just keeps on getting better!!!   The jerk fried rice and emerald chicken are to die for and he snicker doodle cookies....oh my goodness.   Every time I'm in phoenix, this is my must go see do eat spot!!  The owner Frank is awesome.",review,AeViEDV-ZsYWaL3nRNzfwg,2,2,1,5
yExYqENb4F6qH6kJxTOaSQ,2008-01-27,H3EOU1LQkPOrLtK7UeKn2A,4,"I found this place by accident. Blink and you'll miss it. Best fried catfish I've had. Totally not greasy. Thin cornmeal batter is the right amount of crispy. Fish is tender and moist inside without being greasy at all. Coleslaw was pretty decent. Cornbread was soft and had a hint of sweetness but not too much. Portions are good. Vegetarian options for the non-meat eater. I ate well for less than $10, tip included. Glad I found it.",review,6uYJ-ixRxPMyf-iEbhoz2g,0,0,0,5
vxPPpj5jJKO8DtapF5S-NQ,2007-12-06,Ss1DH_8pwBEP_pwBrAelbg,5,"If you haven't been to this place - go! Seriously. It's amazing. It's the best little hole-in-a-rundown-strip-mall you can find. And it's cheap!

Nestled between stores like Big Lots and some electronic place with Mexican ranchero music blasting, this tiny place is hidden in the corner. The owner is from El Salvador, so don't expect it to be Mexican food -- there are many similarities, but the dishes themselves are different.
Walking in, you can smell the homemade pupusas -- seriously, it smells like the roadside stands along the bus routes in central America. It's amazing. There are only a couple waitresses, and I don't think they speak much English, but the menu is in pictures, as well as in Spanish and some English, so you should do just fine.

Get the pupusas - they're like thick, hand-made tortillas stuffed with either pork, cheese and beans or, my favorite, cheese and loraco flower, which is some green and edible plant that tastes a bit like asparagus, to me. It's definitely the best one. These things come with salsa and some coleslaw (if they don't, just ask for the salsa) and are very filling!
The other dishes are really good, too. For a low price, you can get an entire plate of things like meat with rice and beans - and this place doesn't skimp on the fixin's. They put slices of fresh tomatoes, avocado and all kinds of other stuff on the plates.
I honestly LOVE it here. If you want to avoid the crowds, come at an off-hour... then you can just sit, relax and watch the telenovela on the TV in the corner. For dessert, pick up a piece of the cheese pie near the cash register.
I can't recommend this place enough!",review,hnirQYfI4cjrzSMENyQTWw,4,4,1,5
saON8-nDZi5W64u1xGtmPA,2012-03-26,_7ZkA5VyinBVL6fVh2tjJA,4,"Went back on Friday and was disappointed to find they are  closed from 12:30-1:30 on Friday...lunch time  on Friday seems like a super strange time to be closed and I was unable to eat there due to the closure (and I drove out of my way to go there never thinking to call and make sure they would be open at a time that should be the busiest of the day).  I will go again, but I will call before heading out of my way to make sure they are open and I don't waste my time on the drive.",review,opBoaO-xNShH86ZW3N1RIA,0,1,0,5
ZEdaJ8mcMpPiFWgDuSPqeA,2012-09-15,Qs8Ta_P-tIG4diwz01yaJA,5,"Only 10 min away from walking distant.
This is really really really good, also really really really bad.

I am almost finished with trying each soynami.... So far and not a fan of the one with banana.
YET EVERYTHING is.... just... just good. Place on top of a Swiss Alp let me sing, dance, and exclaiming goodness oozing. 

Also i can eat one and not feel lik I am creating havoc for my metabolism to compensate.

RL:

NOTE: Oddly takes an unusually amount of time to get into my hands. 10min?
Worth the wait, worth the walk, worth the extra chocolate ;)",review,uOdEsOgPW48Ky4j8U8CEcw,0,1,0,5
_uUlWKhPmjFUUxOSS-EP_w,2012-09-23,wmeUXmJvfd7f8xPnmFJ_cw,5,"Very friendly staff, or a fast food place-- their customer service and friendliness is unmatched.. I go more often than not simply because of the experience every time! Thanks Micky!",review,6CIxnHYCfM7D4hGx8WWYGQ,0,0,1,5
m9Wqqma30o-hH2fAX7dnug,2010-12-20,4jI2mKO_ZoJ0YLCri-vpRw,5,Love it here. Come regularly now lol thanks to everyone on yelp. Great food cheap price great service. Tho not 100 percent authentic Chinese food still great,review,M8DaT0zmcumO5gfdrf0KEQ,0,0,0,5
3jqOv6re-xPYOg7srmi7tg,2011-12-07,nnBjnMCS941dRw3h-GfWtQ,5,"Picazzo's is a freaking miracle for gluten ""allergies""!  

Almost everything there is gluten free, and you can get something besides gluten free pizza.  I highly recommend going during happy hour and just eating the starters - meatball sliders are awesome!

Pizza is very good as well.  More reasonably priced than a lot of the chain places that get their (really friggin' expensive) dough from somewhere else.  

People with celiacs:  rejoice.  Picazzo's is legendary.",review,izQhXnfoP2vPeBtZ2rLU7Q,0,0,0,5
-EctXOb3B7T177jGYUhjVA,2011-08-09,Qq0KwPY8gAWORyH5v5VkHw,5,"My boyfriend and I decided to try Boulders out last night because we wanted some good beer and it's within walking distance of my condo. Good choice on our behalf! 

We arrived around 10:30 pm, so we took advantage of reverse happy hour ($1 off most pints on draft). They were also having half price pizza night, but we had already eaten pizza earlier in the evening, so we did not get a chance to try the pizza. Had we been hungry, it seemed like a great deal.

I was VERY impressed by their beer list! They had the biggest beer selection I've seen anywhere. When I was shopping at a specialty store last week, I noticed a ""Maui Brewing Co. Coconut Porter"" that l was very curious to try - but I passed it up because it was $10 for a 4-pack (ouch). I asked the bartender at Boulders (Rob) if they happened to have that specific beer - and to my utter surprise they did! I was happy I was able to try it out before shelling out ten bucks to buy a four pack at the store. Two thumbs up! 

Speaking of Rob the bartender, he was great. Very fast to take care of all the customers around us as well as my boyfriend and I. Made sure we had everything we needed without being intrusive. 

Overall, I had a really good first experience at Boulders on Broadway, and I will definitely be back. I dug the old-school ambiance with the wood paneled bar, we received very good service, and the selection of beer was amazing - truly something for everyone. 

If you live in the area, I'd recommend checking it out!
I plan to get some friends together and go back for one of their ""team trivia nights"" soon - sounds like a blast.",review,d8ZgWQENWo2DKu0sYAPqTw,0,0,0,5
1_43FZHx3P5D7X-CpIR9WA,2011-06-13,CzUuQs-QpNEls1URRFSzDg,2,"Stopped in Sunday for lunch after a high recommendation from a friend of mine in San Diego.   She claimed it was the best sub she's ever had so I had to try it.  Unfortunately my sub came up short with lack of taste and toppings.  When we pulled up I noticed it was super busy and was thinking man they must have great subs for it to be so packed.  Was lucky to get a booth inside but it wasn't as clean as others have stated in other reviews.  I had to take one of their comment cards and wipe the table of all crumbs on the ground as others had obviously done from the looks of the floor.  I had the Chipotle Cheese Steak sub that I split with my husband.  The bread tasted ok, but it wasn't fresh out of the oven. They skimpt on the steak and hardly saw any onions at all on it.  For the price of the sandwich I really was expecting to get more.  The sauce was the best thing about it but I was wanting more of it as well.  I won't be going back.  Sad that it wasn't a better first impression.",review,IajbWwj6l-KHrfSEwZBLgw,1,1,1,5
MLcXtnpzygZvQ9BtseLLlw,2009-08-19,x8sFHH94WxMW_SuOZ4TAJQ,5,"The Farm at South Mountain is a splendid little slice of the country- right here in the middle of the desert!

The plentiful green grass spotted with picnic tables makes me want to plan a family reunion. There are gardens and walkways to explore. From first glance, The Farm is a quaint, family-run farmhouse.

Visit Morning Glory Cafe for breakfast and you won't be disappointed. I've personally enjoyed the Morning Glory Benedict on several occasions, while my brother is a big fan of the Farm Monte Cristo. Both dishes are made with as many local ingredients as possible... mmm... local-icious. 

The Farm Monte Cristo is about as close as any breakfast food gets to ""groin-grabbingly delicious."" (a la Homer Simpson) It's slow baked ham, over easy eggs, and melted cheese between two generous pieces of French Toast. Served with warm maple syrup, this is it, folks. The grand-daddy of breakfast foods. 

The service here is generally solid. Our servers tend to be interesting, friendly, and adorable- all good qualities to have when you're serving breakfast to someone who isn't happy about being up early.

I'll return... and return... and return. I'm hooked.

I only wish Morning Glory wasn't closed for the summer! Killing me.",review,4eONcOSuswZvlvWu8ftJHw,0,1,0,5
TkBtRfqMpJ32B0ZM9zYxWw,2011-08-23,iTXs7zAirspJU8VRtnqsSQ,5,"Wow what a fun little antique,etc. store I stumbled across the other day!  I stopped in at the Starbucks for a refresher and noticed all of this funky stuff out in front of the store!  I went inside and it was a combination of an 19th century hardware store and art walk.  There was just a little bit of everything-
some vintage, shabby chic, crystal door pulls - industrial - toys. The owners are great and are going to help me find a little period table I've been searching for. Lot of great accents!  I'm hooked!  I'll be back with a vengence!",review,M_KeR3EJoIOBKGP6o9MhCw,0,1,0,5
IyldfEGfCVcEOb7SMlKs7Q,2010-01-12,wWwK4oB_3YJYHzOEUbMd9Q,5,"I LOL just thinking about some of the cast members and skits that I have seen at Jesterz. The first time I saw Jesterz, I was expecting it to be pretty awkward and honeslty didn't know what to expect. I was blown away how funny it got at times. Good clean funny. We went again soon after the first time but didn't go again for a good 2 years, we went back recently and was kinda worried as the crowd was not as big as past times. Even with a smaller crowd there were tons of LOL moments. Writing about it kinda makes me want to go back.",review,RknsoxpICgtuuv46uaTpyw,1,3,1,5
6nseTZb6WrGWcithRThfag,2011-06-11,y00peMvECCREKVJnNSXh8A,1,This place is over priced and the service is horrible. I went there with my feiends and the server was very rude and degrading!,review,rGaZmAwROLkDFo7lR9-Dzg,0,1,0,5
Lklz5ClavxSzqnBrJQsJcQ,2011-07-17,hSW2HPone8i8vO4uvNqBiw,1,"DON'T GET TIFFANY UNLESS YOU WANT A SPEEDY EXPERIENCE
Pretty Nail tale with Tiffany-
My 10 year old first mani/pedi
4:35 water and feet in chair only 13 minutes and painting toes. Prepped and painted fingernails from the chair- in 20 minutes. 35 minutes in all. Told owner I was unhappy and she said that a kid mani/pedii was 35 minutes then later 35 to 45 minutes. Tiffany never let it dry between coats so when she sat her under the light she told her only 5 more minutes and I stopped her. She said only the under coats will be wet and the top will be dry. I told her Really because you never even let it dry between coats.  She said not 4 coat. Base 2 color and top is 4 ... well top and base dry fast she said...Owner said"" fast or slow it doesn't matter as long as the polish looks good and it looks good."" I didn't tip her on purpose...not because I'm poor- I got poor service. I would expect this for a color change but not a spa pedicure/manicure.  Very disappointed.  You'd think the owners would realize that all the other patrons saw her take advantage of us.  Get anyone but Tiffany unless you want a quick job!",review,_Uq8LfC6X3UJoTurlbiUrA,0,1,0,5
24V8QQWO6VaVggHdxjQQ_A,2012-11-01,opqIDBk5QbxYtG3cjCZfpQ,1,"$8 for a tiny sandwich with one egg, two greasy strips of bacon, and a stale muffin. They say it's pricy because they get it local? It has to have substance to be considered anything. So whack.",review,FUMdzARf71drXyDZ7lkpWw,0,0,0,5
5SS69rC8XWvdlD1OHifEEQ,2012-05-17,1RcTkSQpeYkOeH6pYY1zRw,5,"Beaver Choice is an excellent place which I have had the chance to visit three or four times.  This is about as home-cooked as you can get in a restaurant.  It's like eating at Mom's house, if Mom happens to be Swedish.

I've had a few of the entrees -- schnitzel cordon bleu, pork medallions, seared gravlax -- and all were delicious.  Especially the gravlax.

The sides are also great, and you usually get three per meal.

The poutine is perhaps not as good as what you'd get in Quebec, but it's easily the best I've had in Arizona.  The fact that they even have poutine wins this place a few points.

I have also had the opportunity to try their dessert specialty, the Beaver Supreme.  This mess of chocolate, meringue, cream, mandarin orange, and possibly a few other things, is the sort of thing which you set out intending to only eat half in the first sitting, but ultimately find your free will diminished, invariably resulting in an empty dish and a fear of the onset of diabetes.

Also, it seems one gentleman gave this place low marks for the long preparation time on a chicken wrap.  I just have to ask, why would anyone go to a Scandinavian restaurant and order a chicken wrap?  Can you imagine what would happen if you wander into a Viking camp and order a chicken wrap?  Your head would be off before you could recite one measly Odinian incantation.",review,KYeLSM3MQpirmHukVV5Iow,2,4,1,5
xWKtOLuIOVGZprcpGiqpQA,2009-02-27,so3Dk9OZZ2B7CAYASQ6GuQ,4,"Went to Sticklers for the first time today, with a friend who works across the street.  I'm a little leary of places that get talked up so much, but Sticklers was everything she talked about and more.  

A family friend once told me that the way to tell a good restaurant is how busy it is.  Seems like common sense now, but how many times have you walked into a restaurant with less than 10 people in the whole place and then walked away disappointed?

Well Sticklers was packed.  My first impression was ""Crap, the line is 20 people deep and we only have 40 minutes for lunch...there's no way""!  Well I was pleasantly surprised when we got through the entire line, food in hand, in about 5!  The guys and gals that work there are efficient and have it down.  And they showed some great patience for a newbie.

The chicken salad and provolone sandwich was outstanding and the hot peppers gave it a great kick.  Word of warning to the lactose intolerant - it's a 2-piller!  The atmosphere was active and lively but not overly loud.  We were still able to have a conversation without shouting.  I just wished the people at the next table realized that.  We didn't need to hear about their daughter ""wrongly"" accused of DUI...for the third time!",review,gopGuEb-ft6cHKMyCZEvJg,0,1,2,5
