business_id,date,review_id,stars,text,type,user_id,cool,useful,funny,bucket
muCl5p-9ut1sY0aKeUeRhw,2009-01-04,dSa-IKXBjz0YInXDBXx5kQ,4,"When Sen. Ken Cheuvront opened this restaurant, I was living in Midtown phoenix and it was at a time when a lot of restaurants in the area didn't exist. I was beyond excited of it's creation. 

It's a very trendy urban feel, with a nice patio on Central Avenue. Located at the bottom of Artisan condos, it's not a terribly easy place to see if you're driving by. They feature an incredible selection of wines and cheeses, of which you can purchase and take home as well as nosh in the restaurant. They also feature smaller sized entrees for those who are not looking to get stuffed on greasy messes and feel sick all night.

A particular favorite of mine are the ancho pork empanadas which are fluffy and crispy with a little orange in the pork. They are definitely delicious. Also great is their white pizza featuring sea scallops. 

There is nothing here that is oddly unique, but everything is interesting, and it is a nice spot to hang out with friends and have a nice night out. Especially during a first friday.",review,JgDkCER12uiv4lbpmkZ9VA,0,0,0,5
YxLiLBNTm4cOg7OlKKLmVw,2011-04-23,V_FNJIEmKCvkq4n4om1NJw,1,"Went with three others. My first & last visit.  The menu did not properly describe the item and instead of a bell pepper dish, I got a port dish. It was dreadful. The other three I went with were not very happy with their meals either.  The restaurant was extremely noisy. Not pleasant at all & terrible food. Will never go back.  A big disappointment.  They can't even describe their items properly so you never know what you are going to end up with. They called it a pepper dish and it was a pork dish. The sauce apparently contained pulverized peppers. Are they stupid?  I should have trusted my instincts & not the commercial.  It's a third world country. They can barely afford to feed themselves. They have no history of cuisine.  I wouldn't waste my time and money on this place again.",review,5XZ9gYbA-L4GXWQlMtftjQ,0,0,0,5
HKr_xfeyrv2Bh7urZsQEVA,2010-05-19,jX2VkpXLdidPJ0cFTMVnJQ,3,"Really like this place, wound up there one night by accident, as my friend  and I got disgusted with the lousy service at the ""other"" bar in the same shopping center as Tony's.
The place had a good vibe, jukebox playing, people shooting darts,  we felt totally comfortable, and found a table, to sit and catch up.
 Service was really good, The bartender, while waiting on another customer, made eye contact, to acknowledge me, and said she'd be right with me.  I like that in a place, ---nothing worse than standing at a bar waiting to order drinks and feeling invisiable.

My beer was good and cold,  my friend ordered a vodka and orange juice, and commented that it was a nice ""stiff drink"" -  

We both said we were glad we stumbled upon Tony's and will be back.",review,mJYDA1COTEzU6LI-sZIgsw,0,0,0,5
9VYZA4vEKtT_SXHj-ZK_1Q,2008-05-22,lVdmJGrvqQeioCREdEMOyw,4,"The first thing that sticks out in my mind was the service.  Our waitress was all smiles and incredibly adorable!


Edamame was perfectly steamed

Sushi was tasty

Salmon Teriyaki was delicious

sake and kirin washed it all down

prices are reasonable and the atmosphere is calming.",review,bZFRqP7s0Vszxeu8_IwYow,3,4,0,5
pa_Ft6pLLWo-w_iopBsu0g,2010-02-22,VHlEeajmQg6oVBHYmaoUvA,4,"3.5 stars

Fast friendly service and the food was good. 

I ordered Hung Pao rice bowl, while it was not huge and loaded with things it was plenty for a lunch size. The food tasted good. 

We ordered it Sunday evening for dinner. Orange chicken, General Tso chicken and chicken fried rice. ALL with white meat. While I really like the fact you can get all white meat, it was a little dry. Perhaps the way it was sliced and not in small cubes? All the food was good but not the best I have had. 

I would order again.",review,C6IOtaaYdLIT5fWd7ZYIuA,4,5,3,5
EWMwV5V9BxNs_U6nNVMeqw,2009-06-14,mRtpQtc1CDnFvNaQf7D_Jg,3,"FEZ... The two times that I went it was in the afternoon on the weekend. Both times, I was able to enjoy a great lunch with my sister and cousin and then again with my sister. The two dishes I liked were the FEZ burger and the Casa Blanca Chicken.  The berry shortcake was good, however the water from the strawberries sort of killed the whipped cream and the shortcake (biscuit) was very good.

Overall the environment during those times were peaceful and quiet. The staff offered advice on the menus. The price a little high for my wallet but I would definitely come back to splurge with great company in tow.",review,RHX2qpUTOv2usuckZIil8Q,3,5,1,5
hh2lP4_2N-tk_OxmaTf_qA,2009-07-22,NMz3gC5nOSbKZJG_UjpASg,3,"I have been wanting to eat here since it opened and finally got the opportunity.  The ambiance and service is excellent, however that was not the reason why I was there.  I was there for the food that a lot of people have been raving about.

I read somewhere that the hanger steak was their specialty and I don't disagree.  I had a taste and it was indeed very tasty.  And if I go back I will definitely get it.  And at under $20 it is a steal.  However, I ordered the 8oz filet for myself.  It was cooked properly and tasted good but not memorable.  The individual sauces that you can order on the side were also nothing special.  And yes, the fries were just as everyone on Yelp said they were; good but just like In-n-Out's, but cooked a bit longer.  The sides dishes were ok at best and were a bit on the smaller side.  However, the potato gratin was amazing and better than I have had at any steak place thus far.

While it is less expensive than Mastros/City Hall, I think that for a few extra dollars it is worth going to a better place.  In my opinion, Mastros/City Hall have much better steaks and better/bigger side dishes.  However, J & G does have a better ambiance.",review,rLtl8ZkDX5vH5nAx9C3q5Q,0,0,0,5
w19cemjVR8u02PgjFpJ7Mw,2009-03-31,zXsomljbtmS2Wd4pRlhI0Q,4,"holy crap.  try the side order of garlic mushrooms.  they are little pieces of heaven that are such a delight to pop in your mouth.

also, on the special menu right now there's a salad called the mediteranian chicken salad, which really truly may be the most incredible salad i've ever eaten in my life.  i wish i could drink the dressing that topped the impressive mix of greens, corn, roasted red peppers, cilantro, raisins, pine nuts, red onions, parsley, well-seasoned chicken, and i can't remember the rest.  omg.  beautiful.

service was fine, not exceptional, but the staff was friendly enough.
i'm so HAPPY i found this place.  go there.",review,QfdqvcKtLBr15pMggtAjHg,0,0,0,5
mpdl2_v3MDJVzTaxvlEGTA,2012-07-22,7e5jVB1D6nmONQgM6loaeQ,4,"My GF says Take me out for a rum drink, I says your wish is my command. 

Beautiful little restaurant opens at 5 downtown. A very kind sir welcomes us in. I see the rum punch and I order up. Now this rum punch is delicious but I would have liked it to be stronger, ya know 'Punch' $5. I decided to add a shot to our drinks with a Haitian five star rum.$8. 

We also had an app of Cuban style pork tenderloin sandwiches using fried plantains. My Gf enjoyed them I just am not crazy for plantains. Anyway cozy seating and we had a good time.",review,gN03qFYysM5DbgjuV6N0QQ,1,2,0,5
W7xb2iS4cYL14Yi5LOGSkA,2009-03-08,jxiX6oOomJXJBzK82Wpusg,2,"It's not that I don't like this place, it's just that it's very run of the mill. Bison Witches does the standard sports bar cum college drinking hole thing. That's all that can really be said about this place. You can't really hate this place for that because it is what it is. A milquetoast spot at its most average..",review,FxxYCRPcpd__yhRRmmtyMQ,0,0,0,5
V-mvhyX6lxu5l2euYatlrQ,2009-11-02,-K4Sq6SPrYwN7cNzq3wDeA,3,"Stadium was REALLY nice... the MORONS in control of the parking...not so much.  I understand that you're not going to get doctors/lawyers/rocket scientists to control parking and move traffic in and out of the game.  HOWEVER, it would be nice if Glendale would pull their heads out of their butts and build a new on/off ramp for the stadium.  It took over 30mins to get out of the parking lot!!  To make it worse..the Cards lost :(",review,_jjIaczpcVDpHlH6l334rQ,0,1,1,5
6rijZ1qIjiq1Dgdy35iqxw,2007-03-08,ERGur9ORKj-ES7neGnQ-fg,4,"Camelback Mountain is a well-known landmark and popular hiking spot. And for good reason. The mountain boasts spectacular views from the highest point in Phoenix. Even though the mountain is easily accessible from almost anywhere in the Valley, it can feel like a million miles away from the city's teeming malls and freeways. 

The 1.16 mile Summit Trail is one of the most popular hikes in the area. It therefore may surprise you just how steep it gets or how winded you may become when hiking it. Just bring plenty of water and don't overdo, unless your path to 15-minutes of fame includes a sheriff's department rescue on the evening news...",review,lC4X2crUuxT9Ac9BlOX4Uw,1,1,3,5
jkULHBAZBM3s5DQJkM-6RA,2011-10-27,_dJQfEtgn9A1OOHEgDNmvg,5,I found this restaurant when they were located in Buckeye. I have tried everything on the menu probably more than once and have never been disappointed. My favorite is the Red-Chili Frybread with cheese added. The service is excellent there. You always get treated friendly and with a smile!,review,wvSoHwvcMaZop922gaxwrw,0,1,0,5
WiAY7lyT-DC7Zk3StMMp0g,2011-09-10,SaSnGdY60ibecazmK31NNA,4,"Not a bad visit. I regularly visit the Location in Columbus, OH. I have developed a certain expectation as to the type of service that should be implemented in this concept. Compared to Hooters, this place will eventually put Hooters out of business. The food is consistent and delicious. I am a huge fan of the shepherds pie  and Quinlans 5 cheese pizza. The service at this particular Location was a few notches below the service provided at the Scottsdale and Columbus Locations. The servers seemed under trained in how to communicate with the guests. That preferred to fraternize amongst themselves which was the only fault that was noticed. The place was clean, restrooms well maintained, and the food was expeditiously served. Prices are a little high but who are we kidding, commodities are up everywhere. I will always stop by when passing this concept. Compared to it's competition of sports bars it is among the top of the list.",review,Rwj_uBFy66Uxzq9GHA_Ayg,0,0,0,5
peA3F-PnIfijYr8HuG-A-Q,2010-12-30,hG5zbjZZ3YYG5dTz0_S2AA,4,"Considering how douche-y it could be, it's really not that douche-y.

Drinks are expensive but prepared right. Service is good. The seating is comfortable and the atmosphere relaxing. 

Note to the single guys wearing chin-strap beards and Affliction t-shirts while looking nervous and sitting at tables alone and not approaching women: Try ""Hello"" or ""Nice outfit"" or ""Those martinis are great, aren't they?"" or something. I'm old and fat and dress like I'm teaching a fishing class, but I'm not afraid of girls. Just talk to them like they are people.",review,nDBly08j5URmrHQ2JCbyiw,2,2,4,5
IBrQEBb6_MFtCEiulodXeg,2009-03-21,lnibY6BckqyirtIWSzPSJw,4,"I love this Starbucks. We all know every Starbucks is expensive, so forget that. But these people have our drinks memorized, if you go there alot anyways, they're on top. Good Starbucks.",review,VXUIEbW9_xbCqs12EYD8QA,1,0,1,5
eRb0wjIVlj0bbfmePKZLng,2010-04-10,DJ2epxidXnFdLtFmjQBgwA,1,"How very disappointing!  Nello's had a delightful menu with an array of salads, pizzas and sandwiches. Not Jac's. If the new restaurant wants to be a ""pub"", it should have a wider variety of selections. The menu was sad.

Due to dietary restrictions, I asked for a plain garden salad. Lettuce, tomatoes and onions. And it wasn't very fresh either. Sad.

Guess we'll be driving up north to Pima Crossing to visit Nello's.",review,k6xDCakturvYo1afdPMP6g,0,0,0,5
ADJIoHN3uLx-JalYl3r3Dw,2012-07-24,kZsO87tYXkjCGZlrmwN-jw,4,"Talk about options!  It's almost unfair to have so many items on a menu.   Especially when the food is so good.  I have gone to the Cheesecake Factory several times and have not been able to even put a dent in the menu.

So, I wasn't too hungry this time, so I decided to order from the small plates menu.  We started with the corn fritters.  Then I ordered the shrimp and grits and my husband ordered the hibachi steak.  

The only reason I didn't give them five stars is because we didn't get our appetizer until the our food was ready.  And by that time, we had already stuffed our faces with bread and butter (which is delicious)!  The server apologized for delay in bringing our app and the manager came by and didn't charge us for the corn fritters.  That was much appreciated!  We only had one of the fritters since our other dishes were in front of us and we didn't want those to get cold.  

I really like the shrimp and grits.  I think the dish came with a little too much sauce...but that's just me....I just really liked the taste of the cheddar grits.  My husbands steak was really really good!  The hibachi steak is what I normally ordered. 

I will go back again!",review,kNO6w6EIKo8u6GSykOHBLA,1,2,1,5
Lnohr9bpCbHNsomazXDg-w,2011-08-28,mJgy2lgZsZTtWv5kjG-Alw,5,"Today was the fist time I have been to Chino Bandito. My friend has been there several times and loves this place. After having a few beers, we were pretty hungry and decited to go here. This place is mixed in a sort of industrial corner behind a Walgreens and a transmission shop. Walking in you will notice how big this place is inside. Customer service was excellent. The counter person was great in explaining the different options on the menu which is a mix of Mexican food and Chinese food. Great concept for something different. For ten dollars I had the Carnitas burrito and a Jerk chicken burrito with Jerk fried rice and black beans and a large iced tea (all you can drink). It also comes with a Snikerdoodle cookie. Wait time was minimal and the food was brought very quickly to our table. I really enjoyed the items that I had order and I found the carnitas had the right flavor and tenderness in a burrito (you can also get it in a bowl). The Jerk chicken burrito had some zing to it. Enough to make me sweat a little. One thing that I noticed was that the employee's were really good about keeping the place clean. Sweeping, cleaning the tables, wiping up around the drink dispensers. I also noticed that they wrap all of the highchair trays in plastic to keep the clean and dust free.
One last thing, they have free wifi!",review,SRlh4J85Js9ozC1eco6DQQ,0,0,0,5
Oc-F6O91vOe3T8iOsCBB8Q,2012-06-11,vCzrQ5MIs-SBnCU5opxSzA,1,Wow. Worst food poisoning of my life. Ate here Saturday night for my birthday. Started to just not feel right about 20 minutes afterward. Sunday I never left the bed except to go be sick. I lost a full FIVE pounds in one day. Stay away from the salmon. I for one will never go back. I'm really sad too because I decided on it from the reviews. Another reviewer said they were disappointed in the recent quality. I should have listened!!,review,A8e50wVP7xcz1sWOE6gEbQ,0,3,0,5
Cz0McL5lUaihqOIw0_Yo7w,2012-10-22,li8_bnaT7C0yUaAvYTKmrQ,2,"Finally tried this place after passing it weekly for the last year or so. Atmosphere is pretty cool, but food lacked any special quality. Large glass of orange juice was nearly $6.00...WITHOUT the vodka (lol)! Hash browns were kind of burned, and small portion to boot. Probably won't go back, as there are so many other breakfast places nearby that are much better.",review,iBO2m9xXivsIbvFnZHsNvg,1,1,1,5
Zx8_4zKdDBSO3qGrkukBIA,2012-06-05,ZoQ062IDTg5QpjXyoNsQ8w,1,"I have heard so many good reviews for this place, so who wouldn't try it? I should have taken the hints before I got my meal, that this wasn't a good choice.

Hint 1: Location - It's right next to a smoke shop and a gas station across the street from a mobile park.

Hint 2: Food test - It was nice that I got to sample the food even if the first sample wasn't up to par, the guy wouldn't leave me alone about sampling.

Hint 3: Decor - I know this should never have anything to do with the food, but it felt like I was eating at a cousins house on the bad side of town, wobbly chairs, wobbly table.

I ordered the teriyaki chicken (didn't think it would be bad, I mean who can mess up teriyaki?) With chicken fried rice (once again, how on earth can you mess up fried rice?) 

The chicken tasted like it was frozen and thawed out all day. Such a horrible taste. The fried rice tasted like it too was thawed out, kind of had a gross tangy after taste. There also wasn't any spices or egg in the fried rice, just a bunch of green onion,which technically isn't a fried rice. This meal can be related to something you get in the frozen section at a grocery store.

They also give you a snickerdoodle cookie, that looked like it could be the best thing on the menu, until I noticed it wasn't cooked all the way through.

But the icing on the cake was the gross pube like grey hair I found floating in my teriyaki sauce. 

So the expensive $8 meal was so not worth it, and I 'm sure when Diners Drive Ins and Dives visited, the food was great, but today it was the grossest thing I've ever had.",review,6-cOlCHG9gTu1iwLVm0C8w,1,1,3,5
wqIB7hUTQnCswJV4UyYyEQ,2012-10-17,6D44Kh87e_bVh8u2hglwzg,5,"I'm sure most people don't go to a fancy steak restaurant for the Mac 'n cheese, but as a mac aficionado, it's practically my duty. And the mac here, well it's high quality. I like to order the lobster mac sans lobster (not a big fan of seafood), which without the seafood, is actually quite inexpensive. Now be warned, this is real heavy mac 'n cheese. It's so cheesy, and thick, and delicious; don't plan on being able to wiggle out of your booth any time soon after eating it.",review,AF1FkKODDmXFbVhlNIp4vA,0,0,0,5
AqbgC7Gul5Es1rRzGNLDFA,2011-06-20,fRfafaJw6pJpApH7bJepZg,1,"Went last week, and ordered a dozen variety. I didn't care for any of them, very dry, the frosting wasn't very good,even my 9 yr old daughter spit her cupcake out!",review,CYKz4de61gfOfZEB7MbaDg,0,0,1,5
vujjKuD4Vls4xKLe5MJ63Q,2010-02-16,2fBIkj0y15lcd5z4eNVgGQ,5,"This is another work lunch takeout place for me and it always does me right. I always get the Jerk Chicken bowl with rumbi rice and have never been disappointed by it. Good flavor, lots of chicken and veggies and rumbi rice is simply delicious. I personally like to add hot sauce and also sometimes splurge on a cup of tortilla soup -which is pretty freakin great. There's alot of cheese on top of the soup so lactose intolerants beware!",review,wC1CPV5bf--bDLtlhNSPLg,1,1,1,5
-UT6IHfVW_2yzz1bf8WI5g,2012-09-19,1DmZ5gHhff5CgZ_lqaPyHQ,1,"Love the idea - vegan Mexican. Have tried to eat there twice. Both times checked their FB page for hours, both times they were closed. Called their phone number, no one answered. No sign, no explanation on FB. Pathetic.",review,_caYjV_hptPhQTYCxUaqzA,1,7,1,5
QnAzW6KMSciUcuJ20oI3Bw,2009-10-19,4jzZIXcXOub2k1cvrlFemQ,3,"So I'm apparently oblivious to the fact that anything with the name Joe is owned by the same person.  Luckily for me, I wasn't stupid enough to order bbq pork again.  Joe's Farm Grill is a pretty cool concept and probably the only decent place to eat on this side of the 202 (since Mobsters INC closed, at least).  There are enough review here that clearly he is doing something right.  Suburbanites love to feel like they don't live in a city and, I'm sure, love the idea of a restaurant with picnic tables and trees.  They must because the place was a freaking day care when we went, with snotty brats running all around and climbing on everything.

Anyways, back to the food.  I ordered a BBQ Bacon Burger.  I didn't bother to specify how I wanted it cooked and it was, surprisingly, cooked to a decent medium-well.  I subbed some sweet potato fries with it and they were pretty good.  Little more pepper would have made them great but oh well.  The wife had wanted to sub the veggie fries with hers but they made us order a side of them.  That side was literally 3 pounds of fried veggies and was way too much for any human to consume.  They weren't really my thing but the wife enjoyed.

This place does a lot of things well but they suffer from a lot of the logistical problems that Joe's BBQ does.  The line is better and it keeps people from getting backed up but they seem to run out of menus quickly.  People grab them, carry them in line, and leave them at the window.  As a result, there are no menus left when people walk in.  I refilled the thing twice while I was standing in line.  Also, the condiment/drink counter is outside and all in a row right by the door into the restaurant.  These weird clusters of people trying to get a drink or some sauce develop and creates an obstacle course for people going in and out of the restaurant.  This leads me to my final problem - the indoor pickup window.  While the summer is long and hot (and I'm sure leads to a lot of people usually sitting inside), the day we went had tons of people sitting outside.  When their buzzers went off, they had to go inside to pickup the food.  The single door seemed to be all sorts of hazardous for people going in to get food and people coming out with food.  Finally, and I know this sounds stupid, but the trash can outside has the smallest opening ever.  You cannot actually stick your plastic basket inside the trash can and turn it over to dump your food out.  You have to pick the stuff up out of the basket and throw it away with your hands.  I just finished my meal, cleaned my hands, and now I have to wash them again because I had to handle a greasy, sauce-covered piece of paper to throw it away.

I know this sounds nitpicky but it turned what would normally be a 4-star peaceful lunchtime experience into a logistically stressful nightmare for me.  When you make it hard for me to get in and out with my food, it makes me feel like you don't want me there.  I know they are going to read this and I know they are going to dismiss it just like my gripes about Joe's BBQ but do me a favor, when you build your next restaurant, hire someone with a degree in urban planning to help with the layout instead of just cramming things wherever you think they will fit.",review,fev0iI-XDrteD4SYRKjiUw,1,3,2,5
DBoebGeuz91QAP3tSFYs6w,2012-06-19,qw9o9KNudG_aWcujmc5qMg,4,Not your typical deli meat-this is the real deal with the shredded turkey.  Very good.,review,5c4p-A1sLBlpS1cPaMpdBg,0,1,0,5
mhLN_oiJd7zq6eaOS1Nw1A,2012-06-23,BijeD2f2YIowWPsmQmyZpw,5,"Tried Roy's for the first time last night when we met some friends who rave about their Aloha Hour (Happy Hour).  Always avoided going because we tend to not like restaurant chains, but this place is a gem and exceeded our expectations.

The bar area is relatively small, but very classy.  We were able to have few drinks at the bar ($5 for beer, wine, and their signature cocktails) before we were able to get a table in the bar area for 5 people...thanks to Leah and the hostess staff (you guys are great).  Didn't have a bad drink -- loved the The Original Hawaiian martini was delish, as was the mojito, jalapeno margarita, mai tai, and wine.  A friend was sad the cucumber drink she liked was missing from the menu, but sounds like the menu changes often so diners/drinkers get a chance to try new concoctions throughout the year.  

For food, we tried most of the HH specials.  Everything was spot on -- excellent flavors and beautifully presented.  The tuna roll and tempura shrimp rolls were my favorites (sushi rolls), with the lobster pot-stickers being a close second.  Some friends ordered dinner...and were able to speak with Chef Bray about his recommendations for fish.  She ended up getting the Crab Dynamite Baked Barramundi, which was so yummy!  The happy rice on the side was great too.   My hubby got the Yellow Fin Ahi Poke -- something we have looked for since trying some fresh poke in Kona, HI last year.  I couldn't believe the flavors...eating poke in the AZ desert!  Its preparation with the Wasabi Crme Frache made it a meal we will seek out again in the near future.  Ended our meal by sharing the chocolate souffle, which was a perfect ending to a great Friday night gathering.  

Definitely recommend Roy's for seafood that is excellently prepared.  Aloha Hour is a must.  Extra props to Matt, our waiter, and Leah on the hostess team for their accommodations and service.  We had a great night.",review,m2uaBX3VmZZSc3NyD1qyoQ,1,1,0,5
8H1DwdAAgSBtwDeb2R-hmA,2009-03-03,f7I-Gm8md45qtJYP3ARi0g,4,"I've heard way good stuff about this place for a while and finally had the pleasure of sitting down and having some lunch there.

Thoughts: Staff was friendly and quick, nice place, very clean and some hi-tops and lots of tables and outdoor seating as well.

Chicken salad bagel sandwich wasn't too bad at all, except for the nuts in it - I'd probably eat it again however.  Had a tomato basil bagel toasted with it... yum!  I'm wanting to go back to try different menu items now :)",review,8CNEh7fSbLwDuAKhLjDPKQ,3,4,0,5
ghzksdgNztTZA49PqMvPkA,2008-05-20,7sJ6XV4KEz6Q5FKEe19Z6A,4,"Pei Wei is a family favorite, especially for take out. I can call Pei Wei while I leave the house, order my food as I drive, and when I arrive 9 times out of 10 the food is hot and ready to roll. The food is always tasty and at a fair price. We love it.",review,fVJnUOJT9qvUJLU3iHUNvw,2,2,1,5
