business_id,date,review_id,stars,text,type,user_id,cool,useful,funny,bucket
j7XuypdW_w935NhjbvKPQw,2012-04-03,CXw5W8StPoZ-Zfz3fHIp9A,3,"First I will admit to not being a very impartial critic here-I absolutely adore a good bowl of ramen.  Although I've not been to Japan I've been fortunate enough to visit some outstanding ramen houses in Seattle, Honolulu, Los Angeles, Chicago, and San Jose.
While I think this is probably some of the better ramen I've had in Arizona, unfortunately that's not really saying much.  It was okay, not great.
I ordered the miso ramen with chashu hoping against hope that I'd have a reasonable facsimilie to Santouka's spicy miso available in the Mitsuwa stores around the country-drool.....  The noodles were decent, though I wish there was more of them.  The broth was not very miso-y and lacked the depth that really makes the ramen bowl.  The chashu was really the weak point, sliced thin pork with no real discernable chashu quality.  The accompanying vegetables were fine although I wouldn't say it's what I'm used to/looking for.
In short I'd say this is Americanized ramen-and no, not the cheap junk from the package but suited more for an American palate instead of leaning toward authenticity.  No fish cake or bamboo shoots, none of the cloudy unctuous broth, no pork belly chashu.
The place looks great and the staff is great, I wouldn't dismiss it but Republic doesn't get a fervent recommendation either.",review,szbTVEtATfn8f9GxbGGO5w,0,0,0,1
fRa4l3Rkh_yPq9WrKD82AQ,2012-08-05,C9lHc7zQxyHMshDALzm1bw,2,Even though this is my home gym where I train for my shows...I really starting to not like the people here no more! The GM was very cool with me and since he got transfer to a new LA Fitness nothing isnt the same no more! Everyone here is a meat head witch I dislike!,review,qbzVVyk9w84pG5mfYU6fng,0,0,1,1
TQhP4vCMjvX527YMxPfuUA,2011-12-24,nQH2KAvAeOJOYKX99TO3Cg,1,"Just isn't very good.

I don't understand why people give this place even three stars.  It's rare for me to give a place a low rating, but, My Big Fat Greek restaurant is nothing but gimmick anymore and has gone from bad to worse.   The food is not even close to any representation of what good Greek food tastes like.

I've been to this place several times over the years.  This location and others.   It used to be just on the lower end of OK...  it's never been as good as you can get from a 'Ma and 'Pa place.  However, we went for lunch the other day and it's just gotten to the point I wouldn't even go back for a quick bite.

We ordered the garlic hummus, and it was overly full of garlic and not home made.  It seemed to be loaded with garlic powder, as opposed to fresh hummus that just had roasted garlic in it.   The olives we ordered were rough at best.  UGH even thinking about them.  Overly seasoned and not very fresh.   The rice was over cooked and was so soft it lacked any sort of texture.

The first rule of good let, alone great food, is FRESH.   This place needs a rescue.

Less critical, but, I think an overall representation of what has happened to the place, the menu's were totally trashed.   As in ratty, tattered, and dirty.  The lamination was coming off them and they were dirty. 

Do yourself a favor and go elsewhere.",review,ryjqXdp68i2I9JPOpX9URw,0,2,0,1
uR2aNW75R4oYs9w7aw-_kQ,2010-05-26,8AyRQ78ctCPenSjmzUeHHA,4,"Fun place for happy hour. Good prices, good food and great staff.",review,pprq_7lgBT-WDFGPQe1a_w,0,0,0,1
doEZAj-NSnoEMOJl5yXcNw,2010-10-06,IbZa5ZqgjP-iRPm2Xo2h3Q,5,"I've been coming to Yusefs now for awhile to get gyro meat to go, along with their fresh feta, pitas and cucumber yogurt. BEST I'VE HAD! Finally I was able to eat there as they have a kitchen and OMG, it was delis and the prices are fabulous. I ordered the lentil soup and holy cow, it was UNREAL! I got the gyro plate with gyro meat and fresh rice (basmati?) and it was fabulous. Gyro Greek salad was amazing too. I love coming here because the owner is nice and very sweet!!!!!

I recommend you try this little gem!! It's worth the drive!",review,3vML-LnH0dIyHCrqF5xEYw,1,1,1,1
GpK9MeUjEd7rwhejG2ykww,2011-06-15,JAZx1ZTdTFUYQpbZkqt7QQ,2,"Maybe I'm ordering the wrong stuff, but I've *always* been disappointed in the grub at 5&Diner... The service was STELLAR and I really do like the ability to dine Al-Fresco at 3am, but does everything need to be soaked in butter flavored crisco??? ughghg.",review,nbofxFWHORebBHh10OgYLA,1,2,1,1
9AbyBqGWHYZC73GlyAuTrQ,2012-07-23,rflJEdUJokN2p1s7K1zE6Q,5,"Went here for our anniversary.  Pretty much what you would expect from an upper end steak house.  Yes, it's pricey.  Steaks were good and service was attentive.  A good place to celebrate.",review,b2DKC4kC8-QeSeGZ_MF3XQ,0,1,0,1
lEGq4UveDPxikXcpwjtFow,2010-11-03,t_O1cTzXj8SGrLBl77dEKA,3,The acoustics are pretty good for an amphitheatre.  The process required to acquire booze is a tad ridiculous but you have to remember that you are in Mesa.  This place would certainly rate higher if it was located in a city that allowed concerts to go past 10pm.,review,f3LA83yEEBMj9q92H28O7w,0,0,0,1
eTbtfgUtfewdncgVf2CbWw,2012-09-23,pFHJZfvF4Et8NzdAxTbnLQ,5,Excellent macaroons!  Great owners very conversant with their costumers.,review,hNk9YQNC9vJpEs5swUlbeQ,0,0,0,1
E2F25cRcYf_bWtvbCht0EQ,2011-12-25,pDoptH8gE2rAInbK9mMabA,5,Best damn Brownies on the planet (or close to it)! Words cannot explain how good they are. The only negative is that this palce is located across the street from my office! Way too much temptation.,review,SRlh4J85Js9ozC1eco6DQQ,1,1,1,1
U4IipLI4RsuBLmxTFEV2MQ,2011-02-06,mosH3g7HtQxV8nQLZc772w,2,"I have been parking here loyally for several years but the last two times have prompted me to look elsewhere. The location is somewhat good but stinks if you get stuck behind the train since it is just south of the train tracks. The shuttle are fairly frequent and prices reasonable. What has really rubbed me the wrong way is the service. Okay, maybe just one particular driver. The second to last time we used this place, it just so happened that the driver that dropped us off at the airport wrote down the wrong place. When we were taken back to the parking lot, the driver kept arguing with me and saying my location was wrong. It was to the point, he was almost ridiculing me in front of the other passengers. When we finally located my car, I showed him the ticket where the location was written. His response was that the original driver was an idiot for writing down the wrong location. No apology to me for his behavior. We used Sky Harbor during Christmas and we got the SAME driver again after being picked up and taken back to the lot. Turns out his behavior was the same and this time I watched it exhibited towards other passengers in addition to myself. My husband thought it might have been his sense of humor but yelling at other drivers in the parking lot is unacceptable. Besides this idiot's behavior, during the holiday, Sky Harbor Parking had cars parked in front and behind vehicles in middle rows. There were three couples who were blocked in when dropped off. I couldn't believe it. Who wants to deal with that when traveling all day? Thankfully, it didn't happen to us, because I would have blown a fuse after dealing with the driver. I might try out Pre-Flight who has a frequent driver program. Hopefully, their customer service is better...",review,RxfFQxUtSIGYwTKU_rvAeg,2,3,2,1
3Z88l4UO-FoNbYk_ZpTScA,2011-01-24,6h7oNIYKxcPDVcFARWdkhg,3,"We have been using Delia's Cleaners now for nearly three years and for the most part found the experience to be very good.  

Yes, like most cleaners they goof from time to time (like sometimes killing the button-downs on my dress shirts).  But, here's the difference -- they'll fix them for no charge.  Yep.  Just ask, the staff is very helpful!",review,1BW2HC851fJKPfJeQxjkTA,0,0,0,1
jnzROxEjNkgeo5Ju3F8qzQ,2007-11-26,iLbYXR38DgL7zItTFaoE3g,4,"We were taken here by our host in Phoenix.  It's one of the prettiest Mexican restaurants I've been in, with a courtyard surrounding a duck pond (there is a sign requesting you not feed the ducks tortilla chips!).

The margaritas were great and my chicken was excellent, as were my partner's tequila shrimp.  Would definitely go back there if I were to visit Phoenix again.",review,XnoIg-UnpRjxXtuOB1Ev2A,2,1,0,1
9tSHBEoAhKu-tkU8n6SKjA,2007-01-18,xTwSNNeBgzipKOaO4-Ws1w,4,"Better like it hot...these folks do not know the meaning of the word ""mild""! Plentiful, tasty Mexican fare at a good price...always a good bet.",review,BmrHQgNFdN2IaoI5_OBF7Q,0,0,0,1
wn7GiuOQ_0VrPXNc1wVTDA,2010-06-19,0PJikehxBTmvgOve7sd8EQ,4,"Inspired by recent Talk, this rating simply must be updated.

Fatburger has a QUALITY-quality that places it in a wierd limbo between other fast food burgers and places like Fuddruckers.

If you are a fan of the king, either of the two clowns, or the red haired girl, then Fatburger is likely to feel too expensive and that it takes too long.

However, 'you get what you pay for' and 'good things are worth waiting for'.  

Freshness, a multitude of assembly choices, and overall quality are big standouts at Fatburger.  The employees at this location have always been friendly and courteous.

Tuesdays: buy a combo, get another burger free!",review,n_lAaNGeWgspbbCJc0DqRg,6,8,4,1
cjjZt2oOkk0F152RkQMfQw,2008-09-07,JL-jE0hQDeJNJKxhAc45-w,5,"I love this place! This was the 4th and final stop on our search for a great dive bar in Old Town. Coach House was just was the doctor ordered, that is if the doctor had ordered you to find a great dive bar. I'm still trying to find a doctor who will do that.

Anyway, from the minute we walked up to the guy checking ID's it was a great experience. Everyone was friendly and chill. People actually talked to you and were having a good time. It was a great mix of people.

We played pinball with some guy we met who I renamed the Pinball Wizard. I also found out that I am not as good at pinball after I have been drinking. Apparently if affects your hand eye coordination or something like that. Who knew? ;) 

We also had fun hanging out with some other dudes we met there, and my drinks were $4.25. What more could I ask for? Great bar, great night!",review,AdEy5KAIlMAy8xHyuMQCFg,9,7,5,1
UHh2br86pxndWXELC6B8Cw,2011-01-08,CvBZufPp_CPUn4j1FLyhDw,5,very wonderful and romantic place to take your loved one :),review,CWQOBs0qw58tahumYRBREA,0,0,0,1
ABrSt3fsirLrUYNVrD3fbQ,2011-08-05,clOq6ZQZ86cEVB8NehwEFA,5,Another excellent find in Scottsdale.  The service is wonderful and the food is extremely flavorful with good size portions.  The sea scallops and herb chicken are highly recommended.,review,pU-c4d5koLUBJuBFKPgNVA,0,0,0,1
y6uO4ydAwBHUujfiSktxZg,2010-07-01,0HpAY9IumG80OG5wMHv-Mg,2,"Was a bit dissapointed after reading reviews here! I had the fijitas, wife had tacos. Didnt think the inferno  (green hatch chili)was all that hot!!!
The Taco meat was not spiced bland. Best part of the meal was the bean dip and chips even the salsa was nothing great!!! At least the beer was cold   ut at 13.00 a pitcher it better be!!!",review,AdpQcQcRVNZdG_17p4V45Q,0,1,0,1
JobP0ghILdh8S8l-LhHHxQ,2011-05-23,8XP6XkyiTn921bGG3vPnyQ,3,This is just like Filiberto's. Fast-food mexican food. It's really good and taste pretty authentic to me. My hubby and I stopped in for a quick bite to eat and we went there because he heard it was good from his co-workers. I'm a huge critic of mexican rice and beans and this place has it down. I got the lunch special of the day which was 2 bean tostadas with beans and rice. It was sooo much food and I was so stuffed!  Next time I will get something smaller. You can't beat all that food for $5! They have a good salsa bar with all the fixings!,review,yAeo2D5NdtGuGG2o1M1aGQ,0,1,0,1
hCS5eV0SCAY9LeeL36lz8g,2007-09-14,YuMXpDWSpNgJMHJWHWAhgw,3,"This place is the least douche-filled club of the douche tour in downtown Scottsdale. It is a huge club and in some ways it's like an anchor store in a mall - like Dillards or JC Penny. You can get a little bit of everything you want in one place... It's got its share of plastics and douchebags, but also has a number of college kids venturing away from Tempe to go dancing. 

The place itself is kinda cool with various rooms of different themes and a good sized dance floor. The VIP area upstairs is pretty neat if you can swing the fee. They have the requisite go-go dancers with giant boots on some nights and they often feature good local dj talent.

I haven't had to wait in line to go here in years because I'm always invited to go - I reckon if I had to wait in line, I'd just not go. Don't buy a girl a drink - apparently, this place attracts some pretty (when it's dark) homeless alcoholics. These girls need jobs (and not boob jobs - that's already been covered). 

Myst is large enought that you can go here and manage to find a good time... drinks are a bit pricey, but that's par for the course in the area. It's a one-stop-shop for all your drinking and dancing and scamming needs. You're also very close to a slew of other smaller clubs of the same sort if Myst isn't happening.

One of the best parts is that it's across the way from a pizza by the slice place that stays open after hours just to feed the drunk idiots so they can ""sober up"" for the drive home. Sometimes I go here around 2am sober just to people watch... on any given night, you're likely to see either a fight break out, some drunk chick puke on her hair, or someone crying over something stupid. You also get to see everyone in the harsh fluorescent lights not looking their best - the shine and polish is gone from their outfit and the product in their hair has quit on them and the girls' makeup has given up long ago - plus, they are too drunk to suck in that gut or push out that chest. It's very amusing.

Yes - Myst is a good place to go if you want to go clubbing in Scottsdale - send your out-of-town friends here... locals who aren't into the scene will loath it. I pretty much do.",review,Cp-PV8rsypbO-xBrQ6KmQg,3,4,8,1
Ft7BXN0D9x_XcVd-VZeLeA,2012-12-19,yctTSqpVcJqW1nA4SsVdpA,4,"Pretty good food. Super friendly service. Very clean.

First time I have had duck at a buffet and it was pretty good, just not the crispy skin. Lot of seafood items. They kept things well stocked and didn't just dump the new stuff into the old (a health code violation) They pulled the old pan out and put the new one in. 

We will definitely be back.",review,nT8v1ljwuh_Mt5lBkO0gmw,0,0,0,1
41j3GB7M-Lwq284Pfb9zgw,2012-12-05,O0vFS0XQ3xtHifVdyqT9xg,2,"This review is for food-  

On recommendation from the waitress my dinning partner ordered the nutter sandwich, I went for the grilled cheese and we started with the wings.  The wings were not what I expected nor wanted, the sauce killed it for me.  The grill cheese was just ""okay"" and the nutter sandwich that received raved ratings from our server was a huge let down.  We added the marshmallow and bacon (as recommend) but the marshmallow was no where to be found and the bacon with the natural (non sweet) peanut butter with super sweet jam was just.........not good.

But! i do enjoy the space and the selection of beer.  I have had friends who have gone since and rather enjoyed their spam sliders.",review,ybex2-iQv1Cr05LG-FUY4Q,0,1,0,1
lUhjcttOVyH9uNa0v6NFfw,2010-09-29,_DiQOmvy1EbXuy8Wvm9MZg,1,"I went here while on vacation visiting my friend. Neither of us had been there before, but I know they have lots of locations on the west coast, so we gave it a try. 

The staff was totally rude. Before we went, we called to check the hours. The guy on the phone was patronizing and acted inconvenienced to have to give any information. 

The pizza was blah - totally generic and nothing special. If you're going to have mediocre food, you better have exceptional service. Double fail.",review,P9OhxvmNepsq5Fo2ZokzYg,0,0,0,1
qsThMZ3lXWYLN4t08ScsNA,2009-04-26,bVi18QTIhM7qvF_fpHrriA,5,"I love the clothes and accessories, the staff is friendly and the prices accomodate everyone!",review,MQ96E0cw4L4e9ixXbq15Pg,0,0,0,1
Rus-ewyqLj2D1RlqK-je4w,2011-08-22,3MU-MH2ZpZEkX0Bhtvgzmg,4,"They had amazingly quick service during lunch! The servers were VERY polite, almost to the point of being obnoxious. I ordered the daily special--bacon cheeseburger--which came out hot, fresh, and delicious, though the fries were heavily over-salted. Our drinks were also quickly refilled without us asking, which was nice but unfortunately their tea basically tasted like water. Overall, it was a good experience and I would come back again.",review,BfsjJKw0daRK64a4uARuNA,0,0,0,1
nFo_63pTr-4ZhakuaRFOCA,2012-08-26,dBDSiE4eIw3ePS1qDgmzXQ,2,"Food was tolerable, and tasteless.  The chips were actually tostadas that were extremely hard (almost stale) when eating. The entrees we ordered were bland.  The rice and beans had no flavor at all.  Maybe that is Baja style of food, but couldn't find the flavor anywhere.
The service was great and the ambiance was wonderful, but I don't think we'll be going to this place again.",review,4L6KNUQe2pWYVXf9KkBdsw,0,0,0,1
Aalbsk2pFczUedpRWKUyPw,2010-02-27,Yd4_UbDlKAmUcN0Xg6ltiA,5,"We live in Chandler, so we get take out here probably once a month. My husband is from the east coast and in both his and my opinion, these are the best cheesesteaks around! We love their spicy peppers (they are hot!) and while I am not really a cheesesteak fan, their chicken cheesesteak sandwiches are fabulous! The owners are hard working and really appreciate all of their customers and let you know it! 

We have been eating here for three years now and have never had a bad experience.",review,ccJswjoJ8f9dn9qz0Zfhpw,0,0,0,1
6Kon3cR5ZEm5rmYKlpcfcw,2011-01-29,Or_CAWhC84zaPnxKOtoJpA,4,"I recently stayed at the Valley Ho for a conference being held on-site. My experience was really nice, everything from the food to the retro style room to the poolside atmosphere.  Cafe ZuZu has an assorted lunch selection and Trader Vic was only a short on-site walk where I enjoyed their happy hour. The front desk, catering and valet staff were helpful and provided outstanding service to all the guests.  When scheduling future company events I will definitely keep the Valley Ho in mind.",review,LOZgMx3mJPzmCVtlJ1KpfA,0,1,0,1
cN6aBxe2mQvrQlzk26LyRQ,2010-09-19,gPyYg-tiraAywQLxPxwksw,2,"Oh Man. This is not the place I imagined I would assign my first 2-star rating. I woke up as sad and disappointed as I felt last night, leaving the legendary, old school Durant's after an evening of less than mediocre food and terrible service. Sigh.

Honey had a great lunch there a few months back and was excited to impress me with dinner. We saw Durant's listed on Restaurant week and were excited for the excuse to squeeze into one of their comfy booths amidst the bow-tie clad staff and velvet wallpaper. The instant time travel type setting usually makes for an incredible dining experience. Shall I fault the poor rating to their efforts at succumbing to a prix-fixe menu? Perhaps.

Our time at the bar proved to be the best part of the night. Watching the bartender mix the martini's the way my Pops used to was nostalgia at its best. I LOVED that they serve bottles of beer with a toothpick of meat and cheese. That is brilliant. It could transform me into a beer drinker after all. We met up with friends and continued on to the dinner portion of the evening.

Moving on to the booth, our waitress was definitely in the weeds. Having been in her shoes before, I always try and accommodate the situation. We ordered an appetizer and a few cocktails and waited to order dinner when she seemed able. Appetizer of artichoke dip was yummy. Tortillas and garlic bread and warm, cheesy dip delivered promise.

The limited menu was just that. Okay first course salad/soup options. Main course offered Pot roast, a small steak or chicken fried steak. Stewed steak, grilled steak or fried steak. Really? Your menu is impressive...if you really don't want to participate in Restaurant week, then don't. 

Honey ordered the chicken fried steak as a continuation of the old school vibe. I ordered the trout off the regular menu after C pointed out the fish option. J ordered the cfs too. 

Food took a bit, but we had good conversation flowing, so it wasn't a problem. Salads and soup were fine. Main course arrived and we were all a bit surprised by the size of the fried steak. I guess when you think of this meal from the past, it encompasses half the plate and is oozing with country gravy. This steak was the size of a burger and had a dollop of thick gravy-esque goo on the top. Garlic mashers were appropriately placed. 

My trout was supposed to be topped with a lemon caper sauce but instead it was slathered with a gravy that hinted at lemon and was all wrong for a fish. The trout was pain-fried and should there have been a light sauce, it would have been good. But the fried fish with the gravy was just so not good. 

The fried steak too, so not good. Mashers achieved an appropriate level of goodness, but you really don't want mashed potatoes to lead your dinner. 

We were devastated. 
The whole experience was so not what we came for or expected. I do want to give Durant's another chance and order a big, juicy steak and let them wow me like they do to so many, but it will be a while before our trek downtown includes a walk through their kitchen.",review,IQTk7FS2EF657T8wJqr-sw,1,3,0,1
rkbe2bfskoPY-K_mcYjSYw,2012-02-02,Q6F0ZXSoDq_a6aMwENq6MA,5,"Lots of cool, cute and educational things here for my two kiddies. I stop in here for each birthday/Christmas to balance out the ""junk"" toys. I love the art project portfolio that is divided by school year and the school memory books. :)",review,GPPHDWEZGjiw777_iTOJ1w,0,0,0,1
di2QHs2SrY0XFHcfAq_k2A,2011-11-11,jGo2ovJlMlDRfPvaCOgpaQ,4,"Excellent everything! The customer service was struggling a bit but well, they just opened so hopefully that'll improve. 

The cookies are great. The grilled cheese was so so. Took awhile to get to us but it was slammed (but also, I was on a time limit).

The manager came over and offered us free dessert for our not 100% experience. She also shared with us what soups were vegetarian and were not.

I'm excited to go back. It's a great option for Downtown Phoenix!",review,T5mD6ggC7fh48QgXR0LevA,1,2,1,1
MXFcSmW3m-9IXQEA_7l62g,2011-07-19,ySD_gy1A19xVj7fYH_gC1A,2,"One word sums this place up. GHETTO! The other reviews were right on the money. I'm not gonna lie, I was scarred! So I suggest buying your tickets ahead of time to get the best rate. I also highly suggest paying the extra 5 bucks to get priority seating and sit up front. And watch your seat- if you leave it empty, you will get jacked.
Be forewarned- people stink! Apparently other passengers don't believe in showers or deodorant. A can of Lysol may help.
I'm giving 2 stars instead of 1 because the bus did arrive to destination on time both times I used the bus, and the second driver was very cool and funny.",review,lmiDCrmas8TxRsbIGZX9Pg,3,2,2,1
LzNJLEIo4gh-X_rmDkNkNg,2011-07-09,c4wiS00iZNXpt2rvrKAXIg,4,"Happened upon Four Peaks when we drove up to the restaurant we wanted to go to and there wasn't a car in the parking lot! My hubs and I thought it was just the temps in Scottsdale, and everyone headed out of town for the weekend. However, when we walked into Four Peaks, it blew our assumption out of the water. The place was packed and the only seat left was in the bar, which was OK since we were only there for appetizers and beer. 

We ended up ordering 1 entree as an appetizer, the fish and chips. The were quite good! Nicely cooked, not overly greasy and very crunchy.  Hubs got a dark and I got a light. We were very pleased with the beer and will be looking for a 6-pack in the stores.

I'm looking forward to heading back to Scottsdale to hang out here a bit longer and try some of their great looking menu!",review,MYLBku4sRCoZmi4Z7yESGw,0,1,0,1
VVeogjZya58oiTxK7qUjAQ,2012-06-07,QlYfacd_phP3JbaPpRWbMA,5,"Wow! Food was great! But the service was even better!!! We got there early so we didn't have to wait a long time.  

Their computer system was down, so instead of asking for cash or taking our card numbers, they comped out lunch. So impressed with this place! And such a cool vibe!",review,utAvq1-tCgfM4alrdPmtzQ,3,3,0,1
8qrICL2tS2Rq7b5gxUdQwQ,2009-09-20,0wekFc0vMC9EfbRucSmnSA,5,"Just when I'm about to give up on my search for good Thai around Glendale, I stumble upon a true diamond in the rough. Don't be fooled by the shabby looks of the outside plaza; the inside is contrarily well orchestrated with subtle Thai ornaments and design. A huge desk in the lobby and bigger one inside the dining hall gives this establishment an odd but distinct hotel feel. Much like that feeling, the service is intriguingly exceptional from the time you walk into the front door. 

The food that I've tried here so far is... may I say it... divine. I started off with the squid salad with mint and lemongrass and it was packed with fish sauce and shrimp paste. Score. I also tried some papaya salad and once again, it was mounded in fish sauce and chili. Splendid. Then I had the minced beef phad kaprow (which is not on the menu) and lo and behold, I was tasting Phuket in a Bangkok sort of way. To be honest... the sauces from each of these entrees mingle quite well. You can drizzle some of each dripping over rice and literally have an orgy in your mouth of Mormonic proportions. You can also bolster it with some more heat with their chili fish sauce, again drizzled all over your concoction. Let your adventurous mind roam free and order something outside the pad thai genre. It will pay off handsomely.",review,PiIdsdEd8JrRaMv5aDzSZA,1,2,1,1
