business_id,date,review_id,stars,text,type,user_id,cool,useful,funny,bucket
yZbPvIa_7nt7ekxi31SkUA,2011-12-27,9o4OOxC7-4N0nHXtfP172g,3,"We stayed for three nights while visiting family for the holidays.
Good:
Very comfortable bed
Clean
Funky/cool decor which is unique
Very friendly and helpful staff
Fair price
Great location

Not so good:
Pricey overnight parking that was a surprise upon check in
No coffee maker in room; this is pretty well standard for most hotels. We had to either go to the lobby for $4.50 per cup or drive off site. 
On our final morning before leaving (2 1/2 hours before checkout) with our do not disturb sign duly mounted on the outside of our door, we were disturbed by a rap-rap-rap-rap of who I assume was the cleaner. WTF!",review,kCtnWnf0jYUSlMq6RBB-yw,1,2,1,0
aMsEP51zdkdJpG7so9zmzQ,2010-07-25,9nI4DlZNttD8jnrEb7pUYA,5,"WOW!!! practically half price on everything compared to the chain stores.  Staff is always very friendly and helpful, and i've literally saved hundreds of dollars since I discovered this store just under a year ago!",review,LnMMOFdCcHiYQOpagFINnQ,0,1,0,0
d3MxUXS1b6U2P_gGuCO1-A,2011-09-19,ifufAIjgZR2Q1FizJnUZJw,3,"Wowza!  This place is a total trip!  No, I don't smoke, but if I did this place is probably the place I would go to.  

First off, the food was okay.  I ordered some chicken wings, which wasn't really that great.  My favorite was the Thai Curry -- it definitely had some pop to it.  It's one of those that creep up on you.  Milk please!  My friend ordered some Sake that I thought was real good and smooth -- don't ask me what it was, the lighting was low and I didn't care much by the time I arrived.

Service was pretty good I guess, and then again the place was drop dead for a Friday night.  What's up with that!?  I'm sure the place gets hopping on 1st Friday, but that's only one day out of the month -- I sure it picks up quick!

Ambience, was cool, just reminded me of the 70's in a way even though I didn't grow up during the 70's haha, but I thought the design and decor were pretty cool.  Eccentric I think was the word I used.  Bathroom was blue and that's all I'll say.......check it out! - Enjoy!",review,XqMkm-DD9VsdcKx2YVGhSA,0,1,0,0
C_eWAEOvkHZ_IZYGwjtpmg,2012-07-19,PH2brIyiSG3XdXgInaYudA,4,"What a great place. We (family of three) went on a Sunday afternoon. What a fun place, great food, friendly staff. The manager was there, she let my son sit on the michanical bull. fun. fun. fun",review,nLXfL00a9nSjB7T_OqKscw,0,0,0,0
qkbloHdDZuHf_0wTqUGPjQ,2011-07-04,mrpHZFnKHAqmVCo_f8VcPw,2,"We visited Frank & Albert's on a Sunday afternoon for lunch.  Hardly anyone was there, as it was about 2:30 PM.  We had eaten lunch there a couple of years ago on the patio, and I had a great time then.  However, the temp was 114 on this particular afternoon, so the patio wasn't an option.  We were the only people in there other than the dude who talked on his phone the ENTIRE time we were there.  He even managed to order and eat his entire lunch while yapping.  

I ordered fish tacos, as I had the last time we were there.  Something has changed.  A previous reviewer mentioned this, and he was on the money.  I received two constructed tacos . . .soft tortilla shells in the shaper with cabbage etc.  only no fish!  Two large-ish filets of fish were on the side!  It was really messy . . .I had to tear apart the filets with my fork, smash some fish into the full-of-cabbage tortillas, and complete my own taco :(  I gave up on the second one and ate the veggie taco and the fish separately.  I really didn't like the seasoning on the fish, either.  I thought it was too harsh and blackened.  Ultimately, the fish tacos were ""meh"" to say the most.  I will not order them again.  My bf ordered a sandwich and since he must follow a special diet, he cannot eat mayo.  He reads ingredients very closely and requests things he can't have be left off.  His sandwich came slathered in mayo, even though it wasn't mentioned on the menu as an ingredient.  When we looked around for our server, he was nowhere to be found.  So, while I munched on messy tacos, bf sat looking sad for the next 5-7 minutes until we finally saw the server and flagged him down.

That being said, the server was AWESOME about making the new sandwich sans mayo, and we even received an extra order of sweet potato fries with sea salt.  They were yummy!  And when you see their house ""chipotle ketchup,"" DO try it!  I looked for it in the Biltmore gift shop, but they didn't have any for sale.  Oh well.  

I am not swearing Frank & Albert's off forever, but since I am only in Phoenix a few times a year, it will be a while before I go again.",review,nDP1Ry-y5x-lZeOwULY88w,0,0,0,0
-SxeUGqnKy8YiEV5YA42Jw,2011-01-07,NP6DYMuE28YM9Qgq85lxgA,5,"Love this gym. Not many know it's here..lunch time is the best to get in. I've been a member since Feb of 2009. 

While the trainers are nice, it's a revolving door. You are better off at this gym if you know what you're doing vs. needing 1-to-1 attention. Since LA Fitness just purchased PURE, this will only increase I imagine. Pretty disappointed that they no longer do monthly 're-programs'... But the gym itself is worth the monthly fee. 

If you're looking for a place to be left alone to workout - this is it.",review,JPJDHHyWkOdqvH04LVXWDg,0,0,0,0
mVha7w96h_eSun6EAomuhw,2012-01-02,C_HYu079qvxL7uQvu4d2Rg,2,"I went here to try a  new salon and they were very rude when i first walked in like, I was wasting there time, I just wanted to know about there tanning prices and they kept trying to up sell me on there other products even though i kept telling them no thank you, finally when i got a tanning bed they asked how long i wanted to go for, i said the full  time and the lady tells me i should do less time because I'm a red head, I told her that i have been tanning for years now that I'm fine with the full time, she still gave me a hard time saying i should do less, finally i was like whatever and did less time. The only reason I give them two stars is because there beds are really nice and i got good color from them, but it was not worth the hassle for me to want to go back.",review,gIhEoQQLLUHbKbn2_TS1hg,0,2,1,0
3tk6Syyz5i967Ifuz_4o3w,2010-08-09,AWrrQRIwzIV4t3VAe9VWTg,4,"Had the Korean Beef over white rice. What a great dish. 

Thin sliced beef in a garlic brown sauce with onions and great taste, served with a side of white rice. NOTHING over the top nothing trying to be something it is not. Just good food.",review,C6IOtaaYdLIT5fWd7ZYIuA,3,4,3,0
3O-01lUwrdNCSrqDoJ7CvA,2012-06-30,Au23Mw185CQdjVorbkId1g,5,"Decided to call CityWide based on positive online reviews. We suspected a slab leak and a really expensive repair. Robert showed up within 20 minutes, determined the source of the leak within 5 minutes, and it turned out to be something really simple and inexpensive. He repaired it with a brand new line, we paid, and he left within a half hour of us calling CityWide. Very professional, friendly, and efficient! Would definitely recommend CityWide for anyone's plumbing needs.",review,Jx8VRjgsc3ikBKcP9wLlAQ,0,0,0,0
xKV873WMxM0EJ7NTtu4Qhg,2009-12-28,MH1r59i6GuJR0jDeedsPaA,5,"I picked up some brownies as holiday treats this year and they did not disappoint! 

These are the richest, chocolatiest, moistest, biggest (3"" square) brownies you will find! 

I'm tellin' ya! TOTALLY worth the drive to Gilbert - except they're taking their own holiday break right now, so you'll have to wait until after Jan. 4, 2010 to get your fix! Still, worth the drive and worth the wait!!",review,vsXP832M0kOxKpfduD7dWw,14,14,9,0
g4Eit1EeeEGhTVik6AWYsA,2009-05-07,LsRpL2j4BnVLGt0PXzusyw,1,"After landing in PHX but before embarking on a 2.5 hour drive to Flagstaff, i thought Wendy's would be a safe and easy place to grab some food on the go...well, I was wrong.

* Chicken Nuggets: dry, freezer-burned meat with extra hard double-fried shell.

* French Fries: super hot, crunchy, over-fried french-fry-shaped fry-shells. so hard and crunchy that i thought i was eating french-fry chips.

* Junior Bacon Cheese Burger: bacon and burger meat both tasted dehydrated.

Guess what, last thing I want after a 4hr flight and landing in 100+ weather is hot, dry, crunchy, tasteless food!",review,2W8kTEcYhkSL2yYSyHxOcw,1,1,1,0
VbXy3tH5RAu7HjT7VeMMgA,2010-08-25,iGP6QWXXBflfRxZ4q_m6jw,2,"Not good.
Very bland Thai food, ugh, the two words do not belong together, bland and Thai!
The Peanut sauce was the worst ever.
The Pad Thai and Tom Ka Gai soup were blech.
Fresh rolls large but no flavor.
The service was decent though.
Just disappointing.",review,SwFbQrbTboesoC9hUb4vOw,0,1,0,0
Snp5LyDO9NeQiuFPOlkavw,2012-04-04,4cJjMRcRBDVMyWhNq0jA7A,1,"I keep wanting to like this place.  I want to support a local business, and yet....

Last year I took my two boys there after a theater performance (Greasepaint!   Excellent!), and after we placed our orders for lunch, I took out our SET game (it's a card game that does not use a traditional deck - great fun).  WIthin moments, the server was back at our table.  ""You can't do that.""  ""What?  Play cards?  It's not gambling."" (Maybe I was wrong, but living here, you start to assume that an objection to something must be religion based).  ""The owners don't allow it.""  ""They don't allow it?  It's a matching game.""  ""No.  You'll have to put it away.""

Now.  I would understand not wanting us to sit and play cards if we'd finished eating and were just holding a table (assuming it was busy).   However, this was during the gap between ordering and eating.  I KNOW I should've just left then.  Instead, I made my kids happy and we stayed for lunch (and ice cream!).  

A couple months ago I (foolishly) decided to try again.  Didn't bother with the cards this time.  The lousy thing this time was the mold on my son's bread.  They DID remove the sandwich from the bill, but eish.    

I'd kind of like the ""Restaurant Impossible"" guy to come in here and give it an overhaul.  I don't mind the nostalgia stuff, but the place does need a solid going over.",review,vhGwvm7sCXThBqJ2YQS13A,0,3,1,0
Zx8_4zKdDBSO3qGrkukBIA,2011-10-26,I8_vccF7YuKneFaNTixwwg,4,We visited last week.  The lady offered us a lot of samples of their food so we could pick out what we liked.  The food was excellent and the service was great.  The restaurant was very kid friendly.,review,AE0K8fveXdUu89GnCSI16Q,0,1,0,0
NWtC07BxIqQp76kugbvynA,2010-09-10,JStJgy5ksdO9ladkEvT2RA,4,"Perfect greasy food for the night after a bender, or a family breakfast. I'm cool bringing my 10-month old here because it's noisy and with so many other kids around she pretty much goes unnoticed, except by the nice waitresses.",review,cE1-8mK1g8xZld5Y8u01tw,0,0,0,0
qsWxbgQwuomXvMseg23DGg,2010-11-17,6Nr3rKGooh3ltZ-cdf0d0Q,3,The Phoenix Hooters is directly opposite the Sheraton Downtown hotel where I was staying. Was really hungry and didn't want to eat at the hotel so decided to give hooters a try. Hooters girls are always a nice touch. I really liked this location since there was a lot of outside seating. The food is what you expect from Hooters. I had the pulled pork sandwich with fries. It was good but then I was very hungry. Food quality was good and arrived quickly. Can't ask for anything more!! Hooters girl was also cute!! I would come back with a crowed of guy for a drink and burger. Prices are very reasonable.,review,El-nrOv6QtsmsOnkXQDknQ,0,0,0,0
lVHtVCyFJOqAH0ltn7pLuw,2008-03-22,FvH04ALRAlAT9i1gpu9xTQ,4,"I started going to Sushi Eye since it opened. I quickly befriended Paul and Richard Cho who are the owners of the establishment. A more genuine and convivial Father-Son team of restaurateurs have never opened an establishment in Arizona.

Koreans (by ethnic group)  are by far the largest sushi bar operators in the USA and very successful at creating American pleasing establishments. The Cho clan left Northern California to come to the Valley for sun, golf and open sushi bars. They succeeded at all three. Loud House music, Sports Center on ESPN and lots of Shochu,  can accompany your fresh escolar sashimi and ASU roll. If your sushi'd out try the Nippon-Hawaiian fave, Chicken Katsu. A warm, ""Irasshaimase"" awaits all who enter this charming dollhouse sushi bar. 

By the way, I drank so much Shochu at Sushi Eye that I took a little nap on the gravel out in front of the establishment until Richard Cho came and rescued me from passing out in the gravel. A sushi chef and a finer wingman never existed in Chandler",review,mEMZxvHpemSxn1gl7Lj1Zw,0,1,0,0
NYBx4sdSVrN-I5Q8RfLMPg,2011-10-25,-dyBFg-hZGzkT5w4FH1S2Q,3,"I was way excited to try this restaurant since it's so close to my house.  I just assumed it was one of those places that looked like a dive outside, but served up a piece of heaven inside.  Once I read the Yelp reviews, I was convinced I had made a sound real estate investment!

Maybe my expectations/hopes were too high, but I thought it was just ok.   I liked the chips and salsa, and the service was friendly without being in your face.  We ordered a round of margaritas which tasted good, but were really weak in terms of the amount of tequila.  My father had the garlic shrimp and octopus which was really delicious--if I go back this is what I'd order--and I had the fish cuilichi was ok, just kinda heavy and not really something that got me excited.  The girly girl in me says, ""not worth the calories!""

I think I'll give it another try some time in the future--perhaps it was an off night.",review,2nXVVKX3K4Httr7-IU1Rew,0,0,0,0
jPhmaY35qGP2qNc68viXPg,2012-08-18,fHLAVvhnFKk1c9HHaA1xPA,5,"One word to describe this hotel: quality. The pools were all warm and unique. The hotel has two hot tubs, one that changes colors at night and is next to a man made stream, the other is on its own ""island"". There are two pools, a lazy river, and a small pool. The rooms were comfortable and the whole facility was clean. One thing that must be commented on is the staff was not only efficient but they were very friendly and nice. All of the food and room service I ordered was filled with superb flavor and had good presentation. The hotel also has a botanical garden, herb garden, multiple lawns, and it contains different food services. I highly recommend the ranchero pulled pork tacos and the sushi. The Marriott burger, creme  brûlée, drinks, and fromage board was very good.",review,oY0QNmFG77hNaNwpPTLShA,0,0,0,0
8H1DwdAAgSBtwDeb2R-hmA,2012-06-11,u-p4Mua7xs1WCTYDRJ6hvA,5,Amazing bagels and a great staff. I always get the build your bagel sandwich it's heaven!,review,3q8FzgSsKSzjzQxC212Mug,0,1,0,0
h1kwVr1eTpBK0rWfcm5QSg,2012-02-11,Y5FYhKI8lbzZzMlCR52x0w,1,"2nd time messing up our carry out order. Boneless wings have bones and no carrots or celery again!!  Hamburger with only tomato, cheese, and BBQ sauce had onions and lettuce, when we specifically said no lettuce or onion. Allergic to onions and don't like shredded lettuce. Thanks to Tiler for messing up our order again. Will not be back.",review,B3uJfHeRainL3piiAFjKtw,0,1,1,0
OEWW22gUG_JADQ3h4ajXtg,2012-12-20,IlMOhzkvFknEhuFwhgdPqg,5,"So, after finding out I didn't have to be a juror today, I decided to go to Treehouse to celebrate!  I got 12 different cupcakes (intending to share with my husband and friends at work of course!) and wasn't disappointed. I love the caramel chocolate and peanut butter chocolate ones best! The only ingredient I hope Treehouse considers adding is avocado, since it makes vegan cupcakes decadently rich!  One of the sister's who co-owns and is a co-baker was a doll. We both are hoping Phoenix continues to build up a variety of veggie- conscientious, healthy/delicious places to frequent.",review,CtdGwLKodWXumk3ToyPckw,0,0,0,0
4K7nR-e9staGTNJk1ez7MA,2012-07-23,c5dKCGUV0T002S03t3cWtQ,5,"I am disabled with MS. The heat of summer about does me in, esp. in the car. Because of this, and because the best thing I've ever done for myself was to buy an electric Hamilton-Beach water kettle, I drink TEA. All day. Loads of it. Teavana is MUCHO EXPENSIVE, though I adore it. I learned of the Tea District through somebody's ad and like them very much as well. But, I had no idea we had a genuine tea company in Phoenix. And because of HomeRun, I was allowed to buy THREE vouchers. And because DragonFly is so awesome, they let me use all three to buy tea online and have it shipped to me all at once to avoid huge s&h fees. It should be here any day, and I can't wait to try their Cab(ernet) against Teavana's Opus Rouge. I love red heavily tart, fruity teas. It doesn't matter to me if there is no white, green, or black tea in it. In fact, I prefer it to just be the fruit. I drink it hot, and then as it cools all day in my tea pot, I keep refilling and either warm each huge travel mug with lid in the microwave, or drink it room temp, or even add some ice if it is particularly strong. I can EASILY drop $150 at Teavana, or $120 at Tea District and just touch on what I most want. With your three vouchers worth $60, I got to try two bags of every flavor I most wanted, except Peach (as they are out of it, but Holly wrote me several times and made recommendations based on what I had in my cart).
 
I know I will love it, and go back to order the Peach when it is in stock again. Thank you so much for finding a local treasure and making it accessible.
 
Sincerely,
 
Judith Ann Hillard
President of Addiction Overcome, Inc., a non-profit foundation
Author of The Other Woman at the Well
www.addictionovercome.com",review,_MLUOGwK-1jgwub4Wzwk_A,0,0,0,0
AXixlciaDB5jo2NMZmSKoA,2010-09-30,_7DBu1UqUmMIRiGrX5S7XA,4,"I recently visited the Arizona Science Center, & today came to check this one out, joined by Mike C.  Ok, it's not the same thing, but I'd say this one rules!  There's plenty to see here, It's fun for both adults & kids.  A couple of the excellent features are an old MINE to go through, & lots of DINOSAURS!!    :-))

The walkways kind of wind all over the place, so try to keep track of where you've been, & not miss anything.  They've put a lot of work into this museum, & you're going to like it!

Open Tue thru Fri 10-5, Sat 11-5, Sun 1-5, Closed Monday.

Adults:  $10
Kids 3-12:  $6
Students 13+ with ID:  $8
Seniors 65+:  $9",review,ikm0UCahtK34LbLCEw4YTw,4,5,1,0
UYM3KZLe02XGmUx27AZl-Q,2009-07-12,iwMIeeKW0b94FQ0H02QCUw,5,"I first visited this restaurant after my friend pushed me to visit the Hawaiian festival at the Tempe Town Lake a few months ago.

""Big deal,"" I thought. ""How can a Hawaiian festival be fun?""

Well, the food was amazing. And after having half a rotisserie chicken, I was craving for more.

A few days later, I finally began my search for the perfect (or near perfect) Hawaiian restaurant, in which I can satisfy my Hawaiian cravings.

My first stop was Mai Island Grill, located in/near the Arizona State University campus. Parking was a bit of a challenge; this is especially true during the lunch hour.

When I finally found a parking spot, I went in and ordered. I had the short ribs plate. The plates include one scoop of macaroni salad and steamed rice.

After placing my order for the short ribs, I ordered the Spam musubi.

The guy preparing food replied with a laugh.

""Is it good?"" I asked

Jay -- the man who operates this restaurant -- replied, ""Yes it's good."" 

Then he said something about how the guy who laughs never laughs (or something like that).

About 10 minutes later, my food was ready.

The food was fantastic; just what I was looking for!

The prices are very reasonable. Plates are about $10 and less.

I also suggest that you try the fish, beef, grilled chicken, and pork katsu.

And finally, I hope that this place continues to provide the same liberal portions. Also, I think it would be cool if Mai Island Grill began serving two scoops of macaroni salad and two scoops of rice (just a fantasy of mine).

Additional Notes:

- Cash Only.

- Opens late in the morning and closes early in the afternoon (call for exact hours).

- There never seems to be any ""Lumpia!"" :-/",review,E-Bd5r6Z3zMGA75_D4IRKw,4,4,4,0
7_7fxuG9ESAFmx-AiMsJHg,2010-10-25,hToXrZeYpH9xUvflGywJaA,3,"I don't know what Bar Smith is trying to be. I feel like instead of just saying okay we are going to be a X music club on Saturday night they decided to try and appease too many people. 90s R&B and Hip hop on the first floor Techno Electronica on the roof top bar. 

oooooKAY.

I visited the during the 4th Annual Pub crawl at 11:30 at night the place was still pretty empty. 

Drinks-Meh
Crowd-Meh, I am still trying to find the young professional males in this area.
Layout- I like it
Bouncers-Really big and Super nice but then again I smiled a lot and didn't give them a hard time about my ID. 

The last 2 is what gives it the A-Okay and not a full out Meh. I could see throwing a party there, people love dancing outside and on rooftops. This has both and the first floor DJ was decent, all things considered. 

I will give this place another chance. 

Maybe it can redeem itself up to 4 stars.",review,2y3LWFfyRp02EdjwcVv7sw,0,1,0,0
wDZiLz0A7CIXoBqSjFRMeQ,2011-07-24,o2aDt89mpURcy10qt3EZQQ,1,"This location was a Groupon find... Won't be back. The girl behind the counter was nice but even though I had the groupon right in front of me, she had to read it several times and I had to explain to her what I was supposed to be getting with it. The red light therapy is a nice idea... But the room the bed was in was lacking. They should hire an exterminator, not leave sticky bug traps down with dead bugs all over the floor where people generally have bare feet... Yuck!!",review,8fTTvS499XCz4oP49kxq8A,0,0,1,0
uEJQSIjWui-TDWXaGlcqyQ,2009-10-27,Rb9IR9AGn6LQLFT4PyeLng,4,"I've been to both locations, and I wonder if is fair to rate them together or should I do it separate? 
The Phoenix location is way to small for me, I don't like feeling like I'm almost sitting on my fellow diners lap and, this is a huge pet peeve of mine, I HATE smelling like food! Which is inevitable because the place is tiny. On the other hand it does have charm to it and the food is delicious.

The Scottsdale location I can move, don't smell like food when I get out but is more sterile. And then there's the food....

I always ordered fried chicken (of course!) and the breast tends to be dry so I decided to do thigh and drumstick. Well, this last time  the dark meat was fried to a burn:(  And not only the skin but the meat too. I should have asked for two different pieces but I was starving, and my hunger won. A shame because I left without satisfying my craving for good fried chicken. The waffle was delicious as always and I ordered smothered potatoes which were very good. It seems with their mac & cheese  people either love it or don't. I'm on the 'don't' group. It tastes milky and not very cheesy to me. I may try it again, because I love mac & cheese and I have the hope that maybe it was just bad luck before?

Service is ok, sometimes better than others.

After careful consideration, I'll give it 4 stars. I'll visit again, I'm pretty sure, and then I may go up or down one star.",review,h9d3VW5RTJymoFoLnN60_w,1,1,2,0
oyzxIqrtzu-8sWlPhJVsLw,2012-06-25,S_dxK8th_fjMYRuNc5l39w,5,"The best !

From my first shredded beef taco almost a year ago  ..i have been lovin' this place.
I also love the number 13 combo platter (.Mini beef chimi's ,Gauc ,rice and beans) 

The tacos are 5 star fresh and yum ! ... AND reasonably priced.",review,vtC_cpesIJZ3--W9J-UIXA,2,2,2,0
UIGFrEcoDsw05I1UOrxdOA,2010-09-23,Lcs_S1llDzNMZvjfA2vSpQ,1,"Read al lthe hype, so decided to give Cyclo a try.  What a disappointment!  Portions were small and overpriced, owner thinks she's the next best thing to sliced bread.  She needs to go back to Vietnam to remember how real Vietnamese food is prepared.

Give this place a miss.",review,KwQs1O_M5Y83LYrmES7KIQ,2,5,1,0
VlEzJ8gehlSMDtAtj0yNHA,2011-07-10,882WrHXhCvAACeYLXKa9_Q,1,"I am totally baffled why this place gets such good reviews. I have been there a few times because it's close to my work and I received some gift certificates for my birthday. Unfortunately after the last experience, I can't go back.  Although they are very nice and have great prices, I have to reveal the ugly truth: 
1. They don't put any effort into sanitizing the tools or the pedicure bowl. I actually saw them clean the brushes and tools in the water I was soaking my feet in and then just rinse out the bowl after they were done... not spray, soap, nothing!
2. Reason #1 probably explains why my heals cracked so severely after my pedicure that they began to bleed.  I had to use peroxide, neosprin, and bandages for almost a week to get it heal. 
3. They water down their nail polish... so much that it destroys the bond and polish never actually dries. 
I hate to bash a business with good customer service, but these practices are simply unacceptable.  I obviously won't be back. =(",review,Zwtx7FLZcK5F2P0-Tz8mHg,1,1,0,0
tpN254LPQTzGODnqI6RpSA,2012-08-17,4vzPJZfp3pJVekRFtM4NpA,5,"I love this place they do the best job, I even drive 45 min because I moved and they are worth it! I'm always happy with the results. My nails don't lift or chip. I have also had a facial their and it was amazing. It was my first facial however I was happy and it wasn't expensive. I would recommend this place to anyone. Just bring cash for your tip, they do take cards but not for tips.",review,tsjb0CJI4mes4C4CcSdxDw,0,0,0,0
zjBoVPJi27Ntm5neRuHGvg,2012-11-16,bs7Oh8j8XPC8p4ypEzLZvw,5,We have had nothing but good luck at this franchise so far. We've been here probably a dozen times. It's always clean and the food is fresh and the way it ought to be. Yum!,review,6TnX7mzI-jfgK6teWqIS9Q,0,0,0,0
