business_id,date,review_id,stars,text,type,user_id,cool,useful,funny,bucket
06kfoeRs9Acj82Yl3i9p_w,2011-07-27,D0O1Dqr2clFdfpUbUzykew,3,"I feel bad giving them a mediocre rating but I'm reviewing what's in their NAME. I drove about 9 miles across Gilbert (that is quite a chore) because I wanted to serve good roast beef sandwiches for dinner and I needed good bread. 

I had Boar's Head roast beef, tomatoes, horseradish sauce, avocado, roasted red peppers etc I just needed great bread. Where else in Gilbert should I go? I did a Yelp search and it agreed - to this place. 

I arrived around 4:15 and the pickings were slim. I got the last round of sourdough and a small nine grain. I asked her to slice thick, she walked to the slicer and said it has one setting. Okay I'll slice myself. 

Because I love Cupcakes I also took a chocolate cupcake and my boys got a chewy brownie each. The total was about $16. 

We got home the bread was hard (both) soft on the deep inside so I had to grill the sandwiches with butter not my plan but it's butter, butter fixes everything. 

The cupcake frosting was good I ate the top threw away the 'cup' not worth the calories. I only allowed the boys to eat half the brownie each and save the other half for tomorrow as they were huge. The said they were really good. 

Basically, I'll buy my bread at the grocery store or at Paradise bakery as the wasted gas and time in the car was not worth it.",review,t2YBANsJYySOXvHyOjcZkQ,0,0,0,16
qjmCVYkwP-HDa35jwYucbQ,2009-11-04,McgTbfkTEai9y3vmfBpBXw,3,"My wife wanted to go here a few weeks back for her birthday so we went on a Saturday afternoon.  Parking was easy to find and there was no wait to get a table.  Wish it had been a touch cooler, but it wasn't so we decided to eat indoors.  

Had a little snafu with our servers where someone who was not our waiter took our drink orders, but it was straightened out pretty quickly.  We each ordered one of the signature drinks, the wife got cucumber lemonade (I think) and I got a green arnold palmer.  I liked the g.a.p.  For the meal, don't remember what the wife had, I got the chicken sausage pizza.  It was fine, nothing out of the ordinary.  

Basically, that's how the whole meal was, okay, but didn't blow me away (not that I'm a huge healthy/organic foodie kind of guy though).  I guess I'd go here again, but I probably wouldn't suggest it.  (I did think the music was a little loud...)",review,XpejQYZqVcYGX7fYuYHzSw,0,0,0,16
oRJgXbcawYd3kULBucqdnA,2011-01-17,6443pQKHzT6MsItVYa7o8w,4,"This was my first half marathon.  I enjoyed the music the buzz of tens of thousands of people all about to do a crazy long run.  It was amazing seeing the sunrise over the city.  I found the parking, shuttles at Tempe and food-court to be very easy to use.  It seemed well planned for such a large event, just not enough bathrooms for the amount of people.

The PA for the full marathon kept going in and out so it introduced the 2 star athletes but you couldn't hear their reason for being there or accomplishments. 

Bathrooms on the course were way too few and huge lines.  I felt bad for those who needed them.  I saw less than 10 at the first 2 stops for 12000 people.  If you gotta go #2 on the course, too bad,...  Take Imodium on race day I guess.

Bands and support were fantastic, but this was my 1st time so can't compare.... GU gel is always on me, great to see them out there. The course is NOT flat having a 'heartbreak hill' in it at mile aprox. 9.  UPS gear check bag split apart at a feather's touch the day before the race.  Good thing, i was going to use it.  The top of the seam isn't sealed so any slight pressure/tear will open the entire side. 

Ha


ABOUT THE AUTHOR-INTERESTING BACKGROUND

My first endeavor was a rolerblade marathon in tucson in 2004.  I guess it's out of style now so no more skates.  Used to do the New TImes 10k in phoenix every year too.  GONE, sad.

Last year I did the Tour de Phoenix 72 mile bike race on a 33lb. full suspension (no lockouts) mountain bike with slime in both tires and all my supplies on my bike and camelback... thought i was tough, 'till I tried running!  Injuries were now a new thing now and it is much tougher per hour than biking, but about the same calorie burn... Still love both. I did a sprint triathlon recently too.

We all know running is 'hard' you don't get extra calorie burn from impact stress but something about running and especially in this event captured my interest.  On the way to the zoo last year i saw the half marathon pass by and said ""I think i could do that NOW"" boy was i wrong... it took me almost a year to train for this event, but what a worthwhile challenge.  

I did this as a run walk 3 min run 1 min walk.  I learned from the Galloway training method that this method is not only easier but faster than trying to run straight through.  .I am capable of the constant run for this time but it winds up being slower than when i take walk breaks. I tested this with a 10k distance. I was 7 minutes faster with a run walk than running straight through.  look it up, may change your life too.  I took 50 1 minute walk breaks and i did my time goal of aprox. 2:30 with 1 bathroom break.",review,t5qFxYP2t6ltRbvhqJsZAQ,0,1,0,16
PmPOuRvuN3CoNOi1nBj_TQ,2011-02-28,TbY0qDzbkqU5gP_UTjIKDw,3,"Ok, they should be happy that I am understanding of the flying bug that landed in my dessert and died before it was served.  Yes, I found it as I was eating the dessert, grossed me out, but not necessarily their fault.  The manager came over and apologized and took the dessert off the bill and offered me another one.  Anyway, the rest of the meal was great.  My party and I had the scallops with green beans and capers.  Yummy!  I do like Pappadeaux's overall and this is the first time I didn't have a great experience.",review,uTyIIbOvXH_XZw7OEiTiNg,0,1,0,16
hyff2JyqQgf85MaJZslHCg,2012-02-23,r1NrDLqFDKmaxVy70VoeMA,1,"This place was horrible! I will never go back it was over priced and the best thing I ate was the corn bread you get  before the meal.  I had the chorizo stuffed tenderlion it was like chewing on a piece of rubber stuffed with soy. My girl freind had  flavorless tacos with stale corn tortillas. three  words it sucked, sucked, sucked!",review,pvdXGtu6sAPDJiCIhfVBDQ,0,1,1,16
eIxSLxzIlfExI6vgAbn2JA,2010-01-11,rsp19tEZR_B3kzxicsijkQ,4,"I am always on the prowl for a good burger so when I heard there was a new burger place in Tempe I knew I had to try it out.

The boyfriend and I went to Lobby's on a Friday night. It was not busy but the location doesn't really lend itself to busy. So we were able to walk right in and order. It's an order at the counter and grab a seat kinda place. We both ordered cheeseburgers and got an order of fries to share. I liked that the burgers were not pre-made frozen patties. They threw down two hunks of beef on the grill.

The burgers were tasty, a nice size - not too big, not too small - and the fixin's were fresh. So was the bun. 
The fries were crinkle cut but they were crispy and good.

The atmosphere was fine, good for a quick sit-down and the staff was friendly.

I hope they can survive in this location because they are worth a repeat visit for sure.",review,Pv7DGHzZ-uqIUdOsqPpsVg,2,5,0,16
LmVcYycG_VI3S6RNgqiriw,2011-09-11,AWzeDIiFidF-UumZjCH2fA,4,This spicy chicken soup is a must have when sick. Always makes me feel better when my hubby brings it home for me.,review,ITBs8txD0Zu-YuxXCGqokA,0,1,0,16
A0hxl-YmCYYn0j-X614fQw,2008-12-02,TjvdQBxP_uZR5Gd8b02jow,4,"I know that Wal-Mart gets a bad rap at times, but I need to report how nice they were to me the other day.  I went in there to buy some Christmas presents and found everything I needed and went to pay for everything.  I apparently did not take everything off the kyosk of bags and left one package there.  When I got home and these items were not in the back of my vehicle, I went back down there.  They told me to just go and get two more pair of the item I was missing.  I really felt they were so nice in doing that.  Thank you Wal-Mart.",review,fW1RBWhhVrZ5t-TURpIvlA,2,1,0,16
ZoQAOnEFnyHjSpomtfqesA,2009-03-08,7BQy8bQPmPYCzYs1p5wvig,3,"Its refreshing to find one-of-a-kind places -- God knows Phoenix needs more of them to inject personality into this generic, strip-mall, chains-on-every-corner valley. Finding this unique sandwich shop, which is in a house that has been transformed into a restaurant, is indeed a welcome find. The real estate is limited, so parking is compact and circles around the back of the building.

The dining area is mainly indoors, but there is also a small patio facing the back portion of the parking lot, which is not very scenic. Inside there is art on the wall that can be purchased.

They serve wraps, bowls and salads. The food has been pretty good, although it did not knock my socks off. I ordered the Baja Bowl, which is described on their online menu as ""Southwestern chicken atop garlic rice, black beans, Monterey jack cheese and topped with lime sour cream and pico de gallo."" It was OK, but the chicken was dry and cut in fairly large chunks. It could have possibly been microwaved -- not sure, but there were no southwest flavors to speak of. I have done a better job of cooking chicken on my George Foreman grill at home. Perhaps the garlic rice would have helped with the flavor, but I had substituted the rice with organic brown rice which did little to add flavor. Sour cream was not ""lime"". There was a small slice of lime served on the edge of the bowl. I would not bother ordering this again -- especially if I have a craving for some southwest food.

On another recent visit I ordered a wrap called ""Prince of Thai's - Spicy peanut chicken with baby spinach, garlic rice, fresh ginger slaw, cucumber pico and red onion wrapped in a spinach tortilla."" That had better flavor than the baja bowl. Vegetable ingredients were fresh and good. Again, I was not very impressed with the chicken chunks.

One thing I think That's A Wrap needs to address is the use of styrafoam cups. Afterall their slogan is ""Healthy Food for a Hungry Planet"" and they have a link for a new restaurant ""Green"" for Vegan food on their website. For such an artsy, earthy place, I would have thought That's A Wrap would have made more conscious, earth-friendly choices. For that reason and the bland chicken, I give them an average rating only.",review,0BBO-d1_Dr16Tc55x--ejA,0,0,0,16
UvK70rJjOGLx44Q4qsWz7Q,2008-09-23,yXbBXm7ovAGj2crEWP7WWQ,5,"We went to check out PNP for their 2 Year Anniversary show and were extremely impressed!  Space 55 is the most charming space that I never would've known existed had it not been for this show being promoted on Yelp!  The actors were amazing and we really were in awe the entire time we watched this 30 minute film being created right in front of us!  I'd heard of Comedy Improv, but Movie Improv?  I had no clue... 

Special shout outs to Mark J and Jenn H (our very own Phoenix yelpers) who did an incredible job on Saturday night.  Congrats again, PNP, on your 2 year anniversary!  I look forward to attending future performances for sure!",review,fczQCSmaWF78toLEmb0Zsw,6,6,4,16
K2_Hmmo5crTYWiT_1sWnfQ,2012-09-04,7OTX6no_YKFuZLxDatF0Fg,5,"I have to give them a 5 for their Guacamole and chips.
I am just in love with it.

Everytime I go to the US, I have to go there.
Cheap, super tasty and I love the salad bowl option they have (as I cannot eat wheat flour).
The meat is always tasty and fresh and again .....their guacamole ....the best !!!!

Always clean and fresh with friendly staff.

Healthy fast food .....

Just wish that we had it in Canada !!",review,oRRHrcRPcEAnOepF3KPfsg,1,2,0,16
_-9pMxBWtG_x8l4rHWBasg,2011-06-21,z3eqTSmgMSoghwCb2FJZ0Q,3,"Fine. Just fine. C+/B- average-- all around.    

The decor was rustic and lodge-like, yet still open and modern.  No complaints here-- aesthetically pleasing and lacking the bright colors and loud mariachi music of more traditional Mexican restaurants.  The table we were sat at seemed to have been haphazardly wiped-- not totally clean. Our server was okay as well-- friendly enough, but seemed generally disinterested in her job and us and was not very knowledgable about the food she was serving. 

The food was fine.  The salsa served with the chips was totally fine-- fresh enough but not very flavorful-- a theme we would soon learn would repeat itself throughout our dining experience.  We started with the avocado egg rolls with cilantro honey dipping sauce.  These were the highlight of the meal-- the sweet sauce complimented the creamy avocado taste nicely.  My only qualm here was the $10.50 price tag for 2 standard sized egg rolls.  Seems a wee bit steep for what it was, but still very tasty.  I ordered the vegetarian tacos and they were good-- not wow, but good.  I appreciated the variety of vegetables and the fact that they had veggie tacos in the first place (many more standard Mexican restaurants do not).  I do wish they'd had more spices. The side of rice was pretty good, but not as flavorful as I'd like.  The veggie tacos are also served with some sort of pickled cabbage onion slaw (because the borracho beans that accompany the other dishes are cooked with bacon).  The slaw was also fine.  In general the food was acceptable, but a bit bland.  I should also mention that the portions are quite reasonable-- two smallish veggie tacos and a bit of rice and slaw.  Sometimes the portions as more traditional Mexican restaurants are absurdly gargantuan-- it was nice to see a normal sized and relatively healthy-seeming Mexican(ish) meal.

Full disclosure here-- our visit to Black Chile was prompted by a card we'd received in the mail good for $20 off any meal.  So we figured it was worth a shot-- and it was, but maybe not a return visit.  Our bill (pre-discount) for the appetizer, 2 entrees, and two sodas came to $40.  If it wasn't at the Biltmore, I'd say it was a little steep, but considering its location, it's probably right on.  I'd go back if the food had wowed me, especially since it's in my neighborhood, but it didn't, so a repeat visit isn't likely.  There are enough solidly 4 and 5 star places in the vicinity that 3 stars doesn't generally make me a repeat customer.",review,4d4xIM4lBG8BDZrG9pAuiQ,2,4,0,16
bpPVn4nF8YR40BjhO6YP1w,2012-04-04,pWn9Fof6PFZWIAdxEFNudA,1,"Long wait for food, waitresses that don't know what they're doing, grumpy hosts, and crappy food that keeps us off the lake for 2 hours is not somewhere I plan on going ever again.",review,pqnYZy25nEwGAAjShOpJGg,0,0,0,16
bZivzFTkkjNtUBSuMhoCtg,2012-01-06,XBViOsfJmEryDr7h3waZEw,3,Food is just 'eh... Just one more sushi place of many,review,oBwb6ViGFerK2ATjGEOywA,0,0,0,16
WUZxVr_CaRqEQgzvyeK5tw,2011-02-07,ZyQUKm5pvlrP-5F4qv95zA,3,"I remember a time when Ikea was an almost legendary place where the angels would sing a greeting to me as I passed through the hallowed doors. 

That was a long time ago. 

When I was younger (and significantly poorer) Ikea was the one true way I could get semi-stylish home furnishings at a reasonable price. Many a room was filled with fine pre-fab furniture that was always just a wee bit small. 

It's funny how ones' tastes change. This weekend I ventured forth to Ikea in search of baby stuff. A good friend of mine is with child and wanted to check out what Ikea had to offer. 

Walking through the store I saw the same stuff I saw ten years ago, and while I could still see the appeal, I realized that it just wasn't as cool as I remembered. Ah well, at least I still have the memories (and the coffee table, end tables, TV stand and lamps). 

Ikea is still great if you have something specifically in mind. My friend found a bunch of excellent decorations for the soon-to-be-born babies room, all for insanely low prices. I bought a few pillows. Yes, this is what my life has become. 

Ikea didn't change, I did.",review,ND95DgvN7ba8MabfXE3lsw,1,2,1,16
i41M_To0DAxuzZIGvU1wyg,2012-04-28,1KPmbK4uSTLgVYyYCsrP2Q,3,"Live entertainment, friendly, restroom clean, my dish was good, but my hubbies dish the meat was not seasoned at all and for a fajita they gave him a burrito flour size tortilla and took about 15 mins to bring a second one.  Plus hrs are posted wrong on yelp. States open from 6 am to 2 pm even though they serve breakfast, lunch and dinner.",review,11WMiRoB2sQxo61aJdSg6Q,0,1,0,16
NN2qs5B713vM6BDcMyrg4A,2011-10-31,z3DtJDeJTAolrI2t9ixsWw,4,Very good food with huge portions.,review,WsBMlEq2pPHE0fdgDHnW2A,0,0,0,16
RiJ8Agrw__NG6flFL7BpbA,2012-12-14,1w8mCNXZRHbaHW_1I2aJOQ,4,"There's no better way to find out about a new eatery than to receive a gift card to one you've never been to (or heard of, for that matter). This happened to me when I received a gift card to Paradise Bakery. Being new to Phoenix, of course I Yelp'd it to find one nearby. I located this on on the SWC of Bell Rd and 7th Street while up at Sam's Club. 

Paradise Bakery has sandwiches, salads, soups, sides, and of course -- the bakery items! At this location, you can eat in or take out. I like the Turkey Bacon Bravo or the Turkey Cranberry with a side of their excellent mac 'n' cheese and a drink. Getting this combo also scores you a free cookie! 

This location is in the shopping area with a huge Target and many other stores, so the parking is hit or miss, depending on the time of day/week. And PB's prices are just a bit steep for what they serve...good food, but still a bit pricey.",review,aTi0NVrcPJWbN6jAsJVcAw,1,3,0,16
BJBzsvaCQ2mo8CWfQ1jPiA,2012-07-03,q94gMPm3YrwvA9hSIJgJhQ,1,"I'm sorry. You're too busy to look up my club card information? Too busy too push the button to do the search, enter my phone number and click ok?

I took the time once upon whenever to sign up for your card. And now, you can't take 5 seconds to look it up for me? Let me clue you in, the cashiers here have always looked it up. It always takes 5-10 seconds at most! Great customer service. Insert sarcasm here for the uneducated.

Other Big Lots this hasn't been a problem. Just the one.",review,aIUefJBhBQ_UZEzryL6b8A,0,1,1,16
IoFggnoj1P4EcmNEP2K6Ng,2011-12-30,3RQF9CbMHUquwgr1YqAiRQ,2,"I have been coming to xtreme bean for several years and it is still a generally good place.  the coffee is average or below, the tea selection is good, the atmosphere is ok but same old. The current staff is incredibly immature and act like children yelling, and even barking, at high decibels.  I've never seen anything like  it anywhere.  I'll have to think twice about coming back if this continues.",review,W5Pd_GmMem2LdHZkoxQCtw,0,0,0,16
pAHUC05ceak48e745i6G4g,2012-10-09,0g2uOcC07ilW6n_gX63KQA,5,"Stopped in for the first time at PV Burger Company tonight.  It was quiet, only one table when I got there around 6:20pm.  Ordered a bacon havarti burger with fries and a coke; it came out to just over 9 bucks.  

The burger came with lettuce, tomato, cucumber (???), pickled red onions, and thousand island.  It was DELICIOUS.  Beautifully toasted bun, great char on the meat.  The pickled onions were a nice touch.  The fries were skinny and crispy and had seasoned salt, which brings me back to being a kid and getting fries at the food court in the mall (good memories).  I got a refill on my coke before I left, so I don't know what another reviewer was talking about when they said there are no refills on sodas.  I asked and it was no problem.

My only gripe is that after I had ordered and sat down to wait for my food, a couple of guys came in and the guy at the counter immediately handed them paper menus (with actual descriptions of the menu items I'm sure, unlike the chalkboard on the wall), which I would have liked.  I probably would have gotten an add-on for my burger if he had given me a paper menu when I was at the counter.  Oh well, now I know for next time, because there will definitely be a next time in the near future :)",review,gdNJzMx9duSZCBdiU1QKFg,0,1,0,16
Fl9lKEaY10EnXxekPcHPPg,2011-06-04,4BXF12MufxE4v_qSvS6eOA,4,"Great bagels & bialeys!  Service was great, food was fresh, bagels & bialeys were like NY! I'll be a regular here! Also check for specials on Tues & Fridays",review,JPesnSIxBrhknSJDr0em6A,0,0,0,16
3YATaNAGANoFneE-4KK-JQ,2012-07-16,wZvQUscERCqAPC05KzX6KA,3,"I do not see why people are so quick to judge an IHOP so harshly.

It's an IHOP for Pete's sake. The service is ok for being a chain breakfast place. But it is nice that this location is 24hours because my friends and I need a place to eat whether it be after bar hopping hours or not.

The food is consistantly not too bad (again for a chain) and I've gone back several times. Besides, it is great for people watching at certain hours of the day/night! :)",review,mRAPMBM3dbw8KXNit1aDCw,0,0,0,16
yPpPJyAF8pciHnhTF-C38w,2008-07-03,z_OPi59Bb5QOgfuFw492tw,4,"I went thier on a new wave night. I dont drink so its hard to find somewhere gay that I can enjoy sober. They had bitchin 80's music and had a good guy/girl ratio. Some were straight but I like that, its nice when breeders what to hang out just for the fact that they wnat to hang out and dont care if your gay/straight.

They also have a pool table wich is a rare find in gay clubs in az.

I liked it :)",review,ZZ43etAB2n_T53YBYtf8Dw,3,3,2,16
On_3zLdujQdvDbBYUirNWw,2008-08-13,naxpAVMjrO65Fr5huy9f1g,4,"repeat after me:
creamy polenta covered with young brocolli stems and seared sea scallops!!!!!!!!!
yum.
repeat after me:
buratta with charred bread, heirloom tomatoes and drizzed with olive oil!!!!!!!!!
yum.
repeat after me:
asparagus, radiccio and hearts of palm salad with truffle oil!!!!!!!!!
omg yum.
repeat after me:
chicken stuffed with marscapone cheese, fig and other stuff that's really yummy!
yum.
repeat after me:
spicy spagetti with fruite de mare - clams and mussells!!!!!!!
yum.
repeat after me:
ravioli stuffed with goat cheese and other yummy stuff!!!!!
yum.
cute and attentive waitier:  yum :)

i stayed at the firesky and had dinner at taggio for two nights in a row - not by design but necessity and i'm here to report that even though i didn't choose this restaurant for both meals, i'd come back again in a heartbeat.",review,Eo0o6m0gKBMgmooN_ZeFGw,1,2,2,16
9XX-sxaDFXlXO65WnuS65Q,2010-03-03,2SyBuAtRjEF8DMTzFvsK0Q,5,"I live in the townhomes right next to this restaurant and it still took me 4-5 months to actually try it. Absolute blasphemy as I see it now. This is a charming little place, decor outdated enough that it's sweet again, friendly servers, and man, great food. The pesto cream sauce ravioli (I believe) will blow you away. The wine glasses are filled high. Everything is great quality. Prices are medium-range, most dishes ranging from $11-18 but coming with a salad or soup and bread. This would be a great, great date night spot.",review,7MJJ4dacV5wzslKT3izK8Q,0,0,0,16
n-Q7d10K0h6PyNewmiHLyg,2011-04-04,N3Ut6LtL3lIOfTZDNzR-AA,4,"Phoenix Muni is a great stadium to see Oakland A's Spring Training Games. Yes, it's older than many of the other Arizona stadiums, but it has a simple charm that serves it wall. Great seats can be found just about anywhere in the park, and for $22 we were in row 7, just to the right of home plate. It's also pretty easy getting in and out of both the stadium and the parking lot.

The only (minor) negative is probably common to most stadiums: there don't seem to be enough vendors (at least beer vendors; several people around us mentioned it), and the concession stands can get somewhat backed up at times. But for a relaxing place to watch baseball in the Arizona sun, it's hard to beat Phoenix Municipal Stadium.",review,gVgbIRT9mJkeWSAzBA9i6g,0,2,0,16
4jDDSE2q8X97FjJutOcAqw,2011-08-03,0R7bd8_NwPPPWNRociExpA,5,"*CASH AND CHECKS ONLY*
*OPEN 9 AM, 7 DAYS A WEEK*

Love this place. Took my daughter here a year ago to get her very FIRST haircut. We had Miss Tara, who provided us with a ""first haircut"" certificate and she also had these tiny quarter-size ziploc bags for my daughter's very first strand of hair that she cut. The haircut was $15. Along with the haircut, Miss Tara styled it and put clips and glitter in her hair. My daughter LOVED it. 

The place itself was kid-friendly. There's a little kitchen for the kids to play with while waiting for their haircut. There are 3 big kid chairs for older kids to get their haircut. And there are 2 car-styled chairs for the younger kids. 

I took my daughter for her SECOND haircut today. We had Miss Annette. She was great. Again, my daughter got her hair styled after her haircut and got glitter and flowers put into her hair. The haircut was $15. We also got a punchcard, where you're 9th haircut will be free. 

This place does walk-ins, but it is better to call and schedule an appointment since they don't have a specific opening/closing time. They take CASH ONLY so keep that in mind.",review,u-M4jMYKXsj-l1BYdyNpRQ,1,1,0,16
bts6jVczHJuWzpT8Y26UsQ,2009-05-07,CUp2wLgXsP0o2PsErmF3Tg,2,"No, I don't want to take the bus to get to the train. 

In my opinion, they didn't go far enough for people who live in Phoenix. It may be a good solution for Tempe and Mesa residents commuting to Phoenix, but it isn't effective for Phoenicians who want to get from the north valley into CenPho.",review,AnH84g9V10x41CXmCvcaFg,7,10,6,16
Pj22z5yPSozm_8G1OuzDwg,2009-01-29,j7M2xtDaocrxyBTA0Z9VAQ,4,"I wandered into this store while wandering down Mill on a Saturday afternoon and what a pleasant surprise it was. Their design fit perfectly with my tastes and I wish I had the extra cash to redesign my house with their products. 

The salespeople were friendly and helpful, but not pushy. Great experience!",review,w1LjSa5wMexRIQ-82LKWmQ,2,2,0,16
